Job ID,Title,Company,Date,Link,Description Length,Description
3558848659,Data Analyst,Calero,2023-04-11,https://www.linkedin.com/jobs/view/data-analyst-at-calero-3558848659?refId=j%2BcCc3yUei3%2FRFZr3cZY1g%3D%3D&trackingId=%2FM%2Bdlk1PDpcJWO0sfyHruw%3D%3D&position=25&pageNum=7&trk=public_jobs_jserp-result_search-card,2487,"Specific Responsibilities

Ensure proper, timely and accurate invoice processing for assigned group of customers
Execute customer requirements for GL Coding and Cost Allocations
Create and submit AP files to the customer(s) for payment in line with SLA/KPIs
Interact with customer(s) and carrier(s) relating to invoice processing to resolve any items which prevent completion
Identify if past due balances are the result of missing or misapplied payment
Resolve past due balance with customer(s), including confirmation of payment from the customer, bank clearance, vendor received and accurate application to account
Adhere to all required month-end processes and cut-off periods
Work with the carrier(s) to resolve identified billing disputes, manage and resolve disconnection notices
Validate that all batched invoices have completed payment information (Reverse AP Feed)
Where applicable, ensure batch released and completion of funding has been successful
Where applicable, ensure that payment(s) successfully made to carrier(s) in line with Customer SLA
Where applicable, escalate open items to Service Operations Manager to resolve with appropriate Calero-MDSL finance resource
Manage and action all invoice alerts trigger within the platform and where appropriate create 'task' | 'dispute'
Submit and track system-based alerts disputes on behalf of the customer(s)
Link inventory information or tasks created from billing and/or provisioning details to support full and complete inventory
Management of MACD customer files
Work closely with Service Operations Manager to ensure alignment against customer objectives and needs
Where required, raise helpdesk tickets to solve platform issues and follow to completion
Perform all other duties as assigned including maintaining compliance with all company policies and procedures

Education & Experience

Bachelors’ degree in accounting, math or analytical related field
2-3 Years’ Experience in accounting, finance or data entry type roles preferred

Knowledge/Skills

Moderate level of problem-solving ability.
Gathers and interprets data to solve routine problems that require verification.
Some independent judgment required.

Calero is an equal opportunity employer. All qualified applicants will receive consideration for employment without regard to race, religion, color, national origin, sex, sexual orientation, gender identity, age, protected veteran status, or status as a qualified individual with disability.
Show more "
3580126724,Data Analyst,On Time Talent Solutions,2023-04-07,https://www.linkedin.com/jobs/view/data-analyst-at-on-time-talent-solutions-3580126724?refId=w8zthlH4V574bcGiWm5yCw%3D%3D&trackingId=ZOTIiC5JAhK2h8B8nWKskQ%3D%3D&position=1&pageNum=8&trk=public_jobs_jserp-result_search-card,2205,"TrinityRail is searching for a Data Analyst to work in our Dallas, Texas office!




The successful candidate will help engineer data solutions and provide visualizations to derive insights. The analyst should have experience in data mining and transformation, developing data pipelines, and creating visualizations. Presentation skills are required to explain data architecture, expose insights in the data, and lead conversations with the leadership team.




Join our team today and be a part of Delivering Goods for the Good of All!




What Youll Need




Work with stakeholders and subject matter experts to derive and understand business outcomes
Possess competencies with SQL and data transformation tools to understand and prepare data
Familiarity with Modern Data Warehouse architecture using cloud based storage solutions and data orchestration (e.g. Blob storage, Azure Databricks, Azure Data Factory, etc.)
Familiarity with data visualization tools such as Qliksense and techniques in translating business analytics needs into data visualization and semantic data access requirements
Work with data engineers to facilitate technical design of complex data sourcing, transformation and aggregation logic, ensuring business analytics requirements are met
Assist in generating hypothesis that drives strategic questions about the leasing business




Qualifications




What youll need:




Bachelors Degree in Mathematics, Economics, Computer Science, Information Management, Statistics, Finance or Accounting, Masters preferred
5 years of relevant experience
Intermediate skills in Data Architecting, Visualization, SQL, Microsoft Excel, PowerPoint
Technical fluency regarding data models, database design/Development, data mining and other segmentation techniques
Experience using cloud based data orchestration tools
Must possess effective communication skills, both verbal and written
Strong organizational, time management and multi-tasking skills
Experience with data conversion, interface and report development
Adept at queries, report writing and presenting findings
Process improvement and automation a plus
Work with management to prioritize business and information needs
Show more "
3580132322,Data Analyst,On Time Talent Solutions,2023-04-07,https://www.linkedin.com/jobs/view/data-analyst-at-on-time-talent-solutions-3580132322?refId=w8zthlH4V574bcGiWm5yCw%3D%3D&trackingId=RG3O66UlXjNm6k52CUMBFw%3D%3D&position=2&pageNum=8&trk=public_jobs_jserp-result_search-card,1708,"Greetings everyone,




We hope you are staying safe. We are hiring a Data Analyst to join our Digital Engineering team.




Who are we?




For the past 20 years, we have powered many Digital Experiences for the Fortune 500. Since 1999, we have grown from a few people to more than 4000 team members across the globe that are engaged in various Digital Modernization. For a brief 1 minute video about us, you can check




Whom are we looking for?




Role: Data Analyst




Experience: 10+ Years




Type of Employment: W2 Full-time only (No C2C)




Work Authorization: US Citizen, PR, GC EAD, Any valid work visa.




Location: Initial Remote - Dallas TX/ New York / New Jersey/ Chicago IL/ Boston MA/ Raleigh NC/ Atlanta GA




The Expertise Were Looking For




Should be proficient in data analysis, data modeling, PL/SQL, and No-SQL database technologies
Outstanding SQL skills and experience performing deep data analysis on multiple database platforms.
Solid documentation and technical writing skills for requirements and design specifications
Ability to translate and explain complex business logic to a team of developers
Ability to translate technical details in business terms to users
Good understanding of the Compliance business domain




The Skills You Bring




Outstanding written and oral communication skills
Strong relationship-building and influence skills
Excellent skills in communication, analysis, and problem-solving
Desire to remain continually aware of the changing technical landscape and its impact on the risk data environment




Referrals are much appreciated.




Thanks & regards,




Thamilarashan P R




HR Executive




+1 (214) ###-####




@photon.com
Show more "
3574863492,Data Analyst,Ampcus Inc,2023-04-18,https://www.linkedin.com/jobs/view/data-analyst-at-ampcus-inc-3574863492?refId=w8zthlH4V574bcGiWm5yCw%3D%3D&trackingId=bPvz7k0B8ZhVkf3rZ0MufA%3D%3D&position=3&pageNum=8&trk=public_jobs_jserp-result_search-card,4009,"Must Have

Bachelor's Degree

Complex Data Extension Creation

Data Analysis

Data Reporting

Salesforce Marketing Cloud

SQL automation

Nice To Have

Advanced degree

Experience: 5 - 7 Years

Job Description

Profile: The team seeks a strong Data Analyst with Salesforce Marketing Cloud experience that has experience pulling and manipulating data for campaigns (email/text). This role is not specific to a project, but augmenting the team to support a variety of projects in motion

Position Summary

The Data Analyst II will be a member of a cross-functional digital campaign team, tasked with accurately provisioning for the purpose of outbound digital communications including email and SMS campaigns. Qualified candidates will plan, analyze, develop, test, deliver and complete quality assurance of data they provision to support these external communications.

Essential Functions / Responsibilities

Fulfill data requests from internal customers using a sound understanding of Client data, data policies and governance.

Create complex data extensions and automation activities using SQL.

Partner with Digital Production staff to customize data output as required for use in personalization, dynamic content, and reporting.

Provide customer support on an as needed basis by investigating and addressing escalated incidents with data quality.

Understand Salesforce Marketing Cloud (SFMC) data models, data extensions, and the core system data structure to successfully deliver segmented and tailored messaging to meet business needs.

Facilitate and participate in detailed data analysis necessary to measure, identify and track the quality of data in an ongoing manner.

Complete quality assurance of SQL code and data output to ensure business requirements and specs have been met.

Principal Relationships

Internal Contacts

Maintain regular contact with Communications and Marketing, Information Technology DATA, Client Programs, and Operations.

External Contacts

Participate in phone and email exchanges with a third-party systems integrator and Salesforce as needed.

Education/Experience

Minimum Qualifications

Bachelor's degree required. Additional post graduate degree, MS, or MBS preferred.

Experience with standard business and project management processes.

4-6 years' experience in managing and executing data management initiatives, including data management, warehousing, provisioning, and business intelligence.

Advanced knowledge of SQL, PL/SQL, and expertise in SQL standards and best practices.

Experience in project management.

Practical knowledge of DBMS, ETL tools, reporting and analysis tools, and data mining tools.

Experience in multiple areas of data standards, data management, data warehousing and business intelligence is essential.

Demonstrated ability to complete projects on time and on budget.

Experience With Education Related Data Is Preferred.

Related Skills & Other Requirements:

Demonstrated competency in strategic thinking with strong abilities in relationship management.

Experience in business process analysis, design, and documentation.

Demonstrable experience in Salesforce Marketing Cloud or the ability and willingness to quickly learn Salesforce best practices and development.

Experience with AWS and/or similar cloud technology is a plus.

Execution and delivery focused mind set.

Excellent communication, presentation, and interpersonal skills.

Ability to conceptualize and articulate ideas clearly and concisely.

Strong analytical and data analysis experience with structured problem-solving ability.

Self-motivated and team oriented.

Ability to effectively handle multiple situations simultaneously.

Desire to learn, explore and be challenged.

Ampcus is an Equal Opportunity Employer. All qualified applicants will receive consideration for employment without regard to race, color, religion, sex, sexual orientation, gender identify, national origin, age, protected veterans or individuals with disabilities.
Show more "
3568686882,Data Analyst (Hybrid),U.S. News & World Report,2023-04-13,https://www.linkedin.com/jobs/view/data-analyst-hybrid-at-u-s-news-world-report-3568686882?refId=w8zthlH4V574bcGiWm5yCw%3D%3D&trackingId=plxF2sudlnvvcElbBUAZEw%3D%3D&position=4&pageNum=8&trk=public_jobs_jserp-result_search-card,4388,"U.S. News & World Report is a multifaceted digital media company dedicated to helping citizens, consumers, business leaders and policy officials make important decisions in their lives. We publish independent reporting, rankings, data journalism and advice that has earned the trust of our readers and users for nearly 90 years. Our platforms on usnews.com include Education, Health, Money, Travel, Cars, News and 360 Reviews.

We reach more than 40 million people monthly during moments when they are most in need of expert advice and motivated to act on that advice directly on our platforms. Our signature franchises include our “Best” series of consumer guides on colleges, graduate schools, hospitals, diets, cars, financial services and more. These guides provide an easy-to-digest list for consumers to better understand and compare when making their decisions. We continue to publish annual guides of the authoritative Best Colleges and Best Hospitals rankings on our website and in print. And our U.S. News Live flagship conferences highlight important national conversations including Healthcare of Tomorrow and Healthiest Communities.

We believe in having a broad range of talent and backgrounds at U.S. News. We strive to maintain a welcoming workplace where everyone is given an opportunity to succeed and contribute to their fullest. Learn more about our Diversity, Equity and Inclusion initiative.

Your role in helping us shape the future:

U.S. News empowers everyone to thrive. In this position you will have the opportunity to leverage your strengths and skills toward producing the company’s graduate school, college and K-12 rankings. One week you may update code to the ranking algorithms; another week you may be performing quality assurance on statistical data collected. You will be working on a small team and very quickly will be involved in the facets of the rankings -- from research and analysis through reporting data and testing the website.

Are you up to the challenge?

Possess a keen eye for detail and sharp critical thinking skills for conducting quality assurance of datasets.
Are proficient ingesting, merging and transforming messy, disparate files.
You have an evaluative, analytical mindset which you can employ to solve coding and methodology challenges.
Feel comfortable explaining technical information to non-technical audiences.


You should definitely have:

At least three years of experience in coding with statistical software packages, preferably STATA
Ability to code using STATA.
Ability to query databases such as by using SQL statements.
Demonstrated ability to conduct quality assurance of non-pristine datasets.


It would be nice if you had:

Career or academic experience in the following: survey research, regression analysis, project management.
Experience using control systems to track changes like Git repository.
Experience or interest in K-12 and higher education.


What it’s like to work with us:

Talent is our best asset!

We invest in people with passion and potential who understand U.S. News’ dedication to our consumers.

Entrepreneurial, mission-driven culture with core values of quality and integrity
Focus on fostering personal and professional growth
Competitive benefits including paid vacation time, medical, tuition reimbursement, and training
Collaborative Work Environment : Fun, diverse, inclusive and ambitious co-workers


Other Job Info:

Applicants must submit a Cover Letter and either a CV or Resume to be considered.
These statements are intended to describe the general nature and level of work being performed by employees assigned to this job. This is not intended to be an exhaustive list of all responsibilities, duties, and skills required of employees assigned to this job.
U.S. News & World Report strongly encourages all employees to be fully vaccinated (including boosters).
In New York City, the anticipated base salary for this position is $55,000 to $70,000. The actual base salary offered will depend on a variety of factors, including without limitation, the qualifications of the individual applicant for the position, years of relevant experience, level of education attained, certifications or other professional licenses held, interview performance, and if applicable, the location in which the applicant lives and/or from which they will be performing the job.


Show more "
3576428844,Data Analyst - Recent College Graduates with Strong in Excel (Entry Level),MillenniumSoft Inc,2023-03-29,https://www.linkedin.com/jobs/view/data-analyst-recent-college-graduates-with-strong-in-excel-entry-level-at-millenniumsoft-inc-3576428844?refId=w8zthlH4V574bcGiWm5yCw%3D%3D&trackingId=NH45%2B0JeXRtSu%2F5RuBub5w%3D%3D&position=5&pageNum=8&trk=public_jobs_jserp-result_search-card,2957,"Position : Data Analyst – Recent College Graduates with Strong in Excel (Entry Level)




Location : San Antonio, TX




Duration : 12 Months contract




Total Hours/week : 40.00




1 st Shift




Client: Medical Devices Company




Job Category: Accounting/Finance




Level Of Experience: Entry Level




Employment Type: Contract on W2 (Need US Citizens Or GC Holders Only)




Work hours: 7:30 am to 4:30 Central




3 Must Haves On The Resume




Strong Excel , Data management experience, dashboard creation on power bi or tableau – customer support experience




Education requirements? College graduate or Equivalent experience on data management/excel/power bi




Job Description




Data Metrics/Analytics is responsible for developing, quantifying and evaluating the transformation of internal and external information into business intelligence to support the strategic objectives of the sales organization and drive operational excellence.
Includes data and technology management (data acquisition, mining, analysis, data integrity management, metrics management and reporting.)
Demonstrates advanced knowledge of concepts and principles of business metrics and analytical techniques/tools, including their application in executing effective sales data management and reporting.
Demonstrates working knowledge of at least one software quality discipline.
Implements existing software quality strategies on small projects. Implements existing software quality processes on small projects.
Collects and publishes defined metrics on small projects. Has developed knowledge and skills in own job family; still acquiring / expanding fundamental knowledge and higher-level skills.
Applies knowledge and skills to a variety of standard activities. Works with moderate guidance in own area of knowledge.




50%:




Manage internal schedule reporting, including performance and productivity metrics. Dashboards on Power BI and Tableau




15%:




Manage the data reporting elements of the Health Care Professional account maintenance system.




15%:




Support New hire request for SAP Access and phone set up.
Support the initiatives on reports necessary to track, trend, and analyze all department KPI’s, metrics and measurements.
Ensure adherence to regulatory (SOX, ISO, FDA, cMDR, etc.), business and department guidelines, policies, and procedures.




10%:




Support the Customer Service Representatives and Team Leaders in the setup and troubleshooting of the Call Monitoring System, SAP, Telecom and other systems.




10%:




Support Department Continues improvement initiatives.




Responsibilities




Excel- must know Pivot Tables and Formulas will be involved in Reporting.
Preference knowledge on Power BI and dashboard creation
Depending on performance and attendance this position has the potential for the temp to be converted to full time. .
Attention to detail, organization and multitasking skills is a must.
Show more "
3582519738,Data Analyst,"Full House Resorts, Inc",2023-03-29,https://www.linkedin.com/jobs/view/data-analyst-at-full-house-resorts-inc-3582519738?refId=w8zthlH4V574bcGiWm5yCw%3D%3D&trackingId=lT4IdMDVrvoFF46BG%2Fqsmw%3D%3D&position=6&pageNum=8&trk=public_jobs_jserp-result_search-card,2560,"Job Details




Description




Take your career to the next level and learn the gaming industry while assisting the Director of Business Intelligence & Guest Services in maintaining the integrity of all property system databases. Analyze, interpret, and distribute data by creating reports utilizing Excel and other Business Intelligence tools. This position offers a great opportunity for career growth as we near the completion of a large expansion project that includes a 300+ room new hotel, spa and conference center. visit: https://www.chamonixco.com/ for more information.




Essential Job Duties And Responsibilities




Assists in coordinating the direct marketing efforts, including but not limited to data mining, segmentation, distribution, follow-up, and reporting.




Works with Food & Beverage, Hotel, Marketing, and Casino Operations to analyze and interpret data collected from the property’s CMS, PMS and POS systems.
Understands basic processes and procedures for operating departments to identify areas of improvement based on performance metrics and guest feedback.
Creates, manages and distributes ad hoc reports for various departments.
Identifies and facilitates the correction of “bad data” in any of the property’s databases.
Verifies the accuracy of newly created player’s club card accounts.
Creates and validates pro/post-formas for all casino marketing-related promotions and events.
Builds and validates the creation of casino marketing promotions in SYNKROS to assist the Marketing team.
Enters data into appropriate databases/applications.
Assists in providing excellent customer services to all guests through various activities when necessary. Develops and maintains effective working relationships with all guests and employees.
Complies with established security policies and procedures. Informs supervisor and/or security personnel/supervisor of any concerns.
Within the realm of the responsibility of the job, maintains a clean and safe work environment. Performs duties in compliance with safety procedures, which includes use of safety equipment. Incumbents are responsible for following safety procedures, identifying unsafe practices or conditions and informing their supervisor or the Safety Committee of unsafe conditions, as directed.
Performs all duties in compliance with the Colorado Limited Gaming Act, internal policies and procedures, and Colorado Limited Gaming Regulations.
Performs other related duties, including special projects, as assigned. $55,000 - $77,000 annually based on experience
Show more "
