Job ID,Title,Company,Date,Link,Description Length,Description
3548520222,Data Analyst,VieMed Healthcare,2023-03-29,https://www.linkedin.com/jobs/view/data-analyst-at-viemed-healthcare-3548520222?refId=MIPNuBpEPI0CQ8z7%2FLGq3Q%3D%3D&trackingId=qsKUYqvPKTPKLguhZeEyww%3D%3D&position=13&pageNum=2&trk=public_jobs_jserp-result_search-card,2640,"Position Responsibilities:

Assists in the design, coding, and testing of technical analytical solutions.
Applies knowledge of industry trends and developments to improve service to our clients.
Clearly articulates roles, project goals, and timelines as they relate to project and development plans, as needed.
Adheres to coding standards defined by technical management.
Accurately prepares written business correspondence that is coherent, grammatically correct, effective and professional.
Establishes responsible deadlines and personal work plans.
Listens to others and accepts input from team members.
Responsible for plan performance reporting and trend analyses.
Conducts research and produces actionable insights on healthcare economics issues and trends.
Establishes effective working relationship with other members of the Technology team.
Contributes to team effort by accomplishing related results regularly. Adheres to Scrum Agile practices and consistently delivers results on time.
Works with internal departments to design appropriate business intelligence solutions
Analyzes data from internal and external sources in various formats from spreadsheets to relational databases and creates meaningful visualizations that solve business problems.
Evaluates, researches, and creates reports for departmental operations flows to help increase efficiency and reduce wasted steps and roadblocks.
Designs, creates and deploys data visualization dashboards within departments that display KPIs and team performance.


Requirements:

Bachelor's degree in statistics, mathematics, information systems, computer science, finance, information management, economics or similar quantitative area or the equivalent of four (4) years of work experience in field.
Two (2) years experience in applying quantitative analytics tools, methods and processes.
Preferred previous experience/working knowledge of health insurance industry, processes and data requirements.
Self-starter with the ability to think critically to solve business problems.
Strong analytic, problem solving, and troubleshooting skills.
Ability to communicate technical concepts to a non-technical audience.
Proficient with SQL and data extraction tools.
Experience with data visualization, charts, dashboards and reporting tools.
Exceptional attention to detail.
Experience with Tableau, Microstrategy, Power BI, Sisense and/or other visualization programs.
Ability to support key business initiatives through positive relationships, effective communication and cross-team collaboration.
Strong business orientation and passion for customer service and results.
Show more "
3555955146,Data Analyst,Tailscale,2023-04-04,https://www.linkedin.com/jobs/view/data-analyst-at-tailscale-3555955146?refId=MIPNuBpEPI0CQ8z7%2FLGq3Q%3D%3D&trackingId=2tJWv53kQI%2BtYj9nfT0Gdw%3D%3D&position=14&pageNum=2&trk=public_jobs_jserp-result_search-card,3140,"We are looking for a Data Analyst to partner with our Marketing, Sales, Product and Operations teams, helping Tailscale make data-driven business decisions. In this role, you'll leverage your well-honed analytical skills, first principles problem solving, and business intuition across a variety of high-impact projects. You'll embed directly in marketing initiatives using data to help shape the future of our go-to-market strategy.

Your key responsibilities will include:

Breaking down complex problems to uncover actionable insights
Analyzing marketing data to identify trends, opportunities, and areas for improvement
Communicating and evangelizing data-driven insights to drive go-to-market strategy
Ensure that our data is trustworthy, reliable, and easy to access
Build cross-functional relationships with marketers, designers, engineers, and ops to ensure teams are using data thoughtfully and correctly
Contribute to our team and company data culture through peer collaboration, training, coaching and more


Ideally, you have:

2-3 years of relevant full-time work experience in a quantitative role across analytics, data science, product or consulting.
A first principles approach to solving complicated problems. You enjoy breaking down systems and finding root causes of issues.
Communication as a core strength. You can present actionable data-driven insights to any audience in a grokable format.
A solid analytical foundation. You can use SQL to query large datasets, have experience with A/B testing, and have strong analytical rigor.
A strong business intuition. You contextualize how insights fit into broader business goals and have a strong understanding of business metrics like acquisition, retention, engagement and monetization.
A belief that small empowered teams can do big things.
Insatiable curiosity as a key characteristic. You’re an incredibly fast learner and are able to deeply understand new topics and pick up new skills in a very short time.


It’s nice if you have:

Experience with alternatives to google analytics for marketing insights
Experience in developer tools markets
Experience in a product-led go-to-market motion
A well thought out position on what statistical methods to use in which scenarios
Experience with measuring incrementalit


Please keep reading...

Research shows that candidates from underrepresented backgrounds often don't apply for roles if they don't meet all the criteria — unlike majority candidates meeting significantly fewer requirements.

We strongly encourage you to apply if you’re interested: we’d love to know how you can amplify our team with your unique experience!

About Tailscale

Tailscale builds software that makes it easy to connect and secure devices, no matter where they are. Every day, banks and multi-national companies use Tailscale to protect their corporate networks. Hobbyists and start-ups trust Tailscale to collaborate and share access to tooling. We're building a future for the Internet that's easy, small and safe, like it used to be. Founded in 2019 and fully distributed, we're backed by Accel, HeavyBit, and Uncork Capital.
Show more "
3569778122,Entry Level Data Analyst (Remote),SynergisticIT,2023-04-19,https://www.linkedin.com/jobs/view/entry-level-data-analyst-remote-at-synergisticit-3569778122?refId=MIPNuBpEPI0CQ8z7%2FLGq3Q%3D%3D&trackingId=AMiqiqK1jiavHuE0OYFkPg%3D%3D&position=15&pageNum=2&trk=public_jobs_jserp-result_search-card,2150,"About Us




Synergistic IT is a full-service staffing and placement firm servicing client in America for the past 12+ years. We are dedicated towards fulfilling the IT needs of our clients. From staffing to full implementation of projects we provide the highest quality IT Services. We Intend to deliver exceptional student outcome. We don't just help you secure a tech job but build a solid career in technology.




Job Description




Roles and Responsibilities




Managing master data, including creation, updates, and deletion.
Helping develop reports and analysis.
Supporting initiatives for data integrity and normalisation.
Providing technical expertise in data storage structures, data mining, and data cleansing.
Supporting the data warehouse in identifying and revising reporting requirements.
Desired Candidate Profile




Degree in Business, Finance, Economics, Computer Science, IT or any equivalent degree.
Basic knowledge of MySQL & Python
Should be able to do data visualisation using Tableau or Excel.
Excellent English communication (both oral and written) and reading comprehension skills.
Strong analytical and problem-solving skills, with clear attention to detail.
Ability to prioritise and work under tight deadlines.
Fast learner, able to master new concepts, theories, ideas, and processes with ease.
Willingness to work beyond traditional working hours/days as required by the business.
The person should be open to learning and take new responsibilities.




Education Requirement: -




Bachelors, Masters in Computer Science/ Computer Engineering/ Information Systems/Information Technology/ Electrical Engineering/ Mechanical Engineering.




Benefits




On Job Technical support
E- verified
Filing of H1b and Green card
Full time position




Candidate who are missing the required skills, might be provided an option to enhance their skills, so that they can also apply for the role and can make a career in IT industry.




If you do respond via e-mail, please include a daytime phone number so that we can reach you. In considering candidates, time is of the essence, so please respond ASAP. Thank you
Show more "
3573137885,Data Analyst,"ParkMobile, LLC",2023-04-13,https://www.linkedin.com/jobs/view/data-analyst-at-parkmobile-llc-3573137885?refId=MIPNuBpEPI0CQ8z7%2FLGq3Q%3D%3D&trackingId=YwcHQO1wR4nLYwzqde9yAg%3D%3D&position=16&pageNum=2&trk=public_jobs_jserp-result_search-card,6046,"To Power Smart Mobility for Every Driver and Vehicle, Everywhere

Who You are:

This Data Analyst role will increase our speed to insight around key business questions from our various stakeholders and expand the data team capabilities in many critical areas of Easypark.

This person will work with our existing team of Data Scientists and across Easypark partnering with Operations, Marketing, Sales, Finance, Product and Support functions. You will be responsible for providing data insights, reporting as well as providing accurate and timely data for ad hoc/one-off requests to support and enable data driven decision-making for various stakeholders.

Successful candidates will work cross-functionally with key business partners and will come prepared with new ideas and a unique point of view. You have the ability to execute and can manage multiple projects, fulfill priorities and meet deadlines. You are a data junkie that knows what quality data means and what will help to improve it.

Responsibilities:

Partner with leadership on the best approach for what data is needed and the methodology required to solve complex root cause analysis on business problems to identify insights that inform and drive key business decisions.
Standup reports/dashboards that deliver a high degree of quality, timeliness, and accuracy in reporting as well as clearly showcasing any discovered insights to help drive better decisioning.
Ability to extract data (from a variety of sources like Snowflake, Postgres, Salesforce and Mixpanel) and perform detailed data analysis on internal processes and productivity.
Lead goal setting, tracking and defining reports, and supporting company-wide metrics (Board reviews, QBRs, and OKRs (Objectives and Key Results)) through a regular cadence for daily, weekly, monthly reporting and analytics.
Support financial month end close processes, providing research on out of balances in invoices and settlement reports
Engage in ad-hoc projects, reconciliations as needed.
Enable effective decision making by retrieving and aggregating data from multiple sources and compiling it into a digestible and actionable format.
Work cross-functionally with our Product team to reconcile, identify/define problems to implement processes and standards that inspire trust with data and provide consistent metrics across the organization.
Create presentations that capture key operational metrics, articulate results, and convey actionable business insight for both sales management and executive audiences.
Provide and support ad-hoc reporting services for non-standard issues and analysis.


Qualifications:

3+ years of relevant sales/business/finance operations experience with solid understanding of SaaS business models.
3+ years of Python or other language with demonstrable evidence of data analytic processing
Experience building complex financial and forecast models.
Advanced experience working with various BI tools (Tableau, Looker etc.) **required**
Advanced experience with SQL **required**.
Demonstrated ability to partner with various stakeholders in building intuitive and actionable dashboards and data visualizations that drive business decisions.
Ability to breakdown down fuzzy business questions into actionable and useful data insights
Attention to detail, accuracy, resourcefulness, and ability to follow-through
Ability to thrive in a changing environment and to manage and prioritize multiple initiatives
Intermediate ability in statistical analysis preferred.
Strong technical and critical problem solving skills are preferred to better understand the Parkmobile product.
Experience with DBT is also a bonus.


Talent Attributes - what we look for in all hires at Parkmobile

Self-awareness: you seek to understand your own behaviors, actions, emotions, and traits in an effort to continually improve and develop.
Collaboration: you work together towards a shared goal, not in service of individual needs.
Stage Appropriateness: you have experienced growth and scale and understand the impact it has on individual roles, decision making, prioritization and our vision.
Intrinsic Motivation: you are driven by an internal desire to achieve, succeed and contribute
Intellectual Curiosity & Agility: you have a perpetual need to learn new information, and with exposure to it you’re able to adopt and modify your thoughts, solutions, and outcomes.


We know there’s no such thing as a “perfect"" candidate. We’re all a work in progress and are growing new skills and capabilities all the time. ParkMobile welcomes those who are passionate about learning and evolving. If this looks like a role where you could do work that excites you, we hope you’ll apply.

What You’ll Enjoy About Joining Our Team

We believe in work/life balance. Seriously. Our team members' well-being is just as important to us as their work. We are humans first, employees second. We offer a ton of competitive perks, including:

Unlimited PTO
Medical, dental and vision coverage
401K Matching
Casual Dress
Paid Parental Leave
Flexible Work Hours
Learning and Development Opportunities
Company Social Events - happy hours, outings, and more
Pet Insurance
Company Community Service Events


About ParkMobile

At ParkMobile, we aim to build an inclusive culture where differences are used to inform better creative, strategic, and business decisions. We actively seek diversity of backgrounds, education, beliefs, and ways of thinking. We look to create a culture where everyone can belong because we believe that people do their best work when they can show up every day as their authentic selves. ParkMobile is an equal opportunity employer. We do not discriminate on the basis of race, religion, color, national origin, gender, sexual orientation, age, marital status, veteran status, or disability status.

At the start, we just wanted to make parking easier. Today, we’re the leading provider of parking solutions in the U.S. and it’s our mission to power smart mobility for every driver and vehicle, everywhere.
Show more "
3569227911,Data Analyst,Aya Healthcare,2023-04-18,https://www.linkedin.com/jobs/view/data-analyst-at-aya-healthcare-3569227911?refId=MIPNuBpEPI0CQ8z7%2FLGq3Q%3D%3D&trackingId=jzI46EBrVmU8LA940Ju2Kw%3D%3D&position=17&pageNum=2&trk=public_jobs_jserp-result_search-card,4991,"Join Aya Healthcare, winner of multiple Top Workplace awards!

We're looking for an excited contributor to our new Data Operations team – working closely with DBAs, Data Engineers and other technology teams, this person will help transform information about our apps and technologies into usable information for the business. Working with a variety of tools (Power BI, SSMS, Azure Data Factory, Snaplogic and SSIS), this team works to provide data-driven strategies to department and project heads that have the potential to take technology development to the next level. This role is a part of a small, nimble, team working in a fast-paced environment for a great company where your opinion and experience matters. We have grown seemingly exponentially in the last couple of years and now have a need to dedicate a significant resource to these efforts.

Who We Are:

We're a $5.8 billion, rapidly growing workforce solutions provider in the healthcare industry. We deliver tech-enabled services that help healthcare organizations meet and manage their contingent labor needs. We build and manage tech-enabled marketplaces for national and local healthcare talent and deliver contingent labor management solutions through our proprietary software platform.

At Aya, we're obsessed with creating exceptional experiences for our clients, clinicians and employees. In fact, we put employee satisfaction above all else. Our team members are responsible for incomparable customer experience and we know that happy employees are critical to maintaining happy clients. We foster an entrepreneurial, high-energy, low-bureaucracy culture and value innovative thinking and creative problem solving. We embrace diversity in thought and backgrounds unified by a commitment to high achievement. When you join Aya, you'll be surrounded by teammates who care about you as an individual and leaders who will help you grow both personally and professionally.

Responsibilities:

Technology is constantly changing, so we need quick and innovative individuals to partner with the technology team. Using data from the applications and third-party resources, they will suggest data-driven strategies that will drive technology developments and tuning.
Assist in the ETL processes to load data from independent third parties to help refine decision-making models and predictions.
Be a resource for what other data sources should be added to the data lake and how that information will help the technology team get bigger, faster and better.
Provide data visualizations that will show them how the applications are being used and provide strategies for increasing use and functionality.
Using PowerBI, develop reports, visualizations, and custom extracts for the technology team to monitor the effectiveness of the strategies provided.
Understand database relationships and interconnections among data sources.
Develop work plans, timelines and manage workflows to meet timeframes.
Explore the data and discover patterns, meaningful relationships, anomalies and trends.


Required Qualifications:

Bachelor's degree required.
Master's degree preferred.
Advanced skills in SQL, Python or R required.
Azure Data Factory experience is required
Advanced PowerBI experience, or similar data visualization tool.
Experience managing large projects.
Experience working with relational databases.
Experience with data administration, design, and architecture.
Ability to articulate complex concepts, thought leadership and the business value of solutions in a clear and understandable way.


What We Offer:

Free premium medical, dental, life and vision insurance 
Generous 401(k) match 
Aya also offers other benefits to those that are eligible and where required by applicable law, including reimbursements and discretionary bonuses 
Aya provides paid sick leave in accordance with all applicable state, federal, and local laws. Aya's general sick leave policy is that employees accrue one hour of paid sick leave for every 30 hours worked. However, to the extent any provisions of the statement above conflict with any applicable paid sick leave laws, the applicable paid sick leave laws are controlling 
Celebrations! We hit our goals and reward ourselves.  
Company-sponsored virtual events, happy hours and team-building activities are always on the horizon — plus, you get a special treat on your birthday! 
Unlimited DTO — we believe in time off!  
Virtual yoga, meditation or boot camp classes offered daily 


Compensation: Aya reasonably anticipates the pay scale for this position to be $40.87 to $52.88 hourly, which equates to $85,000 to $110,000 annually.

The pay scale for this position may vary if applicant possesses experience outside of what Aya reasonably anticipates for this position. Bonuses are subject to the role and your manager's discretion. 

Aya is an Equal Opportunity Employer (EEO), including Disability / Vets, and welcomes all to apply. Please click here for our EEO policy.
Show more "
3569783173,Junior Data Analyst,SynergisticIT,2023-04-19,https://www.linkedin.com/jobs/view/junior-data-analyst-at-synergisticit-3569783173?refId=MIPNuBpEPI0CQ8z7%2FLGq3Q%3D%3D&trackingId=qHBR%2FvR8T1VD6EUW3pww8Q%3D%3D&position=18&pageNum=2&trk=public_jobs_jserp-result_search-card,2151,"About Us




Synergistic IT is a full-service staffing and placement firm servicing client in America for the past 12+ years. We are dedicated towards fulfilling the IT needs of our clients. From staffing to full implementation of projects we provide the highest quality IT Services. We Intend to deliver exceptional student outcome. We don't just help you secure a tech job but build a solid career in technology.




Job Description




Roles and Responsibilities




Managing master data, including creation, updates, and deletion.
Helping develop reports and analysis.
Supporting initiatives for data integrity and normalisation.
Providing technical expertise in data storage structures, data mining, and data cleansing.
Supporting the data warehouse in identifying and revising reporting requirements.
Desired Candidate Profile




Degree in Business, Finance, Economics, Computer Science, IT or any equivalent degree.
Basic knowledge of MySQL & Python
Should be able to do data visualisation using Tableau or Excel.
Excellent English communication (both oral and written) and reading comprehension skills.
Strong analytical and problem-solving skills, with clear attention to detail.
Ability to prioritise and work under tight deadlines.
Fast learner, able to master new concepts, theories, ideas, and processes with ease.
Willingness to work beyond traditional working hours/days as required by the business.
The person should be open to learning and take new responsibilities.




Education Requirement: -




Bachelors, Masters in Computer Science/ Computer Engineering/ Information Systems/Information Technology/ Electrical Engineering/ Mechanical Engineering.




Benefits




On Job Technical support
E- verified
Help to get H1B Employer.
Full time position




Candidate who are missing the required skills, might be provided an option to enhance their skills, so that they can also apply for the role and can make a career in IT industry.




If you do respond via e-mail, please include a daytime phone number so that we can reach you. In considering candidates, time is of the essence, so please respond ASAP.




Thank you
Show more "
