Job ID,Title,Company,Date,Link,Description Length,Description
3583434580,Data Engineer,OMTECH,2023-04-26,https://www.linkedin.com/jobs/view/data-engineer-at-omtech-3583434580?refId=03s6HqP%2FtPrulCjo3Ayg8A%3D%3D&trackingId=9oLmMdothIOreJHrynntMQ%3D%3D&position=1&pageNum=0&trk=public_jobs_jserp-result_search-card,1136,"Title: Data Engineer

Location: 100% Remote

Duration: 12+ months Contract

Note

Only W2.

Any Independent Visa is fine.(except CPT and OPT candidates)

Experience Preferred On The Following Tools And Technology

MS SQL
Python
SharePoint
Advanced Excel Skill (formulas, VBA, Power Pivot, Pivot Table)

Responsibilities

Designing and implementing data transformation, ingestion and curation functions on GCP cloud using GCP native or custom programming Designing and building production data pipelines from ingestion to consumption within a hybrid big data architecture, using Java, Python etc. Performing detail assessments of current state data platforms and creating an appropriate transition path to GCP cloud Analysing, re-architecting and re-platforming on-premise data warehouses to data platforms on GCP cloud using GCP/3rd party services Optimizing data pipelines for performance and cost for large scale data lakes GCP stack- big query, cloud functions, Pub Sub, CI/CD automation GitHub Terraform for infrastructure development and deployment Data modelling experience Python

Education

Degree in Computer Science
Show more "
3583084399,Data Engineer,CVS Health,2023-04-27,https://www.linkedin.com/jobs/view/data-engineer-at-cvs-health-3583084399?refId=03s6HqP%2FtPrulCjo3Ayg8A%3D%3D&trackingId=OfUTFmP3adwGJGZmI0ccsg%3D%3D&position=2&pageNum=0&trk=public_jobs_jserp-result_search-card,4018,"Job Description




As a Data Engineer in the Analytics and Behavior Change group, You will be working on the Deployment and Experimentation platform to deliver personalized nudges to improve member health and encourage healthy actions. You will Lead and participate in the design, build and management of large-scale data structures, pipelines, and efficient Extract/Load/Transform (ETL) workflows.




Your Main Responsibilities will Include:




Developing large scale data structures and pipelines to organize, collect and standardize data that helps generate insights and addresses reporting needs.
Writing ETL (Extract / Transform / Load) processes, designs database systems and develops tools for real-time and offline analytic processing.
Collaborating with the data science team to transform data and integrate algorithms and models into automated processes.
Using knowledge in Hadoop architecture, HDFS commands and experience designing & optimizing queries to build data pipelines.
Using strong programming skills in Python, Java or any of the major languages to build robust data pipelines and dynamic systems.
Building data marts and data models to support Data Science and other internal customers.
Integrates data from a variety of sources, assuring that they adhere to data quality and accessibility standards.
Analyzing current information technology environments to identify and assess critical capabilities and recommend solutions.





Pay Range




The typical pay range for this role is:




Minimum: $ 70,000




Maximum: $ 140,000




Please keep in mind that this range represents the pay range for all positions in the job grade within which this position falls. The actual salary offer will take into account a wide range of factors, including location.




Required Qualifications




2 + years of relevant Data Engineering experience.
1 + years of professional experience with Java, Python and other related programming languages.
1 + years of experience with Distributed data/computing tools (MapReduce, Hadoop, Hive, Kafka, Spark, or MySQL).





Preferred Qualifications




Experience with cloud computing (AWS, Microsoft Azure, Google Cloud).
Experience with API’s.
Experience with test-driven development and automated testing frameworks.
Strong knowledge on building a continuous integration and deployment pipeline.





Education




Bachelor's degree or equivalent work experience in Computer Science, Engineering, Machine Learning, or related discipline




Business Overview




Bring your heart to CVS Health Every one of us at CVS Health shares a single, clear purpose: Bringing our heart to every moment of your health. This purpose guides our commitment to deliver enhanced human-centric health care for a rapidly changing world. Anchored in our brand — with heart at its center — our purpose sends a personal message that how we deliver our services is just as important as what we deliver. Our Heart At Work Behaviors™ support this purpose. We want everyone who works at CVS Health to feel empowered by the role they play in transforming our culture and accelerating our ability to innovate and deliver solutions to make health care more personal, convenient and affordable. We strive to promote and sustain a culture of diversity, inclusion and belonging every day. CVS Health is an affirmative action employer, and is an equal opportunity employer, as are the physician-owned businesses for which CVS Health provides management services. We do not discriminate in recruiting, hiring, promotion, or any other personnel action based on race, ethnicity, color, national origin, sex/gender, sexual orientation, gender identity or expression, religion, age, disability, protected veteran status, or any other characteristic protected by applicable federal, state, or local law. We proudly support and encourage people with military experience (active, veterans, reservists and National Guard) as well as military spouses to apply for CVS Health job opportunities.
Show more "
3588895259,Data Engineer,BioNTech SE,2023-04-27,https://www.linkedin.com/jobs/view/data-engineer-at-biontech-se-3588895259?refId=03s6HqP%2FtPrulCjo3Ayg8A%3D%3D&trackingId=ajudxNtTRj5nKstHQEhTMA%3D%3D&position=3&pageNum=0&trk=public_jobs_jserp-result_search-card,5499,"Become a member of the BioNTech Family!




Based in Cambridge, MA and Gaithersburg, MD. We are committed to improving the health of people worldwide with our fundamental research and our work in the area of development of immunotherapies utilizing the full potential of the immune system to fight cancer, infectious diseases and other serious diseases. We believe in scientific rigor, innovation and passion as driving forces. BioNTech was founded by scientists and physicians to translate science into survival by combining fundamental research and operational excellence.




With decades of deep immunology expertise and experience in developing and optimizing mRNA as part of its broad suite of novel technologies, the company is working with the global community to defeat life-threatening and serious diseases such as cancer, COVID-19, malaria and tuberculosis. The first ever approved mRNA vaccine was created in the labs of BioNTech in Mainz, Germany. A fully integrated immunotherapy powerhouse. We remain focused on bringing our broad pipeline of next-generation immunotherapies and vaccines to people around the world to address cancer, infectious diseases, as well as a growing list of other medical conditions. To accomplish this, we continue to be deeply rooted in science and academic research while also having built a fully integrated, global immunotherapy company with cGMP and GMP manufacturing facilities anchored around deep expertise in immunology and complemented by an expanding set of capabilities.




Job Title: Data Engineers Job Location: 70 Sidney Street, Cambridge, MA 02139 Job Responsibilities: 1. Work closely in partnership with scientists to understand scientific challenges, data needs, business needs, technology and software requirements; 2. Design and develop quality R Shiny applications for visualization purposes to address the needs of scientists; 3. Assist in the design and development of optimized and normalized database schemas as needed for the database layer of both data and software projects; 4. Develop and establish DevOps best-practices including code-reviews, version control, continuous integration, continuous delivery and unit testing; 5. Utilize domain knowledge of bioinformatics algorithms functional group worksflows to propose and implement automated software solutions to assist in laboratory ease and automation; 6. Construct automated pipelines using new and existing Python scripts with Apache Airflow as needed, to support a variety of data integration projects; 7. Work with Comp Bio and other data-focused groups to identify public datasets of future interest and build pipelines importing them into the BioNTech data commons; 8. Be comfortable working the AWS cloud and implementing cloud-based software solutions; and 9. Make scientific and engineering presentations to various groups and meetings in the company. Job Requirements: Employer requires a Master's degree in Bioinformatics plus one (1) year of experience as a Bioinformatics Engineer. In addition, the employer requires the following: 1. Experience with immune biology processes gained through one (1) year of work experience; 2. Experience developing automated pipelines using Python gained through one (1) year of work experience; 3. Experience with SQL database technologies gained through one (1) year of work experience or certification; 4. Experience with cloud computing gained through one (1) year of work experience or certification; and 5. Experience developing applications using R Shiny gained through one (1) year of work experience. All years of experience may be gained concurrently. Telecommuting is available from within the Boston metro area. Must be able to come to the office as needed. This position is eligible for BioNTech US ’s Employee Referral Program. Scott Smith – Associate Director, Talent Acquisition by email Scott.Smith@biontech.us or mail to BioNTech US Inc., 40 Erie Street, Suite 110, Cambridge MA 02139 (attn: Req#ER04713)




Benefits for you.




BioNTech US is committed to the well being of our team members and offers a variety of benefits supporting our diverse employee base. Salaried/Position-Targeted Hourly Employees working 30+ hours per week are eligible for our comprehensive benefits package. Benefits include but are not limited to:




Medical, Dental and Vision Insurance
Life, AD&D, STD and LTD Insurance
HSA & FSA Spending Accounts
Health & Wellness, including free onsite gym access
Adoption & Surrogacy Assistance
Vacation and Unlimited Sick Time
Holidays and Floating Holidays, including discretionary winter shutdown
401(K) Plan with Significant Company Match
Tuition Reimbursement and Professional Development
Commuting Assistance and subsidized parking
Discounted Home and Auto Insurance
Pet Insurance




Plus more benefits that will be shared upon hire!




Have we kindled your pioneering spirit?




Then apply now for our location Cambridge (Boston) and simply send us your application documents using our online form.




BioNTech does not differentiate on the basis of gender, political opinion, religion or belief, nationality, ethnic or social origin, age, sexual orientation, marital status, disability, physical appearance, health status or any other aspect of personal status. We are committed to creating a diverse and inclusive environment and are proud to be an equal opportunity employer. Most important – it’s a match!




BioNTech - As unique as you




www.biontech.com
Show more "
3584653457,Data Engineer,Gametime,2023-04-26,https://www.linkedin.com/jobs/view/data-engineer-at-gametime-3584653457?refId=03s6HqP%2FtPrulCjo3Ayg8A%3D%3D&trackingId=n7wYGDIZ%2Fyt3OwUrEmwRVQ%3D%3D&position=4&pageNum=0&trk=public_jobs_jserp-result_search-card,3392,"About Us:

Live experiences help people cross today’s digital divide and focus on what truly connects us – the here, the new, this once-in-a-lifetime moment that’s bringing us together. To fulfill Gametime’s mission of uniting the world through shared experiences, we make it easy for people to discover and access the live experiences that matter most.

With platforms on iOS, Android, mobile web and desktop supporting more than 25,000 events across the US and Canada, we are reimagining the event ticket industry in order to move at the speed of life.

We are looking for an organized, data-driven, and curious team player to work cross-functionally across the data, product, marketing, finance, and operations teams. As a Data Engineer, you will support and inform various functions throughout the company to solve business-critical issues, specifically related to our product, features, etc. You will develop new ETL processes and deploy new technologies into the ecosystem. The ideal candidate will be able to thrive in a fast-paced environment and able to adapt to changes within the business and the industry.

What you'll be doing:

Develop data pipelines and infrastructure that is fast, reliable, and accurate
Create ingest processes for new data sources
Maintain and develop data alerting infrastructure to quickly respond to and fix production issues
Influence and build relationships with people across all levels of the organization, internally and externally


What our ideal candidate has:

1+ years of Data Engineer experience, ideally at a technology company
Proficient in SQL
Experience with a programming language (Python a plus)
Ability to identify, analyze, and provide recommendations to complex business decisions
Solid understanding of database concepts and architecture
Ability to work across disparate data sources to obtain sensible results
Strong collaboration and communication skills
Experience analyzing user-centric products, preferably in the gaming or marketplace industries
Strong problem-solving skills
Some experience with Python or R
Experience with a data visualization software


What we can offer:

Flexible PTO
Equity
Medical, dental, & vision insurance
Life insurance and disability benefits
401K, HSA, pre-tax savings programs
New equipment setup provided
Diverse Family-forming benefits through Carrot Fertility
Wellness programs
Tenure recognition


$130,000 - $175,000 a year

At Gametime pay ranges are subject to change and assigned to a job based on specific market median of similar jobs according to 3rd party salary benchmark surveys. Individual pay within that range can vary for several reasons including skills/capabilities, experience, and available budget.

Gametime is committed to bringing together individuals from different backgrounds and perspectives. We strive to create an inclusive environment where everyone can thrive, feel a sense of belonging, and do great work together. As an equal opportunity employer, we prohibit any unlawful discrimination against a job applicant on the basis of their race, color, religion, veteran status, sex, parental status, gender identity or expression, transgender status, sexual orientation, national origin, age, disability or genetic information. We respect the laws enforced by the EEOC and are dedicated to going above and beyond in fostering diversity across our company.
Show more "
3583434137,ETL Data Engineer,TekIntegral,2023-04-26,https://www.linkedin.com/jobs/view/etl-data-engineer-at-tekintegral-3583434137?refId=03s6HqP%2FtPrulCjo3Ayg8A%3D%3D&trackingId=L%2FiLnc7agMS171lgob%2FPxA%3D%3D&position=5&pageNum=0&trk=public_jobs_jserp-result_search-card,2028,"ALL ROLES ARE HYBRID IN THE OFFICE (2-3 DAYS/WEEK) UNLESS REMOTE IS NOTED

W2 Rate range

LOCATION DETAILS -noted below

Only taking USC, GC or H4 EAD, L2 Visa or TN Visa - they will not take OPT EAD or CPT

Data Analytics Engineer ETL Informatica

Charlotte NC or Summit NJ- 2 days in office/3 days remote LOCAL CANDIDATES ONLY

12+ months

Seeking a data engineer who can assist with transitioning and building new process/enhancements of current state as well as development.

Will be responsible for the following on a daily basis

60% of this role is initially assisting in the identification of process changes/enhancements and the documentation/requirement definition within the data engineering team.
Must have a strong background in data analytics delivery and data warehousing
Must be strong in SQL queries, stored procedures, query optimization and performance tuning
Data engineering background to include: analyzing current state, document the use of tools, primarily SSIS, adopt any ETL tool, create documentation, process and test.
Assessing current state/process and documenting current issues and willing to learn/adapt to other ETL tools outside of SSIS
Documentation and building of new technical documents based on review of trouble tickets
Must be able to help understand and define current state and ensure new enhancements as well as assist in implementing changes

Required Experience

8+ years of data engineering experience within ETL/Informatica, SQL and SSIS
Strong background working within Agile
8+ years of data management experience including data modeling, data integrity and data quality
6+ years RDBMS such as SQL Server, Oracle or MySQL
6+ years of experience writing relational database queries (SQL) for stored procedures, query optimization and performance tuning
6+ years of experience with ETL Tools (SSIS)
6+ years of experience with large data and analytic environments
2+ years of experience with Agile practices
Experience with Autosys or other automation/scheduling tools
Show more "
3584787956,Data Engineer,Radancy,2023-04-27,https://www.linkedin.com/jobs/view/data-engineer-at-radancy-3584787956?refId=03s6HqP%2FtPrulCjo3Ayg8A%3D%3D&trackingId=6%2FtRXkBabMLr%2B60u1CS9%2BA%3D%3D&position=6&pageNum=0&trk=public_jobs_jserp-result_search-card,3206,"Radancy Data Engineering is seeking a Data Engineer to support building new data products and services.




About




Radancy Data Engineering works on data services across product organizations within Radancy, and supports building a customer facing data visualization product. The Data Engineering team supports an enterprise grade recruitment platform focusing on talent acquisition and job opportunity exploration.
The team has extensive experience in ETL development, works with large scale data in real time, and cross collaborates with other engineering teams across the organization.
Build and maintain ETL pipelines utilizing Python that connect 1st and 3rd party data
Work with Cloud Computing Platforms (GCP/AWS), Luigi, Kafka and other open-source technologies
Conduct data modeling, schema design, and SQL development
Ingest and aggregate data from both internal and external data sources to build our world class datasets
Develop and lead the testing and fixing of new or enhanced solutions for data products and reports, including automating ETL testing
Collaborate with Product Owner and domain experts to recognize and help adopt best practices in reporting and analysis: data integrity, test design, analysis, validation, and documentation
Assist with the development and review of technical and end user documentation including ETL workflows, research, and data analysis
Work with Product team to define data collection and engineering frameworks
Build monitoring dashboards and automate data quality testing
Responsible for daily integrity checks, performing deployments and releases 
Own meaningful parts of our service, have an impact, grow with the company
3+ years of Python, SQL, and ETL development 
Bachelors or Masters degree in Computer Science or other related field
Product / reporting suite experience
Familiarity with C#, .Net, Kafka, Docker
Exposure to front end development: HTML, JavaScript, jQuery, Angular or similar libraries
Exposure / familiarity with Google Cloud Platform / BigQuery / Amazon Redshift
AdTech experience preferred
Enthusiastic about working with and exploring new data sets 
Detail oriented and strong communicator




Join the global leader in talent acquisition technologies that’s committed to finding new ways to leverage software, strategy and creative to enhance our clients’ employer brands – across every connection point. We’re looking for unconventional thinkers. Relentless collaborators. And ferocious innovators. Talented individuals who are ready to work towards solutions that transform the way employers and job seekers connect.




Salary Range: $120,000.00-$135,000.00*




The above range is based on a wide array of factors unique to each candidate, including but not limited to skill set, years and depth of experience, certifications, and specific office location.




Radancy is an equal opportunity employer and welcomes all qualified applicants regardless of race, ethnicity, religion, gender, gender identity, sexual orientation, disability status, protected veteran status, or any other characteristic protected by law. We actively work to create an inclusive environment where all of our employees can thrive.
Show more "
