Job ID,Title,Company,Date,Link,Description Length,Description
3589567815,Data Engineer – Remote | 953284,Revel IT,2023-04-27,https://www.linkedin.com/jobs/view/data-engineer-%E2%80%93-remote-953284-at-revel-it-3589567815?refId=03s6HqP%2FtPrulCjo3Ayg8A%3D%3D&trackingId=4Pgru2Hf956adZwrGgEgzw%3D%3D&position=22&pageNum=0&trk=public_jobs_jserp-result_search-card,3819,"OUR GOAL:Treat our consultants and clients the way we would like others to treat us!

Interested in joining our team? Check out the opportunity below and apply today!

A Dublin, Ohio client has a remote contract opportunity for a Data Engineer.

Job Description:

Department Overview:

Supply Chain Digital Partners – Supply Chain Digital Solutions team works with Inventory Management, Logistics and Warehouse Operations business teams on solving some of the business’ biggest challenges, gain efficiency and improve the customer experience by leveraging data engineering, data science and visualization, data automation and data governance & management.
The team drives business innovation by leveraging emerging technologies and turning them into differentiating business capabilities.

Responsibilities:

Develop BQ views per business requirements and best practices. Perform data mapping with source systems.
Ensure on time delivery of project work solve technical issues and provide quick resolution.
Should have advanced SQL programming experience with GCP BQ. Hands on skills with GCP, Bigquery, Airflow, needed.
Work closely with Product Owners on creating estimates/designs and realizing business value
Ensure quality by conducting code review, providing direction to other data engineers
Participate in technical platform strategy as tools, products, and business needs evolve
Define and execute database and data movement standards, design reviews, pipeline CI/CD process, and data container policies to ensure high quality data management
Define how our data analytics and ML/AI capabilities will apply to business needs and result in dependable business solutions
Partner with external consultants, solution providers, and managed services organizations to enable product/solution development as well as meeting documented standards
Interact with multiple organizations to track project progress, identify risks, communicate risks and status to leadership, and to assess potential impacts to the business.
Ensure platforms and tools meet or exceed data security standards, including internal and external audits performed
Use strong verbal and written communication skills that non-technical business and end-users can understand.

Desired Qualifications:

8+ years’ experience with data platforms including GCP, HANA, Teradata, My SQL and SQL Server, Airflow
Expert working knowledge of SQL, Python,
Demonstrated expertise of database design and modeling.
Expert knowledge of BI Reporting and Data Discovery tools
Expert knowledge of Cloud technologies
Experience with business-critical applications.
Experience on large-scale implementation programs preferred.
Experience with SAP, Manhattan SCORE/Warehouse management data highly desired
Excellent written and oral communication skills.

Reference: 953284

ABOUT REVEL IT:

Revel IT (formerly known as Fast Switch) is one of the fastest-growing, privately held, IT Staffing companies in the nation. Our client base includes 32% of the Fortune 25. We have major offices in Dublin, OH, Phoenix, AZ, Los Angeles, CA, and Austin, TX and are rapidly expanding into new markets from coast to coast.

WHY REVEL IT:

In addition to standard health and 401k benefits, we offer referral bonuses and training/continuing education opportunities.
5-year client retention: 99%
No. 1 supplier with customers: 53%
Top 3 supplier with customers: 77%
Consultant retention: 94%

Revel IT is an Equal Opportunity Employer. Revel IT does not discriminate on the basis of race, religion, color, sex, gender identity, sexual orientation, age, non-disqualifying physical or mental disability, national origin, veteran status or any other basis covered by appropriate law. All employment is decided on the basis of qualifications, merit, and business need.

#gdr4900
Show more "
3589575575,Cloud/Data Developer,Fusion Alliance,2023-04-27,https://www.linkedin.com/jobs/view/cloud-data-developer-at-fusion-alliance-3589575575?refId=03s6HqP%2FtPrulCjo3Ayg8A%3D%3D&trackingId=sODg2yV%2BcfhRQm2VsApXiQ%3D%3D&position=23&pageNum=0&trk=public_jobs_jserp-result_search-card,5159,"Looking for a senior data development consultant with proven skills developing data solutions in the cloud. Thorough knowledge of and in-depth experience with building data warehouse, data integration and BI/analytics solutions. Is very skilled with Azure technologies. Broad capabilities to support the many roles involved with data projects including data architecture, solution architecture, environment configuration, data analysis, use case development, ETL design & development and BI/analytics. Must be a good communicator (verbal and written) and able to pick up technologies quickly and independently. Requirements/Credentials: * 8+ years developing data integration/ETL solutions for data warehouses, data marts, data lakes * 2+ years serving in a lead capacity for substantial projects * Expert level knowledge of ETL frameworks including Microsoft SSIS and Azure Data Factory; experience with others such as Informatica, Talend, Wherescape, Fivetran, etc. very beneficial. Can speak to the latest features and techniques and fully understands, at an implementation level, topics such as job automation, auditing and error handling, devops, performance tuning * 3+ engagements where role included data architecture and data modeling * Prior experience serving in a consulting role * Thorough understanding of Cloud Architecture, especially the Azure implementation * One or more projects moving or re-platforming on-premise data applications to Azure cloud. * Expertise with the Azure data technology stack and hands-on deep experience working with various Azure services: Azure Data Factory, Event Hub, Azure Blob & Data Lake, Azure SQL Data Warehouse, Azure SQL Database, DataBricks, Azure Analysis Services, Power BI * Good experience working with modern integration and ingestion tools and approaches: PolyBase, U-SQL, Python, JavaScript * 2+ years of experience with BI reporting with specific knowledge of Power BI design and development; proven ability to create Tabular Reports, Drill-down Reports, Sub Reports, and Charts. Has successfully promoted reporting solutions across environments including production. * Experience designing and implementing ingestion of unstructured and structured data sets to support reporting or analytics; working knowledge of ingesting JSON, XML, documents and streaming data * Experience designing and developing data cleansing routines utilizing typical data quality functions involving standardization, transformation, rationalization, linking and matching * Knowledge of master data and metadata related concepts, standards, processes and technology Optional Capabilities: * Has architecture experience guiding customers to use the right components in Azure for their specific objectives or use cases * Experience with Azure ML studio or custom analytics model development; development experience using R, Python or Spark for analytics * 2+ engagements with solid working experience on the Snowflake cloud DW ; understands approaches to load data, design the data structures, develop views and data delivery. Can work effectively within the platform to manage the environment such as administer security, configuration, cost analysis & optimization, performance analysis and tuning. * Experience working with the data capabilities within AWS including tools/services such as Glue, Redshift, Athena, Kinesis, Lambda * Experience working with multi-Terabyte environments and Big Data * Snowflake certifications Apply Directly to Fusion Alliance Here: -cd38-4675-8745- 78539e0894fb/faa23bbd -00e4-eb11-bacb-002248069133 Company Description Established in 1994 in Indianapolis, Indiana, Fusion Alliance is highly regarded as an enterprise solution provider, delivering practical insights, engaging customer experiences, and human-driven technologies that transform the way our clients do business. That's why over 450 clients across more than 100 companies trust us. They know that the solutions we build alongside them are robust, scalable, usable, and secure - even in the most challenging, dynamic, and highly regulated environments. We have deep experience in delivering solutions to companies within life sciences and healthcare, banking and insurance, manufacturing, energy and utilities, and more. Copy and paste the link to learn a little more about our consultants' experience so far!




Established in 1994 in Indianapolis, Indiana, Fusion Alliance is highly regarded as an enterprise solution provider, delivering practical insights, engaging customer experiences, and human-driven technologies that transform the way our clients do business. That’s why over 450 clients across more than 100 companies trust us. They know that the solutions we build alongside them are robust, scalable, usable, and secure – even in the most challenging, dynamic, and highly regulated environments. We have deep experience in delivering solutions to companies within life sciences and healthcare, banking and insurance, manufacturing, energy and utilities, and more. Copy and paste the link to learn a little more about our consultants’ experience so far! https://fusionalliance.com/careers/spotlight/
Show more "
3583463419,"Data Engineer / Huntsville, AL",Altamira Technologies Corporation,2023-04-26,https://www.linkedin.com/jobs/view/data-engineer-huntsville-al-at-altamira-technologies-corporation-3583463419?refId=03s6HqP%2FtPrulCjo3Ayg8A%3D%3D&trackingId=aw0RgMVonyT8fMTTylQwsg%3D%3D&position=24&pageNum=0&trk=public_jobs_jserp-result_search-card,2300,"This position is for a Data Engineer with a company in Huntsville, AL.

Summary: Altamira is seeking a Data Engineer to support the Missile and Space Intelligence Center (MSIC) in Huntsville, Alabama.

Duties and Responsibilities: In this position you will use your Data Engineering and Artificial Intelligence expertise to find the answers to questions that uniquely position our military to succeed in the digital age. You will design, implement, and operate data management systems for intelligence needs. You will support the entire life cycle of data systems from technology selection and design to development, integration, and operation. If this sounds exciting to you, please keep reading and we look forward to talking to you soon.

Education and Experience: Basic Qualifications: Active TS/SCI security clearance. Bachelor\'s degree in a Computer Science, Engineering or related field Proven work experience or training as a Data Engineer, Machine Learning Engineer, or similar role Expertise with databases and database design, including SQL, NoSQL, and ORMs DoD or IC work experience. Python software development expertise Apache Airflow experience. Experience developing for Docker implementations Good interpersonal skills and the desire to work as part of a high-performing team Preferred Qualifications: Experience with version control software like Git Agile development familiarity Expertise in software development life cycle (SDLC) Experience with Extract, Transform, Load (ELT) operations Experience working with software developers and algorithm developers to create data and Machine Learning pipelines Linux OS experience Experience developing and updating technical documentation, presentations, flow charts, and other documentation Candidate must demonstrate strong troubleshooting and problem-solving skills. ***ACTIVE TS/SCI CLEARANCE REQUIRED*** ***MUST BE A U.S. CITIZEN*** We focus on recruiting talented, self-motivated employees that find a way to get things done. Join our team of experts as we engineer national security!

Altamira is an Equal Opportunity/Affirmative Action employer. All qualified applicants will receive consideration for employment without regard to race, color, religion, sex, national origin, disability, or protected veteran status.
Show more "
3589501588,Data Engineer,BioSpace,2023-04-27,https://www.linkedin.com/jobs/view/data-engineer-at-biospace-3589501588?refId=03s6HqP%2FtPrulCjo3Ayg8A%3D%3D&trackingId=zZGcGn6WLEXn8pPjnFoJaQ%3D%3D&position=25&pageNum=0&trk=public_jobs_jserp-result_search-card,3477,"Define and implement data science architectural framework and operating model for predictive and prescriptive analytics.
Improve existing AI/ML techniques by promoting new methodology and best practices from the industry.
Provide technical leadership in feasibility study of data science use cases to business functions and work with developers across teams to design, build and implement data science solutions and capabilities.
Leverage AI model techniques to model data, predict outcomes, and prescribe actions.
Work closely with all business functional leaders to understand their use cases and help them provide advanced analytics solutions to help them take proactive decisions.
Oversee and ensure completion of business and project cut-over activities.
Align with data engineering, data integration, data analytics, data science, and data operations work to ensure consistency across workstreams.


Qualifications

Bachelors degree in relevant field and at least 5 years relevant experience OR Masters degree in relevant field and at least 4 years experience.
3+ years of experience in data management, business analysis, and developing analytical models using statistical, machine learning, and data mining methodologies to drive business impact.
1+ years of experience with machine learning algorithms for data science, e.g., Linear and Logistics Regression, Decision Tree, Random Forest, Neural Networks, etc.
1+ years of experience with technologies such as Python
1+ years of experience within project management
Experience with advanced analytics platform such as Dataiku.
Experience in data visualization tools such as Qlik.
Familiarity with technologies like AWS S3, EMR, EKS, Snowflake.
Practical experience in architecture roles including architectural principles, helping define the reference architecture, and building technology roadmaps aligned with business strategy.
Strong problem solving and critical thinking skills that build trust and serve to positively influence partners and teammates.
Provide solutioning and support to vendors, developers, and other technical architects to enable solutions that meet business strategies.
Strong written and verbal communication, presentation, and technical writing skills, coupled with a strong interest in further developing and integrating enterprise business processes with technology skills.


AbbVie is an equal opportunity employer including disability/vets. It is AbbVie’s policy to employ qualified persons of the greatest ability without discrimination against any employee or applicant for employment because of race, color, religion, national origin, age, sex (including pregnancy), physical or mental disability, medical condition, genetic information, gender identity or expression, sexual orientation, marital status, status as a disabled veteran, recently separated veteran, Armed Forces service medal veteran or active duty wartime or campaign badge veteran or a person’s relationship or association with a protected veteran, including spouses and other family members, or any other protected group status. We will take affirmative action to employ and advance in employment qualified minorities, women, individuals with a disability, disabled veterans, recently separated veterans, Armed Forces service medal veterans or active-duty wartime or campaign badge veterans. The Affirmative Action Plan is available for viewing in the Human Resources office during regular business hours.
Show more "
