Job ID,Title,Company,Date,Link,Description Length,Description
3589480973,Data Engineer,Pomeroy,2023-04-27,https://www.linkedin.com/jobs/view/data-engineer-at-pomeroy-3589480973?refId=03s6HqP%2FtPrulCjo3Ayg8A%3D%3D&trackingId=gyVyncN2IH%2FOqZRytGyoxA%3D%3D&position=7&pageNum=0&trk=public_jobs_jserp-result_search-card,5220,"General Function: The Data Engineer will play an important role in our growing Enterprise Data and Analytics team. The person in this role will build out a new centralized Analytics Data Lakehouse, help maintain our existing Operational Data Warehouse, and the infrastructure that underlies both. We are looking for a candidate with experience creatively solving data complexities of various sizes and levels of cleanliness - with the goal of enabling data analysts and business users throughout Pomeroy to make decisions backed by data. Company Description For over 40 years, Pomeroy has enabled technology that enhances and empowers people in the workplace. Today we partner with our clients to help them transform from a ""one size fits all"" delivery model to a personalized human experience that is a differentiator and the key to delivering digital transformation and better business outcomes. It's all about delivering an exceptional experience, one that is simple, intuitive and secure - anytime, anyplace and from any device. Our workplace is no longer a physical location or workstation, rather it's the place where a person can work at any given time with full capacity to do their job productively and effectively. We deliver that experience by connecting the dots between people and their applications, across a network that is intuitive and automated to where the applications live, today that is in a hybrid IT environment, on premise and in the cloud, with security an integral part of everything we do. We provide managed IT services to support our clients from our locations throughout North America, Latin America and Europe. Our service delivery model combines monitoring, prevention and resolution in an approach that is always aware, proactive and responsive. Our field engineers support more than 50,000 sites across North America alone and respond to more than 3 million incidents and user requests annually covering 2 million desktops, laptops, smartphones and tablets, servers, printers and other peripherals. Our expertise connecting the workplace, network and hybrid IT is industry recognized, including Gartner recognition for over 17 years as one of a select few who can deliver agile, quality Managed Workplace Services. And although technology and innovation are key ingredients in our solutions, our people are our greatest asset. Over 3,000 highly motivated and diverse, dedicated to supporting our 700+ clients, from midsize organizations to large, well-known US and global brands, 15 in the Fortune 500. ""The Pomeroy Way"" is our guiding principle. It's a conscious understanding that who we are as individuals and how we choose to interact with others is a direct reflection of who we are as a company and how we will be viewed as an organization. It defines our company and our culture as the place to be, the place to stay and the place to grow.




For over 40 years, Pomeroy has enabled technology that enhances and empowers people in the workplace. Today we partner with our clients to help them transform from a “one size fits all” delivery model to a personalized human experience that is a differentiator and the key to delivering digital transformation and better business outcomes. It’s all about delivering an exceptional experience, one that is simple, intuitive and secure – anytime, anyplace and from any device. Our workplace is no longer a physical location or workstation, rather it’s the place where a person can work at any given time with full capacity to do their job productively and effectively. We deliver that experience by connecting the dots between people and their applications, across a network that is intuitive and automated to where the applications live, today that is in a hybrid IT environment, on premise and in the cloud, with security an integral part of everything we do. We provide managed IT services to support our clients from our locations throughout North America, Latin America and Europe. Our service delivery model combines monitoring, prevention and resolution in an approach that is always aware, proactive and responsive. Our field engineers support more than 50,000 sites across North America alone and respond to more than 3 million incidents and user requests annually covering 2 million desktops, laptops, smartphones and tablets, servers, printers and other peripherals. Our expertise connecting the workplace, network and hybrid IT is industry recognized, including Gartner recognition for over 17 years as one of a select few who can deliver agile, quality Managed Workplace Services. And although technology and innovation are key ingredients in our solutions, our people are our greatest asset. Over 3,000 highly motivated and diverse, dedicated to supporting our 700+ clients, from midsize organizations to large, well-known US and global brands, 15 in the Fortune 500. “The Pomeroy Way” is our guiding principle. It’s a conscious understanding that who we are as individuals and how we choose to interact with others is a direct reflection of who we are as a company and how we will be viewed as an organization. It defines our company and our culture as the place to be, the place to stay and the place to grow.
Show more "
3583075069,Data engineer,Cloud BC Labs,2023-04-27,https://www.linkedin.com/jobs/view/data-engineer-at-cloud-bc-labs-3583075069?refId=03s6HqP%2FtPrulCjo3Ayg8A%3D%3D&trackingId=iYc%2B35zC5a9W24P7EGGH6g%3D%3D&position=8&pageNum=0&trk=public_jobs_jserp-result_search-card,493,"Job Title :: Data Engineer Location :: Remote Skill Python Sql Informatica IDQ

Cloud BC Labs Inc is a digital transformation organization aimed at creating seamless solutions for clients to effectively manage their business operations. The company specializes in Business and Management Consulting, AI/ML, Data Analytics & Visualization, Cloud Data Warehouse Migration, Snowflake Implementation, Informatica Implementation & Upgrade, Staffing Services and Data Management Solutions
Show more "
3583544713,Data Engineer,DATAECONOMY,2023-04-27,https://www.linkedin.com/jobs/view/data-engineer-at-dataeconomy-3583544713?refId=03s6HqP%2FtPrulCjo3Ayg8A%3D%3D&trackingId=Wj4B7H%2BTG7Y%2FBobPcuA50A%3D%3D&position=9&pageNum=0&trk=public_jobs_jserp-result_search-card,785,"Role: Data Engineer

Job Location: Charlotte/ Rhodeisland

Experience: min 9Years

Work Mode: full time




Skills Required:

Java Spark, Scala and AWS are mandatory.

Mandatory Cloud Migration skills and lead level skills

Experience with big data tools: Hadoop, Spark, Kafka, etc.
Experience with relational SQL and NoSQL databases, including Postgres and Cassandra.
Experience with data pipeline and workflow management tools: Azkaban, Luigi, Airflow, etc.
Experience with AWS cloud services: EC2, EMR, RDS, Redshift
Experience with stream-processing systems: Storm, Spark-Streaming, etc.
Experience with object-oriented/object function scripting languages: Python, Java, C++, Scala, etc.




Best wishes,




Lokesh Potnuri

Recruiter 

614-356-8153

www.dataeconomy.io

Show more "
3589489836,Analytics Engineer,Fractal,2023-04-27,https://www.linkedin.com/jobs/view/analytics-engineer-at-fractal-3589489836?refId=03s6HqP%2FtPrulCjo3Ayg8A%3D%3D&trackingId=l40muYsJzswc184ksgcSww%3D%3D&position=10&pageNum=0&trk=public_jobs_jserp-result_search-card,6548,"It's fun to work in a company where people truly BELIEVE in what they are doing!




We're committed to bringing passion and customer focus to the business.




Fractal is a strategic AI partner to Fortune 500 companies with a vision to power every human decision in the enterprise. Fractal is building a world where individual choices, freedom, and diversity are the greatest assets. An ecosystem where human imagination is at the heart of every decision. Where no possibility is written off, only challenged to get better. We believe that a true Fractalite is the one who empowers imagination with intelligence. Fractal has been featured as a Great Place to Work by The Economic Times in partnership with the Great Place to Work® Institute and recognized as a ‘Cool Vendor’ and a ‘Vendor to Watch’ by Gartner.




Please visit Fractal | Intelligence for Imagination for more information about Fractal.




Position Overview




Fractal is looking for a proactive and driven Engineer to join our Data Engineering and Analytics team in New York, New Jersey, Remote area. In this role, you will play a vital role as the client and team lead with hands-on involvement in project management, business interpretation and application of solutions, client communication, insights/results delivery. 




This is a perfect opportunity for someone, who is looking to combine best-in-class analytics skills with strong problem-solving and communication abilities to perform analytical work to help clients solve strategic, tactical, and operational business problems.




The perfect candidate will have experience in both Data Engineering and Data Science.




Data Engineer- Data Management & Platforms




Primary Responsibilities




Play a key role in the success and growth of the Data Engineering team by mentoring and playing a leadership role within the team
Drive innovation within Data Engineering by playing a lead role in technology decisions for the future of our data science, analysis, and reporting needs
Work with business partners and software engineers to gather, understand, and bridge definitions and requirements
Lead the design and development for highly complex and critical data projects with strict timelines
Improvements to team efficiency and effectiveness through implementation of data tools (self-service, data quality, etc.)
Design, develop and maintain data pipelines to extract data from a variety of sources and populate data lake and data warehouse
Develop the various data transformation rules and data modeling capabilities
Collaborate with Data Analyst, Data Scientists, Machine Learning Engineers to identify and transform data for ingestion, exploration, and modeling
Work with data governance team and implement data quality checks and maintain data catalogs
Use Orchestration, logging, and monitoring tools to build resilient pipelines
Use test driven development methodology when building ELT/ETL pipelines
Understand and apply concepts like data lake, data warehouse, lake-house, data mesh and data-fabric where relevant
Develop data models for cloud data warehouses like Redshift and Snowflake
Develop pipelines to ingest data into cloud data warehouses
Understand and be able to use different databases like Relational, Document, Graph and Key/Value
Analyze data using SQL
Use serverless AWS services like Glue, Lambda, StepFunctions
Use Terraform Code to deploy on AWS
Containerize Python code using Docker
Use Git for version control and understand various branching strategies
Build pipelines to work with large datasets using PySpark
Develop proof of concepts using Jupyter Notebooks
Work as part of an agile team
Create technical documentation as needed




Education




Bachelor’s Degree or equivalent experience in a relevant field such as Mathematics, Computer Science, Engineering, Artificial Intelligence, etc.




Required Experience And Skills




7+ years of relevant experience
Good experience with AWS services like S3, ECS, Fargate, Glue, StepFunctions, CloudWatch, Lambda, EMR
SQL
Proficient in Python, PySpark
Good with Git, Docker, Terraform
Ability to work in cross functional teams




Preferred Experience And Skills




Any AWS developer or architect certification
Agile development methodology




Pay




The wage range for this role takes into account the wide range of factors that are considered in making compensation decisions including but not limited to skill sets; experience and training; licensure and certifications; and other business and organizational needs. The disclosed range estimate has not been adjusted for the applicable geographic differential associated with the location at which the position may be filled. At Fractal, it is not typical for an individual to be hired at or near the top of the range for their role and compensation decisions are dependent on the facts and circumstances of each case. A reasonable estimate of the current range is: $100-$120k In addition, for the current performance period, you may be eligible for a discretionary bonus.




Benefits




As a full-time employee of the company or as an hourly employee working more than 30 hours per week, you will be eligible to participate in the health, dental, vision, life insurance, and disability plans in accordance with the plan documents, which may be amended from time to time. You will be eligible for benefits on the first day of employment with the Company. In addition, you are eligible to participate in the Company 401(k) Plan after 30 days of employment, in accordance with the applicable plan terms. The Company provides for 11 paid holidays and 12 weeks of Parental Leave. We also follow a “free time” PTO policy, allowing you the flexibility to take time needed for either sick time or vacation.




Fractal provides equal employment opportunities to all employees and applicants for employment and prohibits discrimination and harassment of any type without regard to race, color, religion, age, sex, national origin, disability status, genetics, protected veteran status, sexual orientation, gender identity or expression, or any other characteristic protected by federal, state or local laws.




If you like wild growth and working with happy, enthusiastic over-achievers, you'll enjoy your career with us!




Not the right fit? Let us know you're interested in a future opportunity by clicking Introduce Yourself in the top-right corner of the page or create an account to set up email alerts as new job postings become available that meet your interest!
Show more "
3582119741,Data Engineer - ETL/BI Developer,Avalara,2023-04-26,https://www.linkedin.com/jobs/view/data-engineer-etl-bi-developer-at-avalara-3582119741?refId=03s6HqP%2FtPrulCjo3Ayg8A%3D%3D&trackingId=ipU4MlsU7WStJZ64gmq0XA%3D%3D&position=11&pageNum=0&trk=public_jobs_jserp-result_search-card,4814,"Designs, builds and oversees the deployment and operation of technology architecture, solutions and software to capture, manage, store and utilize structured and unstructured data from internal and external sources. Establishes and builds processes and structures based on business and technical requirements to channel data from multiple inputs, route appropriately and store using any combination of distributed (cloud) structures, local databases, and other applicable storage forms as required.



 



Designs, builds and oversees the deployment and operation of technology architecture, solutions and software to capture, manage, store and utilize structured and unstructured data from internal and external sources. Establishes and builds processes and structures based on business and technical requirements to channel data from multiple inputs, route appropriately and store using any combination of distributed (cloud) structures, local databases, and other applicable storage forms as required. Develops technical tools and programming that leverage artificial intelligence, machine learning and big-data techniques to cleanse, organize and transform data and to maintain, defend and update data structures and integrity on an automated basis. Creates and establishes design standards and assurance processes for software, systems and applications development to ensure compatibility and operability of data connections, flows and storage requirements. Reviews internal and external business and product requirements for data operations and activity and suggests changes and upgrades to systems and storage to accommodate ongoing needs.

Essential Duties and Responsibilities:



Translate business requirements into specifications that will be used to drive data store/data warehouse/data mart design & configuration.
Use ETL tools to load data stores/data warehouse
Provide support as required to ensure the viability & performance of enterprise data and BI environments to both internal & external users.
Ensure proper configuration management and change controls are implemented.
Must be able to perform duties with moderate to low supervision.
Design & Implement technology best practices, guidelines and repeatable processes
Maintain JIRA, Wiki and project documentation as needed.

 



5 years of relevant experience in data management, ETL, data warehousing and BI Reporting.
Minimum of 2 years' experience with data pipelines (ETL / ELT)
Demonstrated understanding of the Data Lifecycle
Knowledge of data modeling, data ingestion and ETL design.
Advanced SQL proficiency
Experience in Talend Data Integration tool.
Experience with Data Visualization tools (Tableau and Power BI a plus)
Exposure to Source Control, CI / CD, and DevOps
Knowledge of AWS technologies (EC2, S3, RDS, Redshift, etc.)
Working knowledge of Agile frameworks and Jira
Knowledge of integration with systems like Salesforce, Relational Databases, REST API, FTP/SFTP, etc.
Knowledge SSRS is a plus.
Ability to learn and use new technologies quickly & effectively.
Proven ability to communicate effectively with technical and non-technical stakeholders across multiple business units
Excellent analytical and problem-solving skills

Preferred Qualifications:



Advanced SQL proficiency
Functional experience with Talend or DBT
Advanced experience with Data Visualization tools (Tableau and Power BI)
Experience with AWS and Snowflake

Pay Range Details



 



The base pay range(s) below are provided in compliance with state speciﬁc laws. Pay ranges may be
different in other locations.



 



Colorado $90,200-$144,200 [annually] 



 



Washington $90,200-$159,500 [annually]



 



California $90,200-$174,600 [annually]



 



NYC $99,700-$174,600 [annually] 



 



The pay range above is the general base pay range for a successful candidate in the state listed.



 



The successful candidate’s actual salary/wage may be based on various factors, such as geographic
location, candidate experience and qualiﬁcations, as well as market and business considerations.



 



This role is eligible for an annual bonus based on individual and company performance, depending on
the terms of the applicable plan and the employee’s role.



 



Beneﬁts



 



Avalara’s beneﬁts for eligible employees includes company beneﬁts such as medical, dental, and
vision coverage, life, AD&D, and disability insurance, a 401(k) retirement plan, 17 days of
paid time off annually, 12 paid holidays, paid parental leave, an employee assistance program, and
subsidized transportation options for commuters.



 



All beneﬁts are subject to eligibility requirements and Avalara reserves the right to modify or
change these beneﬁts programs at any time, with or without notice, unless otherwise required by law.



Show more "
3588487283,Data Engineer,Convoso,2023-04-27,https://www.linkedin.com/jobs/view/data-engineer-at-convoso-3588487283?refId=03s6HqP%2FtPrulCjo3Ayg8A%3D%3D&trackingId=QtZTBYk0RHfm7oWy5G9%2FUQ%3D%3D&position=12&pageNum=0&trk=public_jobs_jserp-result_search-card,5919,"Who We Are:

Convoso is a leading provider of omnichannel contact center software. The company was founded on innovation and continues to push boundaries in our industry.

Headquartered in Los Angeles, the company has employees around the globe working both hybrid and remote. The company culture fosters team integrity, positive persistence, and continuous growth. (A heads up - we were awarded as Built In LA’s Best Places to Work in 2020, 2021 and 2022!)

With Convoso, the future is bright as we continue to evolve our technology.

The company’s foundational product provides the most powerful contact center software available for outbound teams. However, we are expanding our reach by relaunching an advanced version of our conversational AI product. The enhanced capabilities of our Intelligent Virtual Agent (IVA) gives our customers a competitive edge and streamlined productivity by dramatically reducing repetitive tasks. This future forward technology will allow Convoso to grow into new markets across hundreds of use cases.

Convoso is looking for people who are excited about technology and the fast growing, innovative field of IVA and AI. We are a company of motivated team players driving accelerated growth in a supportive, positive culture. We celebrate a diversity of people, ideas, and backgrounds that contribute to one shared community.

Most roles at Convoso function as “hybrid” with some opportunities for travel to in-person business events and company meetings. For remote positions, Convoso’s U.S. hiring is open to candidates who are residents of the following states: AZ, CA, CO, CT, FL, GA, IL, IN, MA, NC, NJ, NV, OH, PA, TX, UT.

The Job:

At Convoso, we’re constantly, vigilantly looking for ways to reshape the future of lead generation contact centers. Our mission is to revolutionize the call center industry by empowering agents to convert leads faster. That’s where you come in.

We are looking for … a Data Engineer with a strong database background to join our Engineering. This individual will join a dynamic team and will be critical to tuning and managing data movement across a highly distributed environment ensuring data is sourced from the right place with the right technology. You must be comfortable working with a wide range of stakeholders and functional teams. The right candidate will have a passion for discovering solutions hidden in large data sets and working with stakeholders to improve business outcomes.

Stepping into this very challenging role will mean stepping into a dynamic environment. There’ll be a steep learning curve, but we believe the future belongs to those who build it. Therefore, success for you would mean reaching your full potential in a short period of time, while doing whatever it takes to get up to speed. Success would mean having a strong ability to manage multiple projects with competing deadlines.

What You'll Be Doing:

Designing and maintaining an optimal data pipeline architecture.
Identifying, designing, and implementing internal process improvements, including re-designing infrastructure for greater scalability, optimizing data delivery, and automating manual processes.
Designing and delivering secured systems and services with high availability and reliability.
Maintain and support the current MySQL database, including the creation of new DBs, migrations, backups, and replications.
Work on implementing new dataflow processes


Who You Are:

Minimum of a Bachelor’s degree in Computer Science, MIS, or related degree and five (5) years of relevant experience, including database administration, database programming, data engineering, or a combination of education and training experience.
Strong understanding of relational databases and the SQL language, including MySQL.
Understanding of non-relational storage systems such as MongoDB, Elasticsearch, Redis, and more.
Strong problem-solving skills with an emphasis on product development.
Previous experience as a data engineer or in a similar role
Excellent written and verbal communication skills for coordinating across teams.
A drive to learn and master new technologies and techniques.
5+ years of coding knowledge and experience with several languages:
Experience with database replication, including MySQL.
Advanced working SQL knowledge and experience working with relational databases, query authoring (MySQL), and working familiarity with various databases.
Working knowledge of message queues, stream processing, and highly scalable ‘big data’ data stores.
Experience supporting and working with cross-functional teams in a dynamic environment.


Work Perks Worth The Hype:

Competitive compensation package
Stock options
100% covered premiums for employees; Medical, Dental, Basic life insurance, Long term disability
Affordable Vision plan and optional FSA
PTO, Paid Sick Time, Holidays, Bereavement time, Parental Leave
Your birthday off
401k program with generous company match
No cost Employee Assistance Program and Travel Assistance
Monthly Gym membership reimbursement
Monthly credits toward food & beverage
Company Outings
On and offsite team building events
Paid training for departments
Apple laptop (most roles)
And a team of highly experienced and kind colleagues!


HQ Office:

Casual office environment & dress
Daily catered lunches
Fully stocked kitchen (Dietary restriction-friendly)
Happy Hours
Monthly Massages
On-site Car Wash
Free Parking


Your California Privacy Rights:

As a California resident who is an applicant to be an employee of Convoso, you have certain rights under California law with respect to information collected by Convoso in the course and scope of its evaluation of your application. The types of information Convoso collects and your rights with respect to that information are contained in Convoso’s privacy policy, which you can review by going to https://www.convoso.com/privacy-policy/.
Show more "
