Job ID,Title,Company,Date,Link,Description Length,Description
3585966085,Analytics Engineer,Bumble,2023-04-28,https://www.linkedin.com/jobs/view/analytics-engineer-at-bumble-3585966085?refId=i4Ub%2FHZymisF8WNE101iiw%3D%3D&trackingId=OqJtBXdQVxAru5Wb%2BIirpA%3D%3D&position=1&pageNum=0&trk=public_jobs_jserp-result_search-card,2562,"We strongly encourage people of colour, lesbian, gay, bisexual, transgender, queer and non-binary people, veterans, parents, and individuals with disabilities to apply. Bumble is an equal opportunity employer and welcomes everyone to our team. If you need reasonable adjustments at any point in the application or interview process, please let us know.




In your application, please feel free to note which pronouns you use (For example - she/her/hers, he/him/his, they/them/theirs, etc).




Analytics Engineer




Bumble is looking to set up an analytics engineering practice. As the first of its kind, you’ll help out in terms of setting up this discipline within Bumble. We believe that analytics engineering will help us in terms of further honing in our self-service analytics strategy. We want domain analytics teams to experience more ownership over the domain data and build out data marts and to bring down their time to insights. Additionally, you’ll help us minimise our cloud costs, drive best practices across all of our data disciplines and scale our data governance.




Key Accountabilities




Drive the self-service analytics strategy for one or more business domains. Harmonisation and streamlining of reporting processes
Support the building of robust data models most in Snowflake that support our various domain teams such as community operations, product, and marketing
Focus on optimisation of our data warehouse in conjunction with our reporting platform and other sources of cloud cost consumption
Set standards and ways of working with data across Bumble, working collaboratively with other team to make this happen
Investigate and work with colleagues from other disciplines to monitor and improve data quality within the warehouse




Experience We Are Looking For




You have experience and a passion for data modelling, ETL projects
You have very strong SQL skills
You are comfortable with general data warehousing concepts
You have proven experience in terms of working with cloud data platform at previous companies
You have python experience
You have previously used dbt, data form, or similar tooling




Desired Skills And Knowledge




Used agile ways of working (Kanban, Scrum)
You have requirement gathering experience and know how to use white boarding techniques to map business processes
You have experience with BI tools / platforms such as Microstrategy, Tableau, or Looker
Any experience working within a previous (consumer) tech company
Experience working with orchestration frameworks such as Airflow
Show more "
3587236471,Data Engineer,Bobbie,2023-04-27,https://www.linkedin.com/jobs/view/data-engineer-at-bobbie-3587236471?refId=i4Ub%2FHZymisF8WNE101iiw%3D%3D&trackingId=4Z1exMXWsADgT4%2Bnr84ilw%3D%3D&position=2&pageNum=0&trk=public_jobs_jserp-result_search-card,4951,"About Bobbie

Bobbie is creating a parenting culture of confidence, not comparison. And it starts with how we choose to feed our babies. We crafted our European style infant formula with purposefully sourced, organic ingredients to give parents a product they are proud to feed their babies, direct to their doorstep. Bobbie is proud to be the only US formula that is designed to meet both FDA and EU standards.

Although 83% of parents turn to formula in the first year of their baby's life, this is the silent majority that is often shamed for not being able to exclusively breastfeed. Co-founded by two moms and created by a team of mom scientists, nutritionists, pediatricians, and lactation consultants, the Bobbie team knows first hand that there is no one size fits all for feeding. With Bobbie, we hope you can Bottle Boldly.

The Role

The Data Engineer is responsible for designing, building, and maintaining the data infrastructure that supports the company's data-driven initiatives. This includes developing and managing data pipelines, data warehouses, and data lakes; building and maintaining data processing and analytics tools; and ensuring the quality and security of the company's data. Not only will you be working closely with the Data team but you will be collaborating with Marketing, Sales, Logistics, Finance and Customer Experience.

What you will accomplish:

Design, build, and maintain the company's data infrastructure
Develop and manage data pipelines, data warehouses, and data lakes
Ensure the quality and security of the company's data
Work with cross-functional teams to understand and meet their data needs
Stay up-to-date on the latest data technologies and trends


What We Would Like You To Have

Must haves:

Advanced knowledge in Python, SQL and Githhub
Google Cloud and tools or equivalent; Cloud Functions, DataFlow, Big Query, Cloud Scheduler, Google Buckets, Pub/Sub, Datastream
ELT/ETL processes, including but not limited to: Airflow, Apache Beam, dbt
Some prior working experience as a Data Engineer


Nice to have:

2+ years of experience in a similar role
Understanding of containerization technologies such as Docker and Kubernetes to package, deploy and manage applications.
Knowledge of CI/CD tools and processes, including experience in any of the tools like Jenkins, GitLab CI/CD, and CircleCI.


You're inspired by our core values:

Be Radical - We are change makers, rule breakers and stigma shakers. We are unapologetically bold and use our megaphone for good.
Nurture the Tension - Parenthood is full of healthy tension, and so is building a company. We embrace the unknowns, practice humility and are a culture of learners.
Deliver Ounce by Ounce - Our customers have entrusted us to feed their babies. We lose sleep over the details, so they don't have to.
Don't Assume - We embrace our unique perspectives, withhold judgment, and find beauty in the paths that brought us all to Bobbie. Our strength is celebrating each other and our collective voice.


Compensation and Benefits:

Salary

San Francisco / NYC: $132,000 - $154,000
All other locations: $110,000 - $132,000


Our salary ranges are based on paying competitively for our size and industry. As a fully remote company, we adjust our salaries to match geographic location. Employees who live in a high cost-of-living city (San Francisco, NYC) have a higher salary range than employees who live elsewhere.

Our total compensation package also includes comprehensive benefits and robust equity offerings. We believe all Bobbie employees should have an option to purchase ownership in the company and benefit from what we expect will be a lot of upside growth.

Our Benefits Include

Employee medical, dental and vision insurance 100% covered by Bobbie, with options to add dependents through a subsidized pre-tax deduction
US-based work from anywhere model
401k with match
Flexible Time Off Policy
Summer Fridays (early office closure every Friday)
13 paid company holidays plus an end of year holiday office shut down
16 weeks of paid parental leave with the option to take an additional 8 months unpaid
1 year Bobbie subscription
Balance Coordinator
$75 monthly internet stipend
Co-working space reimbursement


Bobbie Personnel Privacy Policy and Notice at Collection

At Bobbie, we are committed to building a diverse and inclusive company. We seek to create a culture where everyone can belong because we believe that people do their best work when they can show up every day as their authentic selves. We welcome people of different backgrounds, experiences, abilities, and perspectives.

Bobbie is an equal opportunity employer. We do not make hiring or employment decisions on the basis of race, religion, color, national origin, gender, gender identity, sexual orientation, age, marital status, veteran status, disability status or genetic information, in compliance with applicable federal, state and local law.
Show more"
3587253770,Data Engineer,ExxonMobil,2023-04-27,https://www.linkedin.com/jobs/view/data-engineer-at-exxonmobil-3587253770?refId=i4Ub%2FHZymisF8WNE101iiw%3D%3D&trackingId=H70ztrCiPeWi87KU%2Bzn5cA%3D%3D&position=3&pageNum=0&trk=public_jobs_jserp-result_search-card,7673,"About Us




At ExxonMobil, our vision is to lead in energy innovations that advance modern living and a net-zero future. As one of the world’s largest publicly traded energy and chemical companies, we are powered by a unique and diverse workforce fueled by the pride in what we do and what we stand for.




The success of our Upstream, Product Solutions and Low Carbon Solutions businesses is the result of the talent, curiosity and drive of our people. They bring solutions every day to optimize our strategy in energy, chemicals, lubricants and lower-emissions technologies.




We invite you to bring your ideas to ExxonMobil to help create sustainable solutions that improve quality of life and meet society’s evolving needs. Learn more about our What and our Why and how we can work together.




About Houston




ExxonMobil's state-of-the-art campus north of Houston serves as home to its Upstream, Product Solutions and Low Carbon Solutions businesses and their associated service groups. The facility opened in 2014 and accommodates more than 10,000 employees and visitors.




By bringing many global functional groups together, the campus provides employees with the tools and capabilities needed today, and in the future, to achieve business objectives and accelerate the discovery of new resources, technologies and products. It was designed to foster improved collaboration, creativity and innovation and enhance the company’s ability to attract, develop and retain the top talent in the industry.




The campus is located in Spring, Texas, on 385 wooded acres immediately to the west of Interstate Highway 45 (I-45), at the intersection of I-45 and the Hardy Toll Road, approximately 25 miles from the cultural vibrancy of downtown Houston.




The campus was constructed to the highest standards of energy efficiency and environmental stewardship. Its design incorporates extensive research into best practices in building and workplace design through extensive benchmarking of the world’s top academic, research, and corporate facilities.




Learn More About What We Do In Houston Here.




What role you will play in our team




As a Senior Data Engineer, working alongside other campus’-based data engineers, you develop and maintain essential data pipelines that ingest, process, and deliver technical data for advanced analytics, visualizations, and application integration.
Responsible for streamlining data processing, data wrangling, dimensional modeling and automating data pipelines for big data.
This position will be based at ExxonMobil campus in Houston, Texas.




What You Will Do




Perform ETL, ELT operations and administration using modern tools, programming languages and systems securely and in accordance with enterprise data standards
Assemble, model, transform large complex sets of data that meet non-functional and functional business requirements into a format that can be analyzed
Automate data processing of data from multiple data sources
Develop, deploy and version control code for data consumption, reuse for APIs
Employ machine learning techniques to create and sustain data structures
Perform root cause analysis on external and internal processes and data to identify opportunity for improvement, resolve data quality issues
Lead data-related workshops with stakeholders to capture data requirements and acceptance criteria




About You




Skills and Qualifications




We are looking for someone who has technical depth and broad tool experience related to data engineering and has the following qualifications:




Minimum bachelor’s degree in: Data Science, Business Intelligence, Statistics, Computer Engineering or related field, or the equivalent combination of education, professional training, and work experience
Minimum 8 years IT/Data Professional experience with at least four years performing duties related to data engineering
English – Professional Proficiency
Expert proficiency in at least one of these programming languages: Python, NoSQL, SQL, R, C++, and competent in source code management
Build processes supporting data transformation, data structures, metadata, dependency, and workload management
Create data validation methods and data analysis tools




Preferred Knowledge / Skills / Experience




Excellent problem-solving skills and ability to learn through scattered resources
Expert proficiency with data warehouses, data pipeline technologies (e.g., Snowflake, Databricks, Airflow)
Automate routine tasks via scripts, code
Capacity to successfully manage a pipeline of duties with minimal supervision and using enterprise project management methodology (i.e. Agile)
Experience supporting and working with cross-functional teams in a dynamic environment
Modify existing reports, extracts, dashboards, and cubes as necessary
Commitment to operations integrity and ability to hold self and others accountable for results




Your Benefits




An ExxonMobil career is one designed to last. Our commitment to you runs deep: our employees grow personally and professionally, with benefits built on our core categories of health, security, finance, and life.




We offer you:




Pension Plan: Enrollment is automatic and at no cost to you. The basic benefit is a monthly annuity to be paid to you in retirement for the rest of your life
Savings Plan: You can contribute between 6% and 20% of your pay and are encouraged to enroll right away. If you contribute at least 6% to your savings plan, the Company will contribute a 7% match.
Workplace Flexibility: We have several programs such as “Flex your Day”, providing ad-hoc flexibility around when and where you work, as well as longer-term programs such as leaves of absence and part-time work
Comprehensive medical, dental, and vision plans
Culture of Health: Programs and resources to support your wellbeing
Employee Health Advisory Program: Provides confidential professional counseling for you and your family, including tools and resources promoting mental health and resiliency at no additional cost to you
Disability Plan: Income replacement for when you cannot work due to illness or injury occurring on or off the job. Enrollment is automatic and at no cost to you




More information on our Company’s benefits can be found at www.exxonmobilfamily.com.




Please note benefits may be changed from time to time without notice, subject to applicable law




Stay connected with us




Learn more at our website




Follow us on LinkedIN and Instagram




Like us on Facebook




Subscribe our channel at YouTube




Nothing herein is intended to override the corporate separateness of local entities. Working relationships discussed herein do not necessarily represent a reporting connection, but may reflect a functional guidance, stewardship, or service relationship.




Exxon Mobil Corporation has numerous affiliates, many with names that include ExxonMobil, Exxon, Esso and Mobil. For convenience and simplicity, those terms and terms like corporation, company, our, we and its are sometimes used as abbreviated references to specific affiliates or affiliate groups. Abbreviated references describing global or regional operational organizations and global or regional business lines are also sometimes used for convenience and simplicity. Similarly, ExxonMobil has business relationships with thousands of customers, suppliers, governments, and others. For convenience and simplicity, words like venture, joint venture, partnership, co-venturer, and partner are used to indicate business relationships involving common activities and interests, and those words may not indicate precise legal relationships.
Show more"
3584991452,Data Engineer,CVS Health,2023-04-28,https://www.linkedin.com/jobs/view/data-engineer-at-cvs-health-3584991452?refId=i4Ub%2FHZymisF8WNE101iiw%3D%3D&trackingId=gZqFZvrVcavMzFDe227AxQ%3D%3D&position=4&pageNum=0&trk=public_jobs_jserp-result_search-card,4115,"Job Description




Assists in the development of large-scale data structures and pipelines to organize, collect and standardize data that helps generate insights and addresses reporting needs




Applies understanding of key business drivers to accomplish own work




Uses expertise, judgment and precedents to contribute to the resolution of moderately complex problems




Leads portions of initiatives of limited scope, with guidance and direction




Writes ETL (Extract / Transform / Load) processes, designs database systems and develops tools for real-time and offline analytic processing




Collaborates with client team to transform data and integrate algorithms and models into automated processes




Uses knowledge in Hadoop architecture, HDFS commands and experience designing & optimizing queries to build data pipelines




Uses programming skills in Python, Java or any of the major languages to build robust data pipelines and dynamic systems




Builds data marts and data models to support clients and other internal customers




Integrates data from a variety of sources, assuring that they adhere to data quality and accessibility standards




Pay Range




The typical pay range for this role is:




Minimum: $ 70,000




Maximum: $ 140,000




Please keep in mind that this range represents the pay range for all positions in the job grade within which this position falls. The actual salary offer will take into account a wide range of factors, including location.




Required Qualifications




1+ years of progressively complex related experience




Experience with bash shell scripts, UNIX utilities & UNIX Commands




Preferred Qualifications




Ability to leverage multiple tools and programming languages to analyze and manipulate data sets from disparate data sources




Ability to understand complex systems and solve challenging analytical problems




Strong problem-solving skills and critical thinking ability




Strong collaboration and communication skills within and across teams




Knowledge in Java, Python, Hive, Cassandra, Pig, MySQL or NoSQL or similar




Knowledge in Hadoop architecture, HDFS commands and experience designing & optimizing queries against data in the HDFS environment




Experience building data transformation and processing solutions




Has strong knowledge of large-scale search applications and building high volume data pipelines




Education




Bachelor's degree or equivalent work experience in Computer Science, Engineering, Machine Learning, or related discipline




Master’s degree or PhD preferred




Business Overview




Bring your heart to CVS Health Every one of us at CVS Health shares a single, clear purpose: Bringing our heart to every moment of your health. This purpose guides our commitment to deliver enhanced human-centric health care for a rapidly changing world. Anchored in our brand — with heart at its center — our purpose sends a personal message that how we deliver our services is just as important as what we deliver. Our Heart At Work Behaviors™ support this purpose. We want everyone who works at CVS Health to feel empowered by the role they play in transforming our culture and accelerating our ability to innovate and deliver solutions to make health care more personal, convenient and affordable. We strive to promote and sustain a culture of diversity, inclusion and belonging every day. CVS Health is an affirmative action employer, and is an equal opportunity employer, as are the physician-owned businesses for which CVS Health provides management services. We do not discriminate in recruiting, hiring, promotion, or any other personnel action based on race, ethnicity, color, national origin, sex/gender, sexual orientation, gender identity or expression, religion, age, disability, protected veteran status, or any other characteristic protected by applicable federal, state, or local law. We proudly support and encourage people with military experience (active, veterans, reservists and National Guard) as well as military spouses to apply for CVS Health job opportunities.
Show more"
