Job ID,Title,Company,Date,Link,Description Length,Description
3590394666,Big Data Engineer,Samsung Electronics America,2023-04-28,https://www.linkedin.com/jobs/view/big-data-engineer-at-samsung-electronics-america-3590394666?refId=i4Ub%2FHZymisF8WNE101iiw%3D%3D&trackingId=MBkPgI3iA1LTxEDI0ShzcQ%3D%3D&position=10&pageNum=0&trk=public_jobs_jserp-result_search-card,9325,"Position Summary





Making the future is everyday life at Samsung. We’re seeking innovators who are called to not just change the world, but build a better one. We enable the best technology hardware on the planet, but our best is always a prototype for something better and our people thrive with a driven mindset – better builds on better. We believe that innovation and growth are driven by an inclusive culture and a diverse workforce. We aim to create a global team where everyone belongs and has equal opportunities, inspiring our talent to be their true selves. Together, we are building a better tomorrow for our customers, partners and communities.





Role and Responsibilities





Data Engineers form an important part of the Data Analytics Team within Samsung Care Organization. They have experience with ETL design, coding, and testing as well as engineering software platforms and large-scale data infrastructures. Big Data Engineers should have the capability to architect highly scalable end-to-end pipeline using different open source tools, including building and operationalizing high-performance algorithms.

Big Data Engineers understand how to apply technologies to solve big data problems on cloud and on premise systems with expert knowledge in programming languages like Python, Linux shell scripts, SQL and technologies like Hive, Impala, Presto and Spark.

Big data engineers implement complex big data projects with a focus on collecting, parsing, managing, analyzing, and visualizing large sets of data to turn information into actionable deliverables across customer-facing platforms. They have a strong aptitude to decide on the needed hardware and software design and can guide the development of such designs through both proof of concepts and complete implementations.

Additional qualifications should include:



Experience interacting with Data Analysts and Stakeholders to understand the project scope and requirements
Tune big data solutions to improve performance and end-user experience
Proficient in designing efficient and robust data workflows
Documenting requirements as well as resolve conflicts or ambiguities
Experience working in teams and collaborate with others to clarify requirements
Excellent oral and written communication skills.
Experience in creating architecture for the ETL processes.






Responsibilities and Duties:


Understand and document scope and requirements through interactions with analysts and stakeholders
Translate complex functional and technical requirements into detailed design
Design for now and future success
Design and Develop scalable industry standard ETL pipelines using big data technologies.
Loading from disparate data sets. by leveraging various big data technologies EMR, Hive, Spark. Presto etc.
Code and query Optimization.
Design and implement data modeling
High-speed querying using in-memory technologies such as Spark.
Following and contributing best engineering practice for source control, release management, deployment etc.
Production support, job scheduling/monitoring, ETL data quality, data freshness reporting






Background/Experience Required:

Bachelors or Masters in Computer Engineering.

4 years of experience in the Big data Solutions such as pyspark, python, hive and experience on AWS.





Necessary Skills and Attributes:


4+ years of experience writing complex SQL queries (Hive QL/Spark SQL preferred).
3+ years of Python development experience
3+ years of demonstrated technical proficiency with Hadoop and big data projects
3+ years of hands on development experience on developing ETL pipelines
Fluent in writing shell scripts [bash]
Experience working with AWS components [EMR, S3]
Working experience in Apache Airflow
Writing high-performance, reliable and maintainable code.
Knowledge and ability to implement workflow/schedulers within Oozie
Knowledge of Data Modelling Concepts
Analytical and problem-solving skills, applied to Big Data domain
Proven understanding and hands on experience with Hadoop, Hive, Pig, Presto, and Spark
Good aptitude in multi-threading and concurrency concepts.
B.S. or M.S. in Computer Science or Engineering




Demonstrated ability to interact at all levels within customer's organizations.   The ability to negotiate with and convince others, in a potentially adversarial environment, including customer leadership, directors and managers with opposing views to accept/approve plans, technical and project recommendations. The ability to plan, organize and prioritize multiple strategic programs and simultaneous performance objectives. The ability to write, read, interpret, explain and act based on a thorough understanding of technical documents, engineering materials and contracts or related documents.  Ability to make professional sales and business presentations in writing, through email, reports, or orally, including complex business and technical matters to an audience of high technical skills, management and operational experience. Ability to support a cross-functional Samsung team to achieve customer contracted objectives and specific team goals within established time frames and requirements.  Assist in and if needed direct the Samsung team in lab and field trials related to introduction of products sold to the customer.



Physical/Mental Demands:

Work is generally performed in an office environment. Operate a computer keyboard and view a video display terminal between more than 50% of work time, including prolonged periods of time. Requires considerable work utilizing high visual acuity / detail, numeric / character distinction and moderate hand / finger dexterity. The movement and transportation of equipment, most of the time is under 25 pounds. Performs work under time schedules and stress which are normally periodic or cyclical, including time sensitive deadlines, intellectual challenges and project management deadlines. Machines, tools, equipment, and work aids include PC’s, printers, copiers, faxes and other equipment commonly associated with an office work area. May require working additional hours beyond normal schedule. Travel varies depending on position.







Skills and Qualifications





Background/Experience Required:

Bachelors or Masters in Computer Engineering.

4 years of experience in the Big data Solutions such as pyspark,python, hive and experience on AWS.





Necessary Skills and Attributes:



3+ years of experience writing complex SQL queries (Hive QL/Spark SQL preferred).
3+ years of Python development experience
3+ years of demonstrated technical proficiency with Hadoop and big data projects
2+ years of hands on development experience on developing ETL pipelines
Fluent in writing shell scripts [bash]
Experience working with AWS components [EMR, S3]
Working experience in Apache Airflow
Writing high-performance, reliable and maintainable code.
Knowledge and ability to implement workflow/schedulers within Oozie
Knowledge of Data Modelling Concepts
Analytical and problem-solving skills, applied to Big Data domain
Proven understanding and hands on experience with Hadoop, Hive, Pig, Impala, and Spark
Good aptitude in multi-threading and concurrency concepts.
B.S. or M.S. in Computer Science or Engineering

























* Please visit Samsung membership to see Privacy Policy, which defaults according to your location. You can change Country/Language at the bottom of the page. If you are European Economic Resident, please click here.



At Samsung, we believe that innovation and growth are driven by an inclusive culture and a diverse workforce. We aim to create a global team where everyone belongs and has equal opportunities, inspiring our talent to be their true selves. Together, we are building a better tomorrow for our customers, partners, and communities.



* Samsung Electronics America, Inc. and its subsidiaries are committed to employing a diverse workforce, and  provide Equal Employment Opportunity for all individuals regardless of race, color, religion, gender, age, national origin, marital status, sexual orientation, gender identity, status as a protected veteran, genetic information, status as a qualified individual with a disability, or any other characteristic protected by law.



COVID-19 Vaccine Mandate

Samsung Electronics America requires all employees to be fully vaccinated against COVID-19, unless a medical or religious exemption, or an exemption required under state/local law, is approved. Offers of employment are contingent upon proof that a candidate is fully vaccinated or qualifies for an exemption.  More details on how to apply for an exemption are provided after the application process is complete.



Reasonable Accommodations for Qualified Individuals with Disabilities During the Application Process

Samsung Electronics America is committed to providing reasonable accommodations for qualified individuals with disabilities in our job application process. If you have a disability and require a reasonable accommodation in order to participate in the application process, please contact our Reasonable Accommodation Team (855-557-3247) or SEA_Accommodations_Ext@sea.samsung.com for assistance. This number is for accommodation requests only and is not intended for general employment inquiries.



Show more"
3589635372,Data Engineer (Alteryx),Professional Diversity Network,2023-04-27,https://www.linkedin.com/jobs/view/data-engineer-alteryx-at-professional-diversity-network-3589635372?refId=i4Ub%2FHZymisF8WNE101iiw%3D%3D&trackingId=ugzRvUuOwpH91EgmJ1JwYw%3D%3D&position=12&pageNum=0&trk=public_jobs_jserp-result_search-card,6826,"Company Introduction 9th Way Insignia is a service-disabled veteran-owned company bringing transformative technology to our government customers so they can achieve their missions. Our specialties include cybersecurity, cloud modernization, software development, data analytics, enterprise architecture, enterprise IT, process automation, and artificial intelligence. Learn more about 9th Way Insignia at https://9thwayinsignia.com. Team (Project) Introduction The VA's Office of Information Security (OIS) utilizes the leading data science and automation platform, Alteryx, to develop automated data pipelines that populate the agency's cybersecurity data warehouse. The data warehouse supports analytics and compliance reporting for the agency's enterprise information systems and is a critical component of the VA's Information Security and Risk Management Directorate. Operated on-premises and supporting approximately 2,000 users, the OIS data automation platform's architecture consists of Alteryx Server, MongoDB Enterprise, Microsoft SQL Server, and the Microsoft Power Platform - including Power BI and Power Automate. 9th Way Insignia is looking for an accomplished Data Engineer/Alteryx Developer to join our highly motivated and dedicated team of data engineering and analytic professionals. We are designing and delivering automated data pipelines using process automation tools to create workflows that cleanse and prepare data before populating the cybersecurity data warehouse. We also develop data analytic tools and dashboards that inspect cyber data for evidence of non-compliance with established security controls and automatically alert system owners to mitigate and resolve these issues. Professional Level Information: The Data Engineer/Alteryx Developer position aligns as an Engineer - Level 3, at 9th Way Insignia. An Engineer-3 plans and directs research and development on complex projects, leads design and development efforts, and makes recommendations affecting cost decisions and architectural design components. An Engineer-3 oversees the design, development, implementation, and analysis of technical products and systems, has broad knowledge of engineering methodologies, and assists in complex problem resolution. An Engineer-3 has strong technical skills and background, a knack for learning new technologies, and a blend of problem-solving skills and innovative thinking to resolve a wide variety of technical challenges. Functional Job (LCAT) Information: The Data Engineer will be using the Alteryx data science and automation platform to prepare and cleanse data for populating a data warehouse used for cybersecurity business intelligence reporting. This is an exciting opportunity to work on a team supporting cybersecurity analytics and robotic process automation using your data engineering and data wrangling skills to help create the data foundation needed to support this important work. You and your teammates will be working together to implement state-of-the-art intelligent automation of processes and data preparation using advanced tools like Alteryx, UiPath, and Power BI. Qualified candidates should be experienced with ETL scripting, data prep, and cleanse of file-based and SQL-based data. Experience creating data automation workflows with the Alteryx platform is required. Experience developing visually compelling dashboards using Power BI is a plus. You will help the development team by determining how data will be harvested from available cybersecurity information systems, preparing the data for use, and making it available to the analytics development team by developing automated workflows in Alteryx. You will be familiar with ETL concepts and techniques and have used Alteryx to automate data preparation workflows. Responsibilities:

Design and develop workflows that consume data from file based, SQL, and REST API sources.

ETL scripting, data prep, and cleanse of file-based and SQL-based data.

Write complex SQL queries with multiple joins to automate/manipulate these extracts in Alteryx

Troubleshoot automation programs/reports already created in Alteryx

Work with internal customers to refine and clarify requirements

Optimize our end-to-end use of Alteryx from how we take in data from different sources to how we distribute outputs

Make use of Alteryx server to schedule, monitor, and enhance workflow performance

Serve as the back-up admin for Alteryx Server and MongoDB Requirements:

BA in MIS, BIS, or other IT concentration, BSCS, or related degree

Minimum of 3 years working with databases, data modeling, data management, and data curation

3-5 years of Experience using Alteryx Designer to create data automation workflows

Data preparation experience using SQL or scripting languages to create ETL processes, perform data cleansing, check data integrity

Experience writing SQL queries against any RDBMS with query optimization

SQL RDBMS experience in Microsoft SQL Server.

Minimum 3 years using Alteryx server

Experience performing installation, migration and/or upgrade of Alteryx Servers

Experience Using And Managing MongoDB Preferred/Desired

Experience in Microsoft Power BI

Some experience in UiPath Salary Range: Salary: $96,370.33 to $144,000 per year 9th Way Insignia's range for this job level is a general guideline only and not a guarantee of compensation or salary. Additional factors considered in extending an offer include (but are not limited to) responsibilities of the job, education, experience, knowledge, skills, and abilities, as well as internal equity, alignment with market data, applicable bargaining agreement (if any), or other law. Clearance, background investigation: Applicants selected will be subject to a security investigation and may need to meet eligibility requirements for access to classified information.

Tier1 / Low Risk Location: 100% telework. 9th Way Insignia reserves the right to adjust work location based upon mission requirements. COVID-19: The COVID-19 vaccination requirement for federal employees and contractors pursuant to Executive Order 14043 does not currently apply. Some jobs, however, may be subject to agency- or job-specific vaccination requirements. Legal: We're an equal employment opportunity/affirmative action employer that empowers our people to fearlessly drive change - no matter their race, color, ethnicity, religion, sex (including pregnancy, childbirth, lactation, or related medical conditions), national origin, ancestry, age, marital status, sexual orientation, gender identity and expression, disability, veteran status, military or uniformed service member status, genetic information, or any other status protected by applicable federal, state, local, or international law. hr@9th-way.comPDN-990305dd-e4b5-41d6-89b5-2864009db8f1
Show more"
3571650945,Data Engineer,Allegis Group,2023-04-28,https://www.linkedin.com/jobs/view/data-engineer-at-allegis-group-3571650945?refId=i4Ub%2FHZymisF8WNE101iiw%3D%3D&trackingId=ppxqd6hKOAj%2BvEPUnqRHqQ%3D%3D&position=13&pageNum=0&trk=public_jobs_jserp-result_search-card,2563,"Title: Data Engineer

Top Skills

Strong Python (for OOP)
Postgres Database built on AWS
Data Warehousing
Light Tableau experience


Work Type: 6-12 month contract with potential to convert full-time

Description

Opportunity to support data engineering needs at one of the top IT companies, located in the Bay Area.

Engaging with business and analytic teams to understand data requirements and translating those requirements into technical solutions.
Standardizing and implementing operational processes for data delivery, maintenance, and ensuring data accuracy.
Automating technical solutions the integrate data from a variety of data sources.
Spotting and implementing optimizations across data usage from multidisciplinary teams.
Ensuring data health and quality through monitoring and alerting tools.


Proven Experience In

Designing, building and maintaining data marts.
Programming in Python, SQL (Emphasis on Postgres), and writing efficient and complex queries and ETL jobs that span Terabytes of data
Working with Postgres Databases built on AWS or other distributed data technologies
Implementing data pipelines and applications in a general programming language such as Python
Working with DevOps and Agile methodologies such as JIRA, Jenkins, Gitlab and Airflow
Understanding of ETL, database and Object Oriented Programming Concepts (OOP)
Analyzing logs in tool such as Splunk
Debugging and reconciling complex systems and integrations spanning tools and teams
Building and enhancing existing Tableau dashboards with minimal support
Picking up and embracing new technologies and languages
Would be nice to have an exposure to large-scale data warehouse solutions such as Snowflake and Redshift


This opportunity cannot support c2c at this time.

About TEKsystems

We're partners in transformation. We help clients activate ideas and solutions to take advantage of a new world of opportunity. We are a team of 80,000 strong, working with over 6,000 clients, including 80% of the Fortune 500, across North America, Europe and Asia. As an industry leader in Full-Stack Technology Services, Talent Services, and real-world application, we work with progressive leaders to drive change. That's the power of true partnership. TEKsystems is an Allegis Group company.

The company is an equal opportunity employer and will consider all applications without regards to race, sex, age, color, religion, national origin, veteran status, disability, sexual orientation, gender identity, genetic information or any characteristic protected by law.
Show more"
3587293503,Software Engineer - Python,Bixal,2023-04-28,https://www.linkedin.com/jobs/view/software-engineer-python-at-bixal-3587293503?refId=i4Ub%2FHZymisF8WNE101iiw%3D%3D&trackingId=quLcC%2BzjrG6D9RHNKGylHg%3D%3D&position=14&pageNum=0&trk=public_jobs_jserp-result_search-card,5076,"Who we are




Bixal is a mission-driven, woman-owned small business determined to improve people's lives through human-centered strategies and transformative technologies, with a firm belief that everyone has the right to an effective government. 




We deliver on this belief by partnering with leading Federal agencies to design, develop, and deliver powerful customer experiences through holistic digital product solutions and strategic communications initiatives––bringing a high standard and unique creative energy to our clients––and our wonderfully diverse culture is what makes it all possible.




Bixal unites different people with different perspectives from all over the world! We provide our team with an open and empowered environment where collaboration thrives and solutions flourish.




Location




This role has the ability to work remotely within the United States with occasional travel to the client site in the Washington DC metropolitan area for onsite meetings. You must be legally authorized to work in the USA. Bixal does not provide visa sponsorship.




What will you do?




As a Software Engineer, you will join a diverse team of software architects, engineers, and developers creating innovative solutions positively impacting client operations and employee experiences. You will develop Django, Python, Web Application solutions supporting the CFPB Application Development and Design teams to maintain ongoing production needs as well as create new offerings on consumerfinance.gov and related digital platforms.




Important note




This is a full-time proposal position contingent on contract award.




Responsibilities




Provide software development, continuous integration, software delivery, systems administration, software quality, and systems documentation support to the CFPB’s digital assets, including the Bureau’s public-facing web site, consumerfinance.gov , as well as internal software tools;
Meet with the Application Development Team and content contributors to develop and discuss strategies and plans for CFPB’s web products, to analyze web content needs, and to propose ways the CFPB's web products can address those needs;
Create web applications and web services using various web programming languages, frameworks, and databases including Python, SQL, Django, MySQL, PostgreSQL, and ElasticSearch;
Assist with the management and development of CFPB’s website, including configuring and modifying the Wagtail CMS;
Assist in both the architectural and visual modernization and maintenance of the CFPB 's website at consumerfinance.gov ;
Assist in building a strong technical foundation in build, release, and production using continuous integration tools such as Jenkins;
Engage with various CFPB personnel to understand requirements in order to develop better software for the Bureau and identify new ways in which the development team can easily solve CFPB issues;
Collaborate with CFPB on the design, development, and data teams to build valuable tools that benefit the CFPB’s day-to-day operations and broader missions;
Support, maintain and build out the front-end code base using 508- compliant CSS, HTML, JavaScript, React, and related frameworks;
Provide training on a variety of systems development methodologies, best-practices, and tools along with insight into new technologies and solutions that could help the Application Team and the Bureau at large; and
Assist in the development of Use Cases, Requirements Definition Documents, User and Administration Manuals, Detailed Design Specifications, and Training Manuals and Plans.




Qualifications




Bachelor's degree.
5 years of relevant working experience.
Develops, tests, implements, and maintains web-based application systems.
Troubleshoots system problems and issues and looks for ways to improve the application.
Has knowledge of commonly- used concepts, practices, and procedures, including: Python, Django, Cloud services, such as AWS, Container technology, such as Docker, and Build automation deployment.
Ability to undergo a background investigation by the U.S. government and meet eligibility requirements for suitability.




Perks & benefits




Competitive base salary




Flex hours




Work from home flexibility




401K with matching incentive




Parental Leave




Medical/dental/vision benefits




Flex Spending Account




Company provided short-term disability




Company provided life insurance




Commuter benefits




Generous PTO




11 Paid holidays




Professional development opportunities




New business referral bonus




Bixal is an equal opportunity and affirmative action employer. It ensures equal employment opportunity without discrimination or harassment based on race, color, religion, sex (including pregnancy, childbirth, or related medical conditions), sexual orientation, gender identity or expression, age, disability, national origin, marital or domestic/civil partnership status, genetic information, citizenship status, veteran status, or any other characteristic protected by law.
Show more"
