Job ID,Title,Company,Date,Link,Description Length,Description
3590397227,Big Data Engineer,Samsung Electronics America,2023-04-28,https://www.linkedin.com/jobs/view/big-data-engineer-at-samsung-electronics-america-3590397227?refId=i4Ub%2FHZymisF8WNE101iiw%3D%3D&trackingId=YJxpS1r0SOQw2Kyoq30EJQ%3D%3D&position=5&pageNum=0&trk=public_jobs_jserp-result_search-card,9325,"Position Summary





Making the future is everyday life at Samsung. We’re seeking innovators who are called to not just change the world, but build a better one. We enable the best technology hardware on the planet, but our best is always a prototype for something better and our people thrive with a driven mindset – better builds on better. We believe that innovation and growth are driven by an inclusive culture and a diverse workforce. We aim to create a global team where everyone belongs and has equal opportunities, inspiring our talent to be their true selves. Together, we are building a better tomorrow for our customers, partners and communities.





Role and Responsibilities





Data Engineers form an important part of the Data Analytics Team within Samsung Care Organization. They have experience with ETL design, coding, and testing as well as engineering software platforms and large-scale data infrastructures. Big Data Engineers should have the capability to architect highly scalable end-to-end pipeline using different open source tools, including building and operationalizing high-performance algorithms.

Big Data Engineers understand how to apply technologies to solve big data problems on cloud and on premise systems with expert knowledge in programming languages like Python, Linux shell scripts, SQL and technologies like Hive, Impala, Presto and Spark.

Big data engineers implement complex big data projects with a focus on collecting, parsing, managing, analyzing, and visualizing large sets of data to turn information into actionable deliverables across customer-facing platforms. They have a strong aptitude to decide on the needed hardware and software design and can guide the development of such designs through both proof of concepts and complete implementations.

Additional qualifications should include:



Experience interacting with Data Analysts and Stakeholders to understand the project scope and requirements
Tune big data solutions to improve performance and end-user experience
Proficient in designing efficient and robust data workflows
Documenting requirements as well as resolve conflicts or ambiguities
Experience working in teams and collaborate with others to clarify requirements
Excellent oral and written communication skills.
Experience in creating architecture for the ETL processes.






Responsibilities and Duties:


Understand and document scope and requirements through interactions with analysts and stakeholders
Translate complex functional and technical requirements into detailed design
Design for now and future success
Design and Develop scalable industry standard ETL pipelines using big data technologies.
Loading from disparate data sets. by leveraging various big data technologies EMR, Hive, Spark. Presto etc.
Code and query Optimization.
Design and implement data modeling
High-speed querying using in-memory technologies such as Spark.
Following and contributing best engineering practice for source control, release management, deployment etc.
Production support, job scheduling/monitoring, ETL data quality, data freshness reporting






Background/Experience Required:

Bachelors or Masters in Computer Engineering.

4 years of experience in the Big data Solutions such as pyspark, python, hive and experience on AWS.





Necessary Skills and Attributes:


4+ years of experience writing complex SQL queries (Hive QL/Spark SQL preferred).
3+ years of Python development experience
3+ years of demonstrated technical proficiency with Hadoop and big data projects
3+ years of hands on development experience on developing ETL pipelines
Fluent in writing shell scripts [bash]
Experience working with AWS components [EMR, S3]
Working experience in Apache Airflow
Writing high-performance, reliable and maintainable code.
Knowledge and ability to implement workflow/schedulers within Oozie
Knowledge of Data Modelling Concepts
Analytical and problem-solving skills, applied to Big Data domain
Proven understanding and hands on experience with Hadoop, Hive, Pig, Presto, and Spark
Good aptitude in multi-threading and concurrency concepts.
B.S. or M.S. in Computer Science or Engineering




Demonstrated ability to interact at all levels within customer's organizations.   The ability to negotiate with and convince others, in a potentially adversarial environment, including customer leadership, directors and managers with opposing views to accept/approve plans, technical and project recommendations. The ability to plan, organize and prioritize multiple strategic programs and simultaneous performance objectives. The ability to write, read, interpret, explain and act based on a thorough understanding of technical documents, engineering materials and contracts or related documents.  Ability to make professional sales and business presentations in writing, through email, reports, or orally, including complex business and technical matters to an audience of high technical skills, management and operational experience. Ability to support a cross-functional Samsung team to achieve customer contracted objectives and specific team goals within established time frames and requirements.  Assist in and if needed direct the Samsung team in lab and field trials related to introduction of products sold to the customer.



Physical/Mental Demands:

Work is generally performed in an office environment. Operate a computer keyboard and view a video display terminal between more than 50% of work time, including prolonged periods of time. Requires considerable work utilizing high visual acuity / detail, numeric / character distinction and moderate hand / finger dexterity. The movement and transportation of equipment, most of the time is under 25 pounds. Performs work under time schedules and stress which are normally periodic or cyclical, including time sensitive deadlines, intellectual challenges and project management deadlines. Machines, tools, equipment, and work aids include PC’s, printers, copiers, faxes and other equipment commonly associated with an office work area. May require working additional hours beyond normal schedule. Travel varies depending on position.







Skills and Qualifications





Background/Experience Required:

Bachelors or Masters in Computer Engineering.

4 years of experience in the Big data Solutions such as pyspark,python, hive and experience on AWS.





Necessary Skills and Attributes:



3+ years of experience writing complex SQL queries (Hive QL/Spark SQL preferred).
3+ years of Python development experience
3+ years of demonstrated technical proficiency with Hadoop and big data projects
2+ years of hands on development experience on developing ETL pipelines
Fluent in writing shell scripts [bash]
Experience working with AWS components [EMR, S3]
Working experience in Apache Airflow
Writing high-performance, reliable and maintainable code.
Knowledge and ability to implement workflow/schedulers within Oozie
Knowledge of Data Modelling Concepts
Analytical and problem-solving skills, applied to Big Data domain
Proven understanding and hands on experience with Hadoop, Hive, Pig, Impala, and Spark
Good aptitude in multi-threading and concurrency concepts.
B.S. or M.S. in Computer Science or Engineering

























* Please visit Samsung membership to see Privacy Policy, which defaults according to your location. You can change Country/Language at the bottom of the page. If you are European Economic Resident, please click here.



At Samsung, we believe that innovation and growth are driven by an inclusive culture and a diverse workforce. We aim to create a global team where everyone belongs and has equal opportunities, inspiring our talent to be their true selves. Together, we are building a better tomorrow for our customers, partners, and communities.



* Samsung Electronics America, Inc. and its subsidiaries are committed to employing a diverse workforce, and  provide Equal Employment Opportunity for all individuals regardless of race, color, religion, gender, age, national origin, marital status, sexual orientation, gender identity, status as a protected veteran, genetic information, status as a qualified individual with a disability, or any other characteristic protected by law.



COVID-19 Vaccine Mandate

Samsung Electronics America requires all employees to be fully vaccinated against COVID-19, unless a medical or religious exemption, or an exemption required under state/local law, is approved. Offers of employment are contingent upon proof that a candidate is fully vaccinated or qualifies for an exemption.  More details on how to apply for an exemption are provided after the application process is complete.



Reasonable Accommodations for Qualified Individuals with Disabilities During the Application Process

Samsung Electronics America is committed to providing reasonable accommodations for qualified individuals with disabilities in our job application process. If you have a disability and require a reasonable accommodation in order to participate in the application process, please contact our Reasonable Accommodation Team (855-557-3247) or SEA_Accommodations_Ext@sea.samsung.com for assistance. This number is for accommodation requests only and is not intended for general employment inquiries.



Show more"
3589773977,Data Engineer,Spencer's,2023-04-27,https://www.linkedin.com/jobs/view/data-engineer-at-spencer-s-3589773977?refId=i4Ub%2FHZymisF8WNE101iiw%3D%3D&trackingId=ThturK7ut7%2BUI5hN%2FVobZg%3D%3D&position=6&pageNum=0&trk=public_jobs_jserp-result_search-card,2728,"Overview




Job Description




We are authentic, professional providers of fun, focused on building a Great Place To Work For All by staying true to our mission: 'Life's a Party, We're Makin' It Fun!' and 'So Much Fun It's Scary!'




At Spencer's and Spirit Halloween, we do the right thing always-integrity, fairness, respect, and transparency are our foundation. You will find our culture to be inclusive, passionate, resilient, and one that values differences and embraces all.




One Team / One Goal




We are leaders and owners of our business success. Whether it's developing new and exclusive costumes, quality testing products, or implementing technology solutions, our teams understand the value of working collaboratively to embrace change through innovation, curiosity, and thoughtfulness.




We Offer a Comprehensive Benefits Package That Includes




Flexible work environment
Career advancement
Competitive base salary
Bonus opportunity
Vacation, Personal, Sick and Holiday pay
Medical, Dental, Vision, Disability, Life and AD&D insurance
401k with a company match
30% merchandise discount




Responsibilities




Data Engineer to optimize our data integration at scale. Inside our Data Integration team, you will be designing pipelines and warehouses to model data from multiple sources that will allow us to derive business insight. Using Azure and other open-source technologies, such as Azure Data Factory and PySpark, you will design and build our next-generation ETL pipelines and data models.




Build data pipelines and python-based ETL tools for acquiring, processing, and delivering data
Develop data models and schemas in our data warehouse that enable performant, intuitive analysis
Handle the challenges that come with managing terabytes of data
Collaborate with business leaders and analysts to define key metrics and build reporting to monitor and understand company performance
Develop the server applications and APIs that are used by our Data Team




Qualifications




Bachelor's degree or higher in Computer Science, Computer Engineering, Information Technology or related field
Fluent in several programming languages such as Python, R, or Scala
6+ years of work experience in building ETL pipelines in production data processing and analysis
Experience designing SQL tables, choosing indexes, tuning queries, and optimizations across different functional environments.
Hands-on experience writing complex SQL queries and using a BI tool
Experience with data lakes and designing and maintaining data solutions using Spark and Azure serverless services such as ADF
Familiarity with data ingestion APIs, data sharing technologies, and warehouse infrastructure and development
Show more"
3589722677,Data Engineer,SGA Inc.,2023-04-27,https://www.linkedin.com/jobs/view/data-engineer-at-sga-inc-3589722677?refId=i4Ub%2FHZymisF8WNE101iiw%3D%3D&trackingId=pWff8c5%2B0F1uR%2BflBgW60w%3D%3D&position=8&pageNum=0&trk=public_jobs_jserp-result_search-card,4684,"Software Guidance & Assistance, Inc., (SGA), is searching for a Data Engineer for a CONTRACT assignment with one of our premier SaaS clients in San Jose, CA or Austin, TX.

Client is looking for a data engineer to build the foundational data sets and analytical reports for the B2B customer journey analytics. The data sets and reports will provide quantitative and qualitative analysis for acquisition, engagement, and retention. In addition, the candidate will contribute to cross-functional projects to help business achieve its potential in terms of revenue, customer success, and operational excellence. For this role, we are looking for an ambitious and driven individual - an analytical with outstanding communication skills, high initiative, and strong leadership potential

Responsibilities

Design and develop new systems and tools to enable folks to consume and understand data faster, along with maintain and enhancing existing ones

Analyze the business needs, profile large data sets, design, develop and tune data products on big data platforms (Hadoop, Databricks) with emphasis on data quality and performance

Design, build and launch extremely efficient & reliable data pipelines to move data into and out of the Data Warehouse

Build foundational data sets and reporting solutions and make them available for consumption through dash boards and ad hoc reports

Develop and extend data models, processes, standards, frameworks, and reusable components for various data engineering functions/areas.

Transform and migrate on-prem hosted data applications to cloud platform

Collaborate with key partners including product marketing teams, sales and support teams, engineering leads, architects, BSA's & program managers

Create dashboards in tableau and excel Modelling in Excel.

Write complex SQL queries that help client identify and measure the non-genuine software base.

Apply business logic to determine categorize the non-genuine base into opportunities

Use Big Data best practices to help scale the piracy conversion program

Create dashboards in tableau

Apply statistical methodologies and data mining skill sets on large volume of data

Analyze data and provide insights to senior executives.

Required

Required Skills

BA/BS in Computer Science, Engineering, Mathematics, or other technical fields.

Proven experience of 7 years or more

Experience with Databricks, Hadoop, Hive, HDFS, and Big Data technologies

Experience with Databricks data science workspace, Presto, Tidal and Oozie workflows

Highly proficient in writing Apache Spark and Python queries

Good knowledge writing UDF's in Hive and Spark

Advanced working SQL knowledge and experience working with Cloud columnar databases,

ACID transactions, Spark MLib, Machine Learning for tabular data

Excellent knowledge about ETL processes like Sqoop, Snap logic and Alteryx

Familiarity with cloud environments (AWS, Azure)

Sound knowledge of UNIX and shell scripting

Proficient in Excel, Power BI and Tableau

Familiarity with processes supporting data transformation, data structures, metadata, dependency and workload management

Knowledge about the best engineering practices such as Jira, version control system, CI/CD, code review, pair programming

Ability to quickly learn about Client's business processes, products, data platforms and various tools

Ability to synthesize information across a wide variety of data sources including Sales Force,

Client's analytics, Campaign systems, Client's internal business systems, SAP, Salesforce, Microsoft Dynamics etc.

Able to communicate effectively with business stake holders, engineers, and users

SQL Expertise.

Hadoop expertise.

Can work in hive, pig etc

Power Pivot expertise a must

Understanding of statistics concepts

Ability to interpret data and present

Excellent written and verbal communication skills

Preferred Skills

Preferred Skills

Masters is preferred

SGA is a technology and resource solutions provider driven to stand out. We are a women-owned business. Our mission: to solve big IT problems with a more personal, boutique approach. Each year, we match consultants like you to more than 1,000 engagements. When we say let's work better together, we mean it. You'll join a diverse team built on these core values: customer service, employee development, and quality and integrity in everything we do. Be yourself, love what you do and find your passion at work. Please find us at .

EEO Employer: Race, Color, Sex, Sexual Orientation, Gender Identity, Religion, National Origin, Disability, Veteran Status, Age, Marital Status, Pregnancy, Genetic Information, or Other Legally Protected Status.
Show more"
3590355475,Data Engineer,Spencer's,2023-04-28,https://www.linkedin.com/jobs/view/data-engineer-at-spencer-s-3590355475?refId=i4Ub%2FHZymisF8WNE101iiw%3D%3D&trackingId=Cp%2Fl%2BSOxb0gOBLpHJXUSBQ%3D%3D&position=9&pageNum=0&trk=public_jobs_jserp-result_search-card,2757,"Overview




Job Description




We are authentic, professional providers of fun, focused on building a Great Place To Work For All by staying true to our mission: 'Life's a Party, We're Makin' It Fun!' and 'So Much Fun It's Scary!'




At Spencer's and Spirit Halloween, we do the right thing always-integrity, fairness, respect, and transparency are our foundation. You will find our culture to be inclusive, passionate, resilient, and one that values differences and embraces all.




One Team / One Goal




We are leaders and owners of our business success. Whether it's developing new and exclusive costumes, quality testing products, or implementing technology solutions, our teams understand the value of working collaboratively to embrace change through innovation, curiosity, and thoughtfulness.




We Offer a Comprehensive Benefits Package That Includes




Flexible work environment
Career advancement
Competitive base salary
Bonus opportunity
Vacation, Personal, Sick and Holiday pay
Medical, Dental, Vision, Disability, Life and AD&D insurance
401k with a company match
30% merchandise discount




Responsibilities




Develop data pipeline to provide actionable insights into business acquisition, operational efficiency, and other key business performance metrics.
Work with stakeholder's product, data, and design teams to assist with data-related technical issues and support BI and data teams operational requirements.
Assist in creating data visualization for analytics and data scientist team members.
Work with data and analytics experts to strive for greater functionality in our data systems.
Analyze and understand data footprints of our organization.
Assist development and architecture team on data quality and various POC initiatives.




Qualifications




Graduate degree in Computer Science, Statistics, Informatics, Information Systems, or another quantitative field.
At least a year experience working with enterprise technlogy.
Working SQL knowledge and experience with relational databases, query authoring (SQL).
Working knowledge building and optimizing \u2018big data' data pipelines, and data sets.
Working knowledge performing root cause analysis on internal and external data processing related issues.
Understanding processes supporting data transformation, data structures, metadata, dependency, and workload management.
At least completed one project that involves data extraction and transformation pipelines with large data sets.
Knowledge with big data tools: Hadoop, Spark, etc. Knowledge of relational SQL and NoSQL databases.
Familiar with Azure/AWS cloud services.
Knowledge of object-oriented/object function scripting languages: Python, Java, etc.
Good communication skills, and team player.
Show more"
