Job ID,Title,Company,Date,Link,Description Length,Description
3566306108,"Data Analyst, 203QE",Quartus Engineering,2023-04-28,https://www.linkedin.com/jobs/view/data-analyst-203qe-at-quartus-engineering-3566306108?refId=spwynsKckNQVzCcNsgISDQ%3D%3D&trackingId=%2BhFEKjOKI8OIXbESgy85GA%3D%3D&position=9&pageNum=0&trk=public_jobs_jserp-result_search-card,3848,"About Quartus




Quartus Engineering Incorporated (www.quartus.com) is a leading provider of engineering services and integrated hardware solutions for a wide range of clients and industries. We employ advanced computer-aided engineering tools in the areas of optics, structural, thermal, and coupled analyses. We couple our engineering analysis capabilities with design, prototype, integration and test capabilities to create solutions for our clients that are of extraordinary value.




 What will you do?




As a Data Analyst in our San Diego, CA office you will be highly involved with the design, development and administration of the data infrastructure that is used to lead Quartus Engineering’s Business Analytics initiatives. The Data Analyst will be responsible for meeting with business leaders to gather requirements, retrieve data from applicable data sources and clean/prepare data for ingestion into a data warehouse that can be used to build dashboards with BI tools such as PowerBI or Tableau. Use data to gain insights into business opportunities.




Essential Job Functions




Responsible for developing and maintaining data analytics infrastructure to support business strategic initiatives
Performs comprehensive analysis of source system data and data within the data warehouse to meet client business needs.
Build and maintain dashboards and reports with appropriate KPI’s and metrics to support business requirements
Work with ERP and other core system to manage flow of data into database for analytical reporting and forecasting
Develop plans for all stages of Business Analysis types such as descriptive, diagnostic, predictive and prescriptive
Build, manage and maintain data warehouse with appropriate tools such as SQL
Meet frequently with stakeholders to review and analyze data inconsistencies to resolve in a timely fashion

Location




Position is based in San Diego, CA with a hybrid schedule.




What are we looking for?




BS degree Computer Science, Mathematics or related field required
3+ years of experience with business analytics
Advanced knowledge with analytic tools such as SQL, Python, R, PowerBi, Tableau, Excel, etc.
Experience with creating dashboards, reports and visualizations to help business leaders better understand inefficiencies, trends and forecasting
Experience with Linux and HPC
Experience with project management
Self-motivated, goal oriented and a team player
Strong written and communication skills
Experienced leading people and groups both direct and indirect reports

Compensation and Benefits




Data Analyst pay range: $32.25/hour – $52.69/hour*




This pay range represents base pay. In addition, you may be eligible for additional benefits and compensation.




Executive Order 14042 directs Government Contractors and Subcontractors to provide COVID-19 safety protocols for all employees working on or in connection with a Federal Government contract.  These safety protocols include, among other requirements, a vaccine mandate requiring full vaccination for employees of covered federal contractors, with limited exceptions for those legally entitled to an accommodation. As a Government Contractor, we require all employees to (a) establish that they have been fully vaccinated; or (b) obtain an approved exemption as an accommodation. Any offer from the Company is contingent upon you meeting this requirement prior to starting your employment.




Quartus is an equal opportunity employer, and we are committed to employing a diverse workforce, including, but not limited to, minorities, women, individuals with disabilities, and protected veterans. Quartus provides comprehensive benefits including competitive salary, discretionary performance-based bonus, employee stock ownership plan, medical, dental, vision, and 401k plan with company match.
Show more "
3587263852,Data Analyst,Rose International,2023-04-27,https://www.linkedin.com/jobs/view/data-analyst-at-rose-international-3587263852?refId=spwynsKckNQVzCcNsgISDQ%3D%3D&trackingId=U%2ByEs94qn1oZxQ%2FttgDnKA%3D%3D&position=10&pageNum=0&trk=public_jobs_jserp-result_search-card,3574,"Position TitlePosition NumberLocation




Position Title:




Data Analyst




Position Number:




441125




Location:




USA, MO, Creve Coeur 63141 Position TypeSkills/Attributes




Position Type




Temporary




Skills/Attributes




Data Analysis, MS Excel, Statistics Estimated Duration (In Weeks)




Estimated Duration (In Weeks)




52




Apply Now




Description




**Only those lawfully authorized to work in the designated country associated with the position will be considered.**
**Please note that all Position start dates and duration are estimates and may be reduced or lengthened based upon a client’s business needs and requirements.**




Location: Creve Coeur, MO 63141




Duration: 12 months




Data Analyst




Candidates with a strong background in data/IT/analytics are highly desired for this position.




The individual will be responsible for data and pipeline management activities with enfaces around pre and post advancement set-up and support across row crops. This position is expected to interact with various functions within the company, for example, supply chain, manufacturing, biotech, and across breeding. Attention to detail, agility, and meeting deadlines on a fast pace environment are key for the success of this role. Additionally, the individual will support short-term analytical projects during non-peak seasons.




Required Skills/Experience:




BS in life sciences, data science, statistics.
Excellent Excel and relational database skills.
Ability learn fast a number of processes with consistency and attention to detail.
Commitment to ensuring data quality and accuracy and attention to detail.
Self starter and be able to work as part of a team.
Fosters a sense of urgency, identifies and overcomes obstacles.
Good interpersonal and communication skills.




Desired Skills/Experience:




Knowledge of breeding, agriculture, and/or biotechnology.
Code development experience with any of these languages: R, Python, Java, C++, SAS.
Experience with Visualization tools.
PL/SQL knowledge.
Strong Understanding of database systems and management of large data sets.
MS in an analytics field.
Imagine better solutions.




Looking for 1-3 years of experience




Benefits:

For information and details on employment benefits offered with this position, please visit here. Should you have any questions/concerns, please contact our HR Department via our secure website.

California Pay Equity:

For information and details on pay equity laws in California, please visit the State of California Department of Industrial Relations' website here.

Rose International is an Equal Opportunity Employer. All qualified applicants will receive consideration for employment without regard to race, color, religion, age, sex, sexual orientation, gender (expression or identity), national origin, arrest and conviction records, disability, veteran status or any other characteristic protected by law. Positions located in San Francisco and Los Angeles, California will be administered in accordance with their respective Fair Chance Ordinances.

If you need assistance in completing this application, or during any phase of the application, interview, hiring, or employment process, whether due to a disability or otherwise, please contact our HR Department.

Rose International has an official agreement (ID #132522), effective June 30, 2008, with the U.S. Department of Homeland Security, U.S. Citizenship and Immigration Services, Employment Verification Program (E-Verify). (Posting required by OCGA 13/10-91.).
Show more "
3590598426,CIN Data Analyst - CIN * Days - 40hrs/wk,University of Michigan Health-West,2023-04-28,https://www.linkedin.com/jobs/view/cin-data-analyst-cin-days-40hrs-wk-at-university-of-michigan-health-west-3590598426?refId=spwynsKckNQVzCcNsgISDQ%3D%3D&trackingId=k8mkpy%2FmpRYxalRQ4HI58w%3D%3D&position=11&pageNum=0&trk=public_jobs_jserp-result_search-card,3925,"Requisition #: req6689

Shift: Days

FTE status: 1

On-call: No

Weekends: No

Looking for someone with proficiency in SQL and SSRS.

General Summary

The CIN Data Analyst supports the Metro Health Integrated Network (MHIN) data strategy and operations by providing analytical and data management support to the MHIN staff and membership. This position provides support by managing the integration of internal and external data from various sources and conducts audits to ensure quality, completeness, consistency, and timeliness of data sources. As part of the analytics team, the CIN Data Analyst supports the strategies and initiatives of MHIN. This position works closely with CIN and Metro Health IT staff to initiate, monitor, and maintain open data requests to ensure requests are completed on time. This position generates standard reporting and insightful analysis relating to payer and network initiatives.

Requirements

Bachelor’s degree in business, healthcare administration or related field, or commensurate experience.
1-3 years of data analysis experience required; previous health care insurance industry strongly preferred.
Previous experience in data management including the collection, organization, and validation of multiple data sources.
Strong analytical, interpersonal and communication skills, to enable effective interaction with staff, customers, and other key stakeholders, required.
Previous experience in the design and development of reports; identifying trends, potential problems and issues to support the organizations efforts in medical management.
Strong project management skills, with ability to prioritize multiple projects in relation to the organization’s strategic objectives.
Self-motivated, creative problem solver who can work independently and collaborate through strong communication and interpersonal skills.
Excellent attention to detail with good time management skills.
Excellent knowledge and use of existing software packages. Proficient with analysis in Excel.

Essential Functions And Responsibilities

Support the organizational efforts related to low to moderately-complex data quality and analysis.
Serve as a liaison between CIN and Metro Health IT to translate operational needs into data requests and reporting specifications.
Initiate, monitor, and maintain data and reporting requests in coordination with Metro Health BI/BA department.
Integrate data from internal and external data sources or functional areas, ensures data accuracy and integrity, and updates data as needed. Develop a thorough understanding of data sources used within the department, including how the data is obtained/stored, appropriate use for the data from different information sources, complexities involved with certain types of data, and how to validate different types of data.
Manage the incoming and outgoing data from payers and external entities as necessary.
Conduct data audits to ensure quality, completeness, consistency, and timeliness of data. Identifies and addresses data quality issues with the necessary stakeholders.
Data acquisition, data analysis, report development, data monitoring, and maintenance of quality and utilization data from both internal and external sources.
Reconcile external data with CIN sources and work to resolve any discrepancies.
Generate standard weekly/quarterly/monthly reports as assigned and provide accurate, timely and insightful analysis in response to ad hoc management requests and issues.
Proactively work cross-functionally within the CIN analytic team to meet organizational objectives.
Performs other duties as assigned. These may include but are not limited to: Maintaining a current knowledge base of department processes, protocols and procedures, pursuing self-directed learning and continuing education opportunities, and participating on committees, task forces, and work groups as determined by management.
Show more "
3589726354,Data Analyst,"Tanisha Systems, Inc",2023-04-27,https://www.linkedin.com/jobs/view/data-analyst-at-tanisha-systems-inc-3589726354?refId=spwynsKckNQVzCcNsgISDQ%3D%3D&trackingId=s6gr9LCHdIyVBFddo2%2FCRg%3D%3D&position=12&pageNum=0&trk=public_jobs_jserp-result_search-card,4020,"Job Description

Role: Data Analyst

Location: Offshore

Location- Alpharetta, GA/ Menlo Park, California Onsite US

Type- Permanent

We are looking for Data SME or Tech BA

Good to Have: candidates previously worked with E*TRADE company/organization.

Must have experience in Middle office platform &T++ Application.

Candidate from any location is fine.

Looking for DATA SME who has worked previously in this space ( must not be in the past 1 year)

Who are we looking for?

A Lead Data Analyst who can Lead the Data Analyst team under customer data security, governance and compliances requirements, Analyze, Design and Develop Data Management processes.

Skills

"" Analyze functional and non-functional requirements.

"" Experience in Data Purge and Archive

"" Strong experience in Python programming and libraries especially in Panda

"" Coordinate with business to get clarification on requirement.

"" Provide Technical guidance and design documents on project needs

"" Ability to profile data and derive Data patterns / Data statistics

"" Ability to envisage test data needs based on the Business requirement

"" Strong ability in building Documentation, Project Artifacts and Proposal documents

"" Strong communication skills in both verbal and written

Behavioral Skills

"" Effective interpersonal, team building and communication skills

"" Ability to collaborate; be able to communicate clearly and concisely both to laypeople and peers, be able to follow instructions, make a team stronger for your presence and not weaker.

"" Ability to see the bigger picture and differing perspectives; to compromise, to balance competing priorities, and to prioritize the user.

"" Desire for continuous improvement, of the worthy sort; always be learning and seeking improvement, avoid change aversion and excessive conservatism, equally avoid harmful perfectionism, ""not-invented-here"" syndrome and damaging pursuit of the bleeding edge for its own sake.

"" Learn things quickly, while working outside the area of expertise.

"" Analyze a problem and realize exactly what all will be affected by even the smallest of change you make in your design

"" Ability to communicate complex technology to no tech audience in simple and precise manner.

"" Ownership skills.

Qualification

"" Any Degree from a reputed college - B.Tech, BE, BCA, MCA, M. Tech or equivalent technical degree is preferred.

"" 6-8 years experience as Data Analyst.

What s in for you?

"" At Mphasis, we promise you the perfect opportunity of building technical excellence, understand business performance and nuances, be abreast with the latest happenings in technology world and enjoy a satisfying work life balance.

"" With the current opportunity, you will get to work with the team that has consistently been setting benchmarks for other deliveries in terms of delivery high CSATs, project completion on time and being one of the best teams to work for in the organization.

"" You get an open and transparent culture along with freedom to experimentation and innovation

Who are we?

Mphasis is a leading IT solutions provider, offering Applications, Business Process Outsourcing (BPO) and Infrastructure services globally through a combination of technology knowhow, domain and process expertise. Over the years we have left an indelible impression in the IT solutions domain with an impressive clientele and an extensive global presence. The accolades we have been garnering can be attributed to our undeterred focus in delivering quality solutions across verticals that meet the challenging requirements of our esteemed customers. Our integrated solutions offering is aimed at creating value for our customers, helping them in improving their business processes with minimum hassles and capital outlays.

Thanks & Regards

Kumar Amar Kant

Account Manager, Tanisha Systems Inc

Phone : (phone number removed) (Direct)

Office: (phone number removed) EXT: 624

Email: |(url removed)

Address:99 Wood Ave South Suite # 308,Iselin, NJ 08830
Show more "
3584962254,Data Analyst,"Invictus International Consulting, LLC",2023-04-28,https://www.linkedin.com/jobs/view/data-analyst-at-invictus-international-consulting-llc-3584962254?refId=spwynsKckNQVzCcNsgISDQ%3D%3D&trackingId=iKuCDNSAQqDiNxb3JdFWdw%3D%3D&position=13&pageNum=0&trk=public_jobs_jserp-result_search-card,1730,"Job Description: Perform as a data scientist to support the practices of continuous integration, continuous delivery, and deployment through the automation of application builds and computer environments. Deliver and configure deployment environments tailored to various roles, including development, testing, and operations on actual servers and in virtualized environments, such as KVM, AWS, or VMware. Work with development teams to ensure applications can be deployed and maintained at scale using automation.

Preferred Skills

8+ years of experience with development in Java, JavaScript, C#, C++, or other high-level languages.
Experience with Cloud architecture and development, including Amazon Web Services (AWS) or Commercial Cloud Services (C2S).
Experience with build server, including Jenkins or Bamboo and infrastructure automation, including Puppet or Chef.
Experience with version control systems, including Github or Gitlab.
Experience with building applications in a compiled language.
Knowledge of basic Linux and UNIX system administration.

Additional Skills

Experience with developing in any of the popular languages to assist other developers with build automation.
Experience with a variety of build tools, including Maven, Gradle, CMake, or SBT and OS Packaging, including RPM or Deb.
Experience with implementing Secure Socket Layer (SSL) solutions.
Experience with implementing Public Key Infrastructure (PKI) solutions.
Experience with Spring Model-View-Controller (MVC), Groovy, or Grails.
Knowledge of advanced system administration.

Education requirements: BS degree in a related field preferred; MS degree in a related field a plus or equivalent experience.

Job Posted by ApplicantPro
Show more "
3584156411,Data Analyst,Murray State University,2023-04-27,https://www.linkedin.com/jobs/view/data-analyst-at-murray-state-university-3584156411?refId=spwynsKckNQVzCcNsgISDQ%3D%3D&trackingId=X3u4kyCoKOemiQtvtjtogQ%3D%3D&position=14&pageNum=0&trk=public_jobs_jserp-result_search-card,2108,"Summary Of Job Duties And Responsibilities

This position constructs complex queries used to create reports and predictive models. This job integrates data in relational databases such as Tableau, Microsoft Access and other business objects. Responsibility for federal and state reporting is inherent with substantial work for institutional surveys for internal, state and federal agencies.

Compile, coordinate, and report official institutional data to federal and state agencies as well as other internal and external constituencies.
Use statistical techniques for reports with use of algorithms and computer code for needed reports.
Routinely discusses gaps in programming specifications with supervisor, Information Systems and other offices, as appropriate.
Extract, combine, and/or compare data as needed to produce ad hoc or scheduled reports for decision support purposes.
Performs maintenance on existing reports to ensure data is available for Institutional Effectiveness for colleagues’ work responsibilities.
Collaborate and organize reports for internal and external data requests.
Coordinate enrollment, retention, graduation data and financial information necessary for performance funding projects.
Serve as the main contact and developer for completion of internal and external surveys.
Assist with work needs for the Director of Institutional Research as it relates to requests from administration, faculty and staff.
Support the work associated with IPEDS and serve in a role to assist in the IPEDS keyholder position.
Perform other duties as assigned or needed.
Employees of the Office of Institutional Effectiveness must comply with all rules and regulations per the Higher Education Act ( HEA ), as disaggregated student data may be received in order to complete Title IV reports which are required for institutional purposes. This position has a legitimate educational interest in the disclosed information, and the data must be handled with the highest level of confidentiality. All FAFSA data will be de-identified, if required for other institutional reporting purposes.
Show more "
3585976129,Data Analyst II - Remote | Hybrid,Get It Recruit - Finance,2023-04-28,https://www.linkedin.com/jobs/view/data-analyst-ii-remote-hybrid-at-get-it-recruit-finance-3585976129?refId=spwynsKckNQVzCcNsgISDQ%3D%3D&trackingId=%2BJpe%2FQZRithKBUPdBWktJw%3D%3D&position=15&pageNum=0&trk=public_jobs_jserp-result_search-card,2288,"Are you ready to be part of a team that's changing the health industry for the better? We're looking for a Data Analyst II to join us at a national healthcare organization with 26 million members. As part of our team, you'll have access to a wide range of competitive benefits, including flexible work options, paid time off, health insurance coverage, 401(k) plans, and tuition reimbursement.

As a Data Analyst II, you'll be responsible for managing complex data requests and reports, including predictive data modeling. You'll work on analyzing health management programs, including data collection, validation, and outcome measurement. This may involve analyzing financial, pharmacy, claims, provider, and member data, as well as IRS, CMS, HHSC, and HEDIS reporting. You'll also be responsible for internal data cleansing and data reconciliation analysis, trend analysis, and generating reports through MS-Excel, MS-Access, and SQL using Business Objects interface and direct links to core databases (ODS/EDW).

In addition to your analytical duties, you'll also be expected to gather and interpret business requirements, monitor data trends to proactively identify issues, execute data changes and update core systems as needed, and handle multiple projects and timelines effectively. You'll also assist with training lower level Data Analysts.

To be successful in this role, you should have a Bachelor's degree in a related field or equivalent experience, as well as 2+ years of statistical analysis or data analysis experience. You should also have advanced knowledge of Business Objects, SQL, and Microsoft Applications, including Excel and Access.

At our company, we're committed to diversity and value the ways in which we are different. We're an equal opportunity employer, and all qualified applicants will receive consideration for employment without regard to race, color, religion, sex, sexual orientation, gender identity, national origin, disability, veteran status, or other characteristic protected by applicable law.

If you're excited about this opportunity, please apply to our Data Analyst II position, located in various locations throughout Florida. We can't wait to hear from you!

Employment Type: Full-Time

Salary: $ 60,000.00 120,000.00 Per Year
Show more "
