Job ID,Title,Company,Date,Link,Description Length,Description
3586615396,Claims Data Analyst II - (Open To Remote),The General®,2023-04-27,https://www.linkedin.com/jobs/view/claims-data-analyst-ii-open-to-remote-at-the-general%C2%AE-3586615396?refId=spwynsKckNQVzCcNsgISDQ%3D%3D&trackingId=CWPLXrzzqLJuaRWHnbYoRA%3D%3D&position=25&pageNum=0&trk=public_jobs_jserp-result_search-card,4269,"This position is responsible for using tools such as SQL, GCP and Looker Studio to identify, define and employ an analytical strategy to proactively and reactively investigate business data.

Compensation Minimum:$58,900 Annual

Compensation Maximum:$88,400 Annual

Compensation may vary based on the job level and your geographic work location.

Essential Job Responsibilities

Claims Data Analyst will create, deliver, and support custom data products, as well as enhance/expand team capabilities. They will work on analyzing and manipulating large datasets supporting the enterprise by activating data driven strategy.
Creates and maintains complex spreadsheets, dashboards, and database queries. Performs trend analysis and produces various reports as determined by management.
Strategically mines claims, policy, vendor, and industry data to identify patterns and insights which could enable process improvement opportunities. Additionally, develop workflows to confirm suspicious trends as it relates to operations and organized insurance fraud.
Supports the research, analysis, and presentation of information by producing reports, compiling, and summarizing information, producing supporting documentation and exhibits, and verifying information received from external sources.
Develops, produces, and maintains custom and ad hoc reports. Analyzes information contained in reports as requested or needed. Uses various data tools to pull information and create reports.
Utilizes exception analysis to audit data, identify and trace faulty information to its source. Proactively and independently works to get information corrected.
Analyze daily, weekly, and monthly reports and presents findings to Management. Maintains compliance with Internal Audit Reporting.
Assists other associates with preparation of reports and use of information systems, software, and related sources of information. Trains other users on report preparation, report usage, and database access.
Collaborates extensively with the claims and product organizations. Comprehensively cross trains with other analysts to fully support all team functions.
Participates and leads special projects and teams.
Completes special projects as assigned by business management.
Performs other duties as assigned.


Experience/Skills Requirements

Strong experience building complex SQL queries, prior experience working in Big Query.
Experience with dashboarding and visualization tools such as Tableau and Looker Studio.
Prior experience using Alteryx or Python is a plus.
Three-Five years data analysis experience required.
Leadership/training/supervisory experience a plus.
One-two years of automobile insurance experience, non-standard insurance industry, claim processing, and/or SIU preferred.
Ability to provide oral and written communication regarding claims issues to various departments and levels of management.
Works well both independently, and within a team environment.
Ability to multi-task, meet deadlines, and works well under pressure.
Excellent verbal, written, presentation, and interpersonal skills expected.
Ability to build strong relationship across the organization required.


Education Requirements

Bachelor’s Degree in business, information systems, statistics, mathematics, economics, data science, or related field is preferred.


We provide benefits that support your physical, emotional, and financial wellbeing. You will have access to comprehensive medical, dental, vision and wellbeing benefits that enable you to take care of your health. We also offer a competitive 401(k) contribution, a pension plan, an annual incentive, 9 paid holidays and a paid time off program (23 days accrued annually for full-time employees). In addition, our student loan repayment program and paid-family leave are available to support our employees and their families. Interns and contingent workers are not eligible for American Family Insurance Group benefits.

We are an equal opportunity employer. It is our policy to comply with all applicable federal, state and local laws pertaining to non-discrimination, non-harassment and equal opportunity. We also consider qualified applicants with criminal histories, consistent with applicable federal, state and local law.
Show more "
3589638229,Data Steward Analyst Jr,Citibanamex,2023-04-27,https://mx.linkedin.com/jobs/view/data-steward-analyst-jr-at-citibanamex-3589638229?refId=9g2mwYWRE%2Bl9LSBkNzPRCQ%3D%3D&trackingId=r2fWfx3ywuWIHZbAbsc9dw%3D%3D&position=1&pageNum=1&trk=public_jobs_jserp-result_search-card,3500,"ID de trabajo 23631043 Ubicación primaria Ciudad de México, México; Categoría de Trabajo Technology

The Data Steward Analyst Jr is a developing professional role. Applies specialty area knowledge in monitoring, assessing, analyzing and/or evaluating processes and data. Identifies policy gaps and formulates policies. Interprets data and makes recommendations. Researches and interprets factual information. Identifies inconsistencies in data or results, defines business issues and formulates recommendations on policies, procedures or practices. Integrates established disciplinary knowledge within own specialty area with basic understanding of related industry practices. Good understanding of how the team interacts with others in accomplishing the objectives of the area. Develops working knowledge of industry practices and standards. Limited but direct impact on the business through the quality of the tasks/services provided. Impact of the job holder is restricted to own team.

Responsibilities

Facilitate and review data governance programs, principles, policy, practices, and standards including industry best practices with Data Governance leads and managers.
Prepare materials for Monthly Operating Reviews (MORs), Portfolio Reviews, Horizontal meetings, Town Halls and Staff Meetings.
Perform analysis of DQ issues and deliver metrics reporting.
Support Managers with status reports and presentation content. Guide data analysis and reporting processes that include collection from multiple sources, validation of data and assembly and presentation of required data.
Develop new data collection and evaluation methodologies, including format design, data compilation, relevancy and metrics.
Liaise with other Citi risk organizations to determine and maintain appropriate alignment, specifically with Citi Data Standards.
Appropriately assess risk when business decisions are made, demonstrating particular consideration for the firm's reputation and safeguarding Citigroup, its clients and assets, by driving compliance with applicable laws, rules and regulations, adhering to Policy, applying sound ethical judgment regarding personal behavior, conduct and business practices, and escalating, managing and reporting control issues with transparency.

Qualifications

1-2 years Banking or Financial Services experience
Demonstrated influencing, facilitation and partnering skills
Analytical, flexible, team-oriented and have good interpersonal/communication skills.
Passion and good skills working with Data.
Good attitude facing new challenges.

Education

Bachelor’s/University degree or equivalent experience

-------------------------------------------------

Job Family Group

Technology

-------------------------------------------------

Job Family

Data Governance

------------------------------------------------------

Time Type

Full time

------------------------------------------------------

Citi is an equal opportunity and affirmative action employer.

Qualified applicants will receive consideration without regard to their race, color, religion, sex, sexual orientation, gender identity, national origin, disability, or status as a protected veteran.

Citigroup Inc. and its subsidiaries (""Citi”) invite all qualified interested applicants to apply for career opportunities. If you are a person with a disability and need a reasonable accommodation to use our search tools and/or apply for a career opportunity review .

View the ""

View the

View the
Show more "
