Job ID,Title,Company,Date,Link,Description Length,Description
3522284035,"Data Scientist, Battery Manufacturing Engineering",Tesla,2023-04-26,https://www.linkedin.com/jobs/view/data-scientist-battery-manufacturing-engineering-at-tesla-3522284035?refId=wD7PpZHl1%2BbhaywvoIhA8A%3D%3D&trackingId=YUjrezUGKWE7RGYK3Ptm9Q%3D%3D&position=17&pageNum=0&trk=public_jobs_jserp-result_search-card,4126,"What To Expect
Tesla is looking to hire a Data Scientist to contribute to the development and deployment of specialized manufacturing processes for our cutting-edge vehicle battery products. In this position, you will have access to data playgrounds across manufacturing processes and equipment globally and the opportunity to build and implement innovative data science services, models, and tools into production use. Battery development is at the heart of our company, and this is an exciting opportunity to work directly on the central challenges with electric vehicles – battery cost and performance. Tesla is a demanding and fast-paced environment where you will work with a highly motivated team on extremely challenging projects.
What You’ll Do
Perform exploratory analyses and correlation studies on process-related inputs and outputs to facilitate the understanding of process mechanisms
Act as the owner/subject matter expert to collect and analyze data, identify process improvement opportunities, inform solution spaces, and drive the evaluation of their effectiveness
Develop and deploy sophisticated algorithms and predictive models using in-process and post-process data to improve manufacturing process monitoring/part quality prediction capability
Clearly convey results of data analyses in a way that is digestible by cross-functional stakeholders to facilitate the rapid development and deployment of solutions
Standardize the reporting architecture of key manufacturing line performance metrics (OEE, etc.) across various stations and processes
Determine what data should be collected and how on new manufacturing process and production lines
Develop frameworks and methodologies for experimental design (A/B test, RCA, GRRs, etc.)
Research and evaluate external data acquisition & processing software for process monitoring


What You’ll Bring
BS, and/or MS in quantitative fields (Statistics, Data Science, Applied Mathematics, etc.)
1+ years of experience in manipulating and analyzing complex & high-volume data from various sources
Proficiency with programming languages such as Python, R
Proficiency with relational and/or non-relational databases
Proficiency with data visualization techniques and tools using Tableau, R Shiny, Python Dash, Plotly, etc.
Strong mathematical/ statistical knowledge relevant to process control and monitoring
Experience with experimental design is a plus
Experience working with high-volume manufacturing data streams is a strong plus


Benefits

Along with competitive pay, as a full-time Tesla employee, you are eligible for the following benefits at day 1 of hire:
Aetna PPO and HSA plans > 2 medical plan options with $0 payroll deduction
Family-building, fertility, adoption and surrogacy benefits
Dental (including orthodontic coverage) and vision plans, both have options with a $0 paycheck contribution
Company Paid (Health Savings Account) HSA Contribution when enrolled in the High Deductible Aetna medical plan with HSA
Healthcare and Dependent Care Flexible Spending Accounts (FSA)
LGBTQ+ care concierge services
401(k) with employer match, Employee Stock Purchase Plans, and other financial benefits
Company paid Basic Life, AD&D, short-term and long-term disability insurance
Employee Assistance Program
Sick and Vacation time (Flex time for salary positions), and Paid Holidays
Back-up childcare and parenting support resources
Voluntary benefits to include: critical illness, hospital indemnity, accident insurance, theft & legal services, and pet insurance
Weight Loss and Tobacco Cessation Programs
Tesla Babies program
Commuter benefits
Employee discounts and perks program


Expected Compensation

$76,000 - $276,000/annual salary + cash and stock awards + benefits

Pay offered may vary depending on multiple individualized factors, including market location, job-related knowledge, skills, and experience. The total compensation package for this position may also include other elements dependent on the position offered. Details of participation in these benefit plans will be provided if an employee receives an offer of employment.
Show more "
3587948713,Software Engineer VI,Shift4,2023-04-26,https://www.linkedin.com/jobs/view/software-engineer-vi-at-shift4-3587948713?refId=wD7PpZHl1%2BbhaywvoIhA8A%3D%3D&trackingId=zykfcKkgCNrSnNdcL8h%2BCA%3D%3D&position=18&pageNum=0&trk=public_jobs_jserp-result_search-card,2889,"Overview




Shift4 (NYSE: FOUR) is boldly redefining commerce by simplifying complex payments ecosystems across the world. As the leader in commerce-enabling technology, Shift4 powers billions of transactions annually for hundreds of thousands of businesses in virtually every industry. For more information, visit www.shift4.com.




Seasoned technical engineering lead that will drive technology and delivery for a cross functional Scrum team working on a complex Cloud Native platform within a large Scaled Agile delivery group.




Responsibilities




Be a key leadership member within a high velocity engineering team.
Technology
Work hands on within the platform tech stack to deliver new features, fix issues and ensure best practices.
Lead the technical design and architecture development for parts of the solution. Ensure that best practices are defined and adhered to.
Diagnose and resolve issues with deployed systems in collaboration with DevOps and the operations groups when required (as a part of level 3 support).
Become a technical expert for parts of the platform.
Evaluate and resolve technical debt, engage in platform modernization and build reliable features.
People and Leadership
Lead a cross functional team to meet productivity and quality standards (Scrum, Scaled Agile)
Work very closely with the product team, product owners and stakeholders to understand needs and ensure alignment.
Interface across multiple engineering teams and engineering groups working on various parts of the platform.
Ensure efficient use of team members.
Mentor and develop technical skills within the team members while also contributing across multiple teams.
Process
Ensure efficient operation of Scrum within the team.
Analyze and update processes when required.
Measure key team metrics




Qualifications




Must have:
12+ years total relevant industry experience.
6+ years working with Javascript / Typescript based front-end frameworks such as React, Angular, Ember (Ember would be highly advantageous).
6+ years working with Node.
3+ years leading a team of at least 4 team members.
3+ years working in a role with responsibility over technical design and architecture.
5+ years working with Agile teams. Experience with Scaled Agile (such as SAFe) would be very advantageous.
Nice to Have:
Hands-on experience working with AWS environments (troubleshooting, monitoring, etc.)
Experience working with globally distributed teams.
Domain expertise with point of sales systems, hospitality software and/or Internet payments solutions.




We are an Equal Opportunity Employer and do not discriminate against any employee or applicant for employment because of race, color, sex, age, national origin, religion, sexual orientation, gender identity and/or expression, status as a veteran, and basis of disability or any other federal, state or local protected class.
Show more "
3588397782,Data Scientist - hybrid to atlanta,Vaco,2023-04-26,https://www.linkedin.com/jobs/view/data-scientist-hybrid-to-atlanta-at-vaco-3588397782?refId=wD7PpZHl1%2BbhaywvoIhA8A%3D%3D&trackingId=FFgNE77a9CVpTolMQEdOVw%3D%3D&position=19&pageNum=0&trk=public_jobs_jserp-result_search-card,1904,"Integrating large data sets to develop pricing data and machine learning models, build machine learning algorithms, and incorporate outcomes into various systems and tools. Analyzing the success of prior pricing actions, such as franchisee adoption and sales/margin impacts, will also be a focus for this role. Along with these key functions, this role will also be involved in providing location-level pricing guidance during brand-wide pricing implementations.
Partner with BI team to design and implement dashboards in Microsoft Power BI.
Master's degree with a related focus (preferred)
Bachelor's degree in Computer Science, Mathematics, Statistics, Engineering or other related discipline (required)
Experience with data visualization tools (e.g. Power BI)
Experience working with large data sets, distributed computing tools (e.g. GCP tensor flow, Synapse, Snowflake) and data transformation tools (e.g. Databricks, Data Factory)
Experience using analytical tools and languages, (e.g. Python, SQL, Spark SQL, etc.)
Expertise in advanced analytical techniques (e.g. descriptive statistics, machine learning, optimization, pattern recognition, cluster analysis, segmentation analysis, etc.)
Preferred: 3+ years relevant experience in a data science role related to pricing
Required: 3+ years relevant experience in a data science role
Ability to multi-task, manage tight deadlines, handle competing priorities and achieve results in a dynamic environment
Skilled in managing complex projects that require working with cross-functional teams
Strong communication and presentation skills with experience in summarizing complex information and adapting message to different audiences
Passionate about working with large sets of complex data and finding relationships to uncover insights
Strong analytical skills with a keen attention to detail and ability to recognize patterns and anomalies
Show more "
3584205804,React JS Developer,EPSoft,2023-04-26,https://www.linkedin.com/jobs/view/react-js-developer-at-epsoft-3584205804?refId=wD7PpZHl1%2BbhaywvoIhA8A%3D%3D&trackingId=Ajb6%2BpGMXiRYhqbjBn85iA%3D%3D&position=20&pageNum=0&trk=public_jobs_jserp-result_search-card,1190,"Title: React JS Developer

Location: Plano, TX (Hybrid Model/3 days Onsite in a week)

Duration: Long Term

Job Description

Requires Strong Experience in ReactJS Development.

9+ years of experience developing and deploying large-scale websites and website content or demonstrated skill level in previous positions

5+ years of experience Design and developing application in React.JS/Redux.

5+ years of experience Design and developing application in JavaScript technologies.

Skills

Experience building Responsive websites using React.JS, Node.JS and Webpack.

Experience in client-side scripting, libraries, and structures which include HTML5, CSS, JavaScript, XML and JSON

Understanding of Content Stack and Content Stack integration with React.JS

Thorough understanding of React.JS and its core principles

Experience with popular React.JS workflows (such as Flux or Redux)

Strong proficiency in JavaScript, including DOM manipulation and the JavaScript object model

Experience with common front-end development tools such as Babel, Webpack, NPM, etc.

Experience writing unit tests for JavaScript

Familiarity with RESTful Web Services, Web APIs, and Micro-Services.
Show more "
3588408303,Data Scientist,Leidos,2023-04-26,https://www.linkedin.com/jobs/view/data-scientist-at-leidos-3588408303?refId=wD7PpZHl1%2BbhaywvoIhA8A%3D%3D&trackingId=4FE7TXPAYk%2B5nJ16vEcnuw%3D%3D&position=21&pageNum=0&trk=public_jobs_jserp-result_search-card,2480,"Description

Leidos is looking for a candidate to support survey design, development, implementation, and analysis, as well as running focus groups, and briefing results to customer stakeholders. Surveys will focus on issues related to customer workforce perceptions and morale on topics such as communication, diversity and inclusion, promotion selection, and management support. This involves using customer-provided survey tools. Some surveys will be part of a continuing series that provides an ability to see trends over time.

The office provides business analytics primarily using structured datasets, but values surveys to fill in knowledge gaps that structured data does not provide. The successful candidate should be someone who is creative and independent, and is capable of managing many tasks at the same time. The candidate needs to have excellent communications skills and be capable of imparting insights orally and through written analytic products.

Primary Responsibilities

Consult with customer stakeholders to frame survey design and create responsive questions.
Create and run surveys in customer-provided applications.
Run focus groups to generate more in-depth data and analyze that data in conjunction with survey data.
Direct, manage, and mentor junior team members.
Collaborate cross-functionally with other team members, such as methodologists and database developers, to compile survey results, including through online dashboards.

Basic Qualifications

BS degree and 12 – 15 years of prior relevant experience or Masters with 10 – 13 years of prior relevant experience.
At least 8+ years of relevant work experience.
Ability to work across multidisciplinary teams.
Experience with PowerPoint, Word, and Excel.
Active TS/SCI with a polygraph

Preferred Qualifications

Experience working with MS Access, SQL Server or Oracle databases and with Tableau or Power BI dashboard software.
Experience with Intelligence Community workforce and with issues unique to that environment.

Pay Range

Pay Range $142,350.00 - $219,000.00 - $295,650.00

The Leidos pay range for this job level is a general guideline only and not a guarantee of compensation or salary. Additional factors considered in extending an offer include (but are not limited to) responsibilities of the job, education, experience, knowledge, skills, and abilities, as well as internal equity, alignment with market data, applicable bargaining agreement (if any), or other law.
Show more "
3587947819,Software Engineer VI,Shift4,2023-04-26,https://www.linkedin.com/jobs/view/software-engineer-vi-at-shift4-3587947819?refId=wD7PpZHl1%2BbhaywvoIhA8A%3D%3D&trackingId=xQgwa%2B4m5TSegyj%2BWn%2Fftw%3D%3D&position=22&pageNum=0&trk=public_jobs_jserp-result_search-card,2889,"Overview




Shift4 (NYSE: FOUR) is boldly redefining commerce by simplifying complex payments ecosystems across the world. As the leader in commerce-enabling technology, Shift4 powers billions of transactions annually for hundreds of thousands of businesses in virtually every industry. For more information, visit www.shift4.com.




Seasoned technical engineering lead that will drive technology and delivery for a cross functional Scrum team working on a complex Cloud Native platform within a large Scaled Agile delivery group.




Responsibilities




Be a key leadership member within a high velocity engineering team.
Technology
Work hands on within the platform tech stack to deliver new features, fix issues and ensure best practices.
Lead the technical design and architecture development for parts of the solution. Ensure that best practices are defined and adhered to.
Diagnose and resolve issues with deployed systems in collaboration with DevOps and the operations groups when required (as a part of level 3 support).
Become a technical expert for parts of the platform.
Evaluate and resolve technical debt, engage in platform modernization and build reliable features.
People and Leadership
Lead a cross functional team to meet productivity and quality standards (Scrum, Scaled Agile)
Work very closely with the product team, product owners and stakeholders to understand needs and ensure alignment.
Interface across multiple engineering teams and engineering groups working on various parts of the platform.
Ensure efficient use of team members.
Mentor and develop technical skills within the team members while also contributing across multiple teams.
Process
Ensure efficient operation of Scrum within the team.
Analyze and update processes when required.
Measure key team metrics




Qualifications




Must have:
12+ years total relevant industry experience.
6+ years working with Javascript / Typescript based front-end frameworks such as React, Angular, Ember (Ember would be highly advantageous).
6+ years working with Node.
3+ years leading a team of at least 4 team members.
3+ years working in a role with responsibility over technical design and architecture.
5+ years working with Agile teams. Experience with Scaled Agile (such as SAFe) would be very advantageous.
Nice to Have:
Hands-on experience working with AWS environments (troubleshooting, monitoring, etc.)
Experience working with globally distributed teams.
Domain expertise with point of sales systems, hospitality software and/or Internet payments solutions.




We are an Equal Opportunity Employer and do not discriminate against any employee or applicant for employment because of race, color, sex, age, national origin, religion, sexual orientation, gender identity and/or expression, status as a veteran, and basis of disability or any other federal, state or local protected class.
Show more "
3587947818,Software Engineer VI,Shift4,2023-04-26,https://www.linkedin.com/jobs/view/software-engineer-vi-at-shift4-3587947818?refId=wD7PpZHl1%2BbhaywvoIhA8A%3D%3D&trackingId=BK3EGyhItMQjjqc9IlovbA%3D%3D&position=23&pageNum=0&trk=public_jobs_jserp-result_search-card,2889,"Overview




Shift4 (NYSE: FOUR) is boldly redefining commerce by simplifying complex payments ecosystems across the world. As the leader in commerce-enabling technology, Shift4 powers billions of transactions annually for hundreds of thousands of businesses in virtually every industry. For more information, visit www.shift4.com.




Seasoned technical engineering lead that will drive technology and delivery for a cross functional Scrum team working on a complex Cloud Native platform within a large Scaled Agile delivery group.




Responsibilities




Be a key leadership member within a high velocity engineering team.
Technology
Work hands on within the platform tech stack to deliver new features, fix issues and ensure best practices.
Lead the technical design and architecture development for parts of the solution. Ensure that best practices are defined and adhered to.
Diagnose and resolve issues with deployed systems in collaboration with DevOps and the operations groups when required (as a part of level 3 support).
Become a technical expert for parts of the platform.
Evaluate and resolve technical debt, engage in platform modernization and build reliable features.
People and Leadership
Lead a cross functional team to meet productivity and quality standards (Scrum, Scaled Agile)
Work very closely with the product team, product owners and stakeholders to understand needs and ensure alignment.
Interface across multiple engineering teams and engineering groups working on various parts of the platform.
Ensure efficient use of team members.
Mentor and develop technical skills within the team members while also contributing across multiple teams.
Process
Ensure efficient operation of Scrum within the team.
Analyze and update processes when required.
Measure key team metrics




Qualifications




Must have:
12+ years total relevant industry experience.
6+ years working with Javascript / Typescript based front-end frameworks such as React, Angular, Ember (Ember would be highly advantageous).
6+ years working with Node.
3+ years leading a team of at least 4 team members.
3+ years working in a role with responsibility over technical design and architecture.
5+ years working with Agile teams. Experience with Scaled Agile (such as SAFe) would be very advantageous.
Nice to Have:
Hands-on experience working with AWS environments (troubleshooting, monitoring, etc.)
Experience working with globally distributed teams.
Domain expertise with point of sales systems, hospitality software and/or Internet payments solutions.




We are an Equal Opportunity Employer and do not discriminate against any employee or applicant for employment because of race, color, sex, age, national origin, religion, sexual orientation, gender identity and/or expression, status as a veteran, and basis of disability or any other federal, state or local protected class.
Show more "
3587948718,Software Engineer VI,Shift4,2023-04-26,https://www.linkedin.com/jobs/view/software-engineer-vi-at-shift4-3587948718?refId=wD7PpZHl1%2BbhaywvoIhA8A%3D%3D&trackingId=caJJ8rrNtxpOf27R%2FFfe%2Fg%3D%3D&position=24&pageNum=0&trk=public_jobs_jserp-result_search-card,2889,"Overview




Shift4 (NYSE: FOUR) is boldly redefining commerce by simplifying complex payments ecosystems across the world. As the leader in commerce-enabling technology, Shift4 powers billions of transactions annually for hundreds of thousands of businesses in virtually every industry. For more information, visit www.shift4.com.




Seasoned technical engineering lead that will drive technology and delivery for a cross functional Scrum team working on a complex Cloud Native platform within a large Scaled Agile delivery group.




Responsibilities




Be a key leadership member within a high velocity engineering team.
Technology
Work hands on within the platform tech stack to deliver new features, fix issues and ensure best practices.
Lead the technical design and architecture development for parts of the solution. Ensure that best practices are defined and adhered to.
Diagnose and resolve issues with deployed systems in collaboration with DevOps and the operations groups when required (as a part of level 3 support).
Become a technical expert for parts of the platform.
Evaluate and resolve technical debt, engage in platform modernization and build reliable features.
People and Leadership
Lead a cross functional team to meet productivity and quality standards (Scrum, Scaled Agile)
Work very closely with the product team, product owners and stakeholders to understand needs and ensure alignment.
Interface across multiple engineering teams and engineering groups working on various parts of the platform.
Ensure efficient use of team members.
Mentor and develop technical skills within the team members while also contributing across multiple teams.
Process
Ensure efficient operation of Scrum within the team.
Analyze and update processes when required.
Measure key team metrics




Qualifications




Must have:
12+ years total relevant industry experience.
6+ years working with Javascript / Typescript based front-end frameworks such as React, Angular, Ember (Ember would be highly advantageous).
6+ years working with Node.
3+ years leading a team of at least 4 team members.
3+ years working in a role with responsibility over technical design and architecture.
5+ years working with Agile teams. Experience with Scaled Agile (such as SAFe) would be very advantageous.
Nice to Have:
Hands-on experience working with AWS environments (troubleshooting, monitoring, etc.)
Experience working with globally distributed teams.
Domain expertise with point of sales systems, hospitality software and/or Internet payments solutions.




We are an Equal Opportunity Employer and do not discriminate against any employee or applicant for employment because of race, color, sex, age, national origin, religion, sexual orientation, gender identity and/or expression, status as a veteran, and basis of disability or any other federal, state or local protected class.
Show more "
