Job ID,Title,Company,Date,Link,Description Length,Description
3584230173,Artificial Intelligence Engineer,Spatial Labs,2023-04-26,https://www.linkedin.com/jobs/view/artificial-intelligence-engineer-at-spatial-labs-3584230173?refId=wD7PpZHl1%2BbhaywvoIhA8A%3D%3D&trackingId=VSCfr7Vop2rpVneyMWAOBA%3D%3D&position=25&pageNum=0&trk=public_jobs_jserp-result_search-card,2930,"About the Job

Spatial Labs makes the hardware+software that powers the Web3 economy. We build ecosystems with real-world value and utility, making blockchain and the metaverse accessible and usable for the masses.




We have raised $14m in seed funding from notable VCs such as JAY-Z from Marcy Ventures, Blockchain Capital, and more. Link to raise details.




Spatial Labs currently powers infrastructure for brands such as Tidal, Pantone, IKEA, CROCS, ALES GREY, and more.




Spatial Labs is seeking an experienced Artificial Intelligence (AI) Engineer with a focus on wearable products to join the Spatial Labs team. The AI Engineer will be responsible for designing, developing, and implementing AI algorithms and models for wearable products. The ideal candidate should have a strong background in machine learning, deep learning, computer vision, and data analysis, as well as experience in developing and deploying AI models on wearables.


Responsibilities

Design, develop, and implement AI algorithms and models for wearable products.
Develop and optimize machine learning and deep learning models for wearable products.
Implement computer vision algorithms on wearable devices to improve user experience.
Analyze and interpret large data sets from wearable devices to derive meaningful insights.
Work closely with the software development team to integrate AI models into wearable products.
Collaborate with cross-functional teams, including hardware engineers, product managers, and designers, to deliver high-quality wearable products.
Stay up-to-date with the latest research and advancements in AI, machine learning, and wearable technology.


Experience and Qualifications

Qualifications:

Bachelor’s or Master’s degree in Computer Science, Electrical Engineering, or a related field.
3+ years of experience in AI, machine learning, and deep learning.
Strong programming skills in Python, C++, and/or Java.
Experience with popular machine learning and deep learning frameworks such as GPT , TensorFlow, Keras, PyTorch, and Scikit-learn.
Experience with computer vision and image processing algorithms.
Knowledge of wearable technology and its design principles.
Ability to analyze and interpret large data sets.
Strong problem-solving skills and ability to work independently or in a team environment.
Excellent communication and interpersonal skills.

Preferred:

Experience with developing and deploying AI models on wearable products.
Knowledge of signal processing and sensor fusion techniques for wearable products.
Familiarity with embedded systems and microcontrollers.
Experience with mobile app development.




If you are a self-starter who is passionate about using AI to develop innovative wearable products and are looking for an exciting new opportunity, we encourage you to apply. We offer a competitive salary, flexible work hours, and a dynamic and collaborative work environment.

Show more "
