Job ID,Title,Company,Date,Link,Description Length,Description
3583477207,Software Engineer,Apexon,2023-04-26,https://www.linkedin.com/jobs/view/software-engineer-at-apexon-3583477207?refId=wD7PpZHl1%2BbhaywvoIhA8A%3D%3D&trackingId=GLqkEL55TYa7KrvzNHRu5w%3D%3D&position=9&pageNum=0&trk=public_jobs_jserp-result_search-card,2126,"Description




Company Description:




Apexon is a digital-first technology services firm backed by Goldman Sachs Asset Management and Everstone Capital. We specialize in accelerating business transformation and delivering human-centric digital experiences. For over 17 years, Apexon has been meeting customers wherever they are in the digital lifecycle and helping them outperform their competition through speed and innovation.




Responsibilities And Qualifications




Manage multiple tasks and use sound judgment when prioritizing.
Collaborate with global cross functional teams in building customer-centric products.
Analyze existing software implementations to identify areas of improvement and provide deadline estimates for implementing new features.
Update and maintain documentation for team processes, best practices and software runbooks.
Establish trusted partnerships with peers, product heads, and executive level stakeholders.
Must be passionate about technology and engineering.
Exceptional analytical skills and ability to apply knowledge and experience in decision-making.
Ability to leverage technology to deliver business value.
Must be independent and comfortable in a fast paced, ambiguous and often multi-directional work environment.




Skills And Experience We Are Looking For




Minimum 5 years of relevant professional experience using a modern programming language (preferably Java/Scala).
Experience with Databases (SQL or no-SQL)
B.S. or higher in Computer Science (or equivalent work experience).
Strong analytical skills.
Experience leveraging test-driven development methodologies.
Comfort with Agile operating models (practical experience of Scrum/Kanban)
Team oriented; strong interpersonal and communication skills.
Energetic, self-directed, and self-motivated




Disclaimer




If you feel that this is a good match for your skillsets, please submit a current word version of your resume along with a cover letter describing your skills, experience and salary expectations. We are an Equal Opportunity Employer (EOE). You can read our job applicant privacy policy here .
Show more "
3584213439,Full Stack Developers (Front End),CloudQ,2023-04-26,https://www.linkedin.com/jobs/view/full-stack-developers-front-end-at-cloudq-3584213439?refId=wD7PpZHl1%2BbhaywvoIhA8A%3D%3D&trackingId=Jl3CcrqP7H5joxqY5fQ9jg%3D%3D&position=10&pageNum=0&trk=public_jobs_jserp-result_search-card,1133,"The Information Technology Software Engineer oversees the application development, modification, and maintenance of applications. This position monitors system applications, ensures systems run smoothly, and creates reports and other documentation outlining findings/solutions.

Primary Responsibilities

Oversees development and installation of new hardware and software
Installs and configures systems and other software
Tests installed software for malfunction detection
Identifies and resolves business systems issues
Designs and deploys new applications and enhancements to existing applications, software, and operation systems
Measures effectiveness and efficiency of existing systems
Develops and implement strategies to improve systems
Monitors and tests system performance
Typically has full ownership of a process
May act as a procedural expert
May lead the work of junior-level associates

Requirements

Bachelor's degree in a related field
Five (5) years of experience

Looking for Full Stack Developers however focusing more on Front End.

React/Knockout/Bootstrap, etc.
.NET/MVC
SQL Server
Azure or AWS-plus
Show more "
3582155240,Developer,PotomacWave,2023-04-26,https://www.linkedin.com/jobs/view/developer-at-potomacwave-3582155240?refId=wD7PpZHl1%2BbhaywvoIhA8A%3D%3D&trackingId=JnBj1Za%2FYoziFxn4OwLs%2Bg%3D%3D&position=11&pageNum=0&trk=public_jobs_jserp-result_search-card,2221,"PotomacWave Consulting is looking for a Developer to join our FedDataCheck team located in Arlington, VA.



Our FedDataCheck product is in use by 17 Federal Agencies. For 10 years FedDataCheck has helped ensure that federal contracts adhere to all applicable regulations and has assisted in vetting vendors to ensure that they are meeting their responsibilities such as tax compliance and past job performance. More athttps://www.feddatacheck.com.



This position involves developing and administering the FedDataCheck product using the advanced capabilities of Amazon Web Services, Microsoft SQL Server, and Visual Studio. The ideal candidate should be highly motivated to learn new technologies and have strong logical reasoning and problem-solving skills. In this position, the candidate will investigate programmatic and data errors, create new reports, work with SQL Server to improve the FedDataCheck product, and optimize how to show the data in a way that communicates important information to the client.



Responsibilities:



Amazon Web Services administration to include setting up servers in a test environment, role based and group-based security, and storage device setup and connectivity
Implement approved design and functional changes to the Microsoft SQL Server Reporting Services (SSRS), and associated tools used for customer facing interfaces
Apply standardized color, formatting, and logos to all SSRS reports
Run various SQL Server Integration Services (SSIS) tools for ETL loads
Setup and troubleshoot SQL Server connectivity issues
Develop business solution logic using T-SQL or similar query/scripting languages to execute on the reporting and data validation needs
Manage and troubleshoot email failures by correcting the user library
Conduct testing of reports for data accuracy
Other duties as assigned

Qualifications:



Bachelors degree in math, science, computer science, information systems, or similar degree
Familiarity with programming languages
Structured Query Language (SQL) programming is a strong plus
A strong desire to learn new technologies
Ability to work on a team and independently
Must have strong communication skills
Ability to problem solve a strong plus
Show more "
3588409277,Data Scientist,Leidos,2023-04-26,https://www.linkedin.com/jobs/view/data-scientist-at-leidos-3588409277?refId=wD7PpZHl1%2BbhaywvoIhA8A%3D%3D&trackingId=oRrHraoZYYH57e504Fhb%2BQ%3D%3D&position=12&pageNum=0&trk=public_jobs_jserp-result_search-card,2434,"Description

Leidos is looking for a candidate to support survey design, development, implementation, and analysis, as well as running focus groups, and briefing results to customer stakeholders. Surveys will focus on issues related to customer workforce perceptions and morale on topics such as communication, diversity and inclusion, promotion selection, and management support. This involves using customer-provided survey tools. Some surveys will be part of a continuing series that provides an ability to see trends over time.

The office provides business analytics primarily using structured datasets, but values surveys to fill in knowledge gaps that structured data does not provide. The successful candidate should be someone who is creative and independent, and is capable of managing many tasks at the same time. The candidate needs to have excellent communications skills and be capable of imparting insights orally and through written analytic products.

Primary Responsibilities

Consult with customer stakeholders to frame survey design and create responsive questions.
Create and run surveys in customer-provided applications.
Run focus groups to generate more in-depth data and analyze that data in conjunction with survey data.
Direct, manage, and mentor junior team members.
Collaborate cross-functionally with other team members, such as methodologists and database developers, to compile survey results, including through online dashboards.

Basic Qualifications

Masters with 15 – 20 years of prior relevant experience or Doctorate with 13 – 16 years of prior relevant experience.
Ability to work across multidisciplinary teams.
Experience with PowerPoint, Word, and Excel.
Active TS/SCI with a polygraph

Preferred Qualifications

Experience working with MS Access, SQL Server or Oracle databases and with Tableau or Power BI dashboard software.
Experience with Intelligence Community workforce and with issues unique to that environment.

Pay Range

Pay Range $142,350.00 - $219,000.00 - $295,650.00

The Leidos pay range for this job level is a general guideline only and not a guarantee of compensation or salary. Additional factors considered in extending an offer include (but are not limited to) responsibilities of the job, education, experience, knowledge, skills, and abilities, as well as internal equity, alignment with market data, applicable bargaining agreement (if any), or other law.
Show more "
3587938692,Web Developer,Techverx,2023-04-26,https://www.linkedin.com/jobs/view/web-developer-at-techverx-3587938692?refId=wD7PpZHl1%2BbhaywvoIhA8A%3D%3D&trackingId=ja5AfDnS%2BA0XAGqvcPX8bw%3D%3D&position=13&pageNum=0&trk=public_jobs_jserp-result_search-card,2800,"Techverx hires on the basis of skills, we need people who can be efficient, vigilant and on top of their game.

At Techverx, we provide our employees with a friendly yet professional environment where they’re encouraged to talk about any new tech oriented ideas they might have. We believe that a happy employee can work better. That's why we provide them with a safe space where they can comfortably work with a fresh mind. Our state-of-the-art facility includes well designed workstations, latest equipment, in-house kitchen for healthier eating, common and entertainment areas. This gives us a status of a preferred employer with manageable retention issues.

We are looking for an outstanding Web Developer to be responsible for the coding, innovative design and layout of our website. Web developer responsibilities include building our website from concept all the way to completion from the bottom up, fashioning everything from the home page to site layout and function.

Responsibilities

Write well designed, testable, efficient code by using best software development practices
Create website layout/user interface by using standard HTML/CSS practices
Integrate data from various back-end services and databases
Gather and refine specifications and requirements based on technical needs
Create and maintain software documentation
Be responsible for maintaining, expanding, and scaling our site
Stay plugged into emerging technologies/industry trends and apply them into operations and activities
Cooperate with web designers to match visual design intent

Requirements And Skills

Proven working experience in web programming
Top-notch programming skills and in-depth knowledge of modern HTML/CSS
Familiarity with at least one of the following programming languages: PHP, ASP.NET, Javascript or Ruby on Rails
A solid understanding of how web applications work including security, session management, and best development practices
Adequate knowledge of relational database systems, Object Oriented Programming and web application development
Hands-on experience with network diagnostics, network analytics tools
Basic knowledge of Search Engine Optimization process
Aggressive problem diagnosis and creative problem solving skills
Strong organizational skills to juggle multiple tasks within the constraints of timelines and budgets with business acumen
Ability to work and thrive in a fast-paced environment, learn rapidly and master diverse web technologies and techniques.
BS in computer science or a related field

Benefits

Health Care Plan (Medical, Dental & Vision)
Life Insurance (Basic, Voluntary & AD&D)
Paid Time Off (Vacation, Sick & Public Holidays)
Short Term & Long Term Disability
Training & Development
Work From Home
Stock Option Plan

Salary $79,000 - $86,000
Show more "
3588368135,Data and ML Engineer,TechDoQuest,2023-04-26,https://www.linkedin.com/jobs/view/data-and-ml-engineer-at-techdoquest-3588368135?refId=wD7PpZHl1%2BbhaywvoIhA8A%3D%3D&trackingId=LlmvvQLmOmyVIPl2wh3GRw%3D%3D&position=14&pageNum=0&trk=public_jobs_jserp-result_search-card,2426,"Data and ML Engineer-United States




**Candidates who have work authorization GC and Citizens can apply for this position ***




Job Description

AWS Certification is Mandatory

·        Work with our customers and focus on our AWS Analytics and ML service offerings such Amazon Kinesis, AWS Glue, Amazon Redshift, Amazon EMR, Amazon Athena, Amazon Sagemaker and more. Help our customers to remove the constraints that prevent them from leveraging their data to develop business insights

·        Engage in a wide variety of projects for customers, providing collective experience from across the AWS customer base and are obsessed about customer success

o  Experience with analytic solutions applied to the Marketing or Risk needs of enterprises

o  Basic understanding of machine learning fundamentals

o  Ability to take Machine Learning models and implement them as part of data pipeline

o  5+ years of IT platform implementation experience

o  Experience with one or more relevant tools ( Flink, Spark, Sqoop, Flume, Kafka, Amazon Kinesis)

o  Experience developing software code in one or more programming languages (Java, JavaScript, Python, etc)

o  Current hands-on implementation experience required

o  Experience with design, development and operations that leverages deep knowledge in the use of services like Amazon Kinesis, Apache Kafka, Apache Spark, Amazon Sagemaker, Amazon EMR, NoSQL technologies and other 3rd parties

o  Develop and define key business questions and to build data sets that answer those questions""

·         Bachelor’s degree, or equivalent experience, in Computer Science, Engineering, Mathematics or a related field

o  5+ years’ experience of Data platform implementation, including 3+ years of hands-on experience in implementation and performance tuning Kinesis/Kafka/Spark/Storm implementations

o  One (1) AWS Certification(s) at the associate, professional or specialty certification offered by Amazon Web Services and 1 AWS certification in-progress with expected completion on 1 month.""




**Candidates who have work authorization GC and Citizens can apply for this position ***







**Must have Experience

1.Experience in one or more relevant tools - Flink,Spark,Sqoop,Flume: ?

2.Experience in Machine Learning : ?

3.Experience in developing software code in one or more programming languages (Java, JavaScript, Python, etc):?

4.Certification in AWS:?

Show more "
3587923949,Software Engineer I,UiPath,2023-04-26,https://www.linkedin.com/jobs/view/software-engineer-i-at-uipath-3587923949?refId=wD7PpZHl1%2BbhaywvoIhA8A%3D%3D&trackingId=VIP72EKBdxx84goMf%2FYTbg%3D%3D&position=15&pageNum=0&trk=public_jobs_jserp-result_search-card,6003,"Your Mission




We see boundless potential in the way we live. It drives the way we work. Our culture is our most valuable asset. It acts like a compass for us. We are fast, immersed, humble and bold. And that’s not just words on the walls.




Eliminating time-consuming tasks means people get to do more of what they love. It’s an inspiring, high stakes challenge that motivates us, and this common passion bonds UiPath employees globally. We all strive every day to be better and to accelerate human achievement.




We make software robots, so people don’t have to be robots. Would you like to be part of this journey?




Identity is at the core of the security architecture of any enterprise. To onboard any organization to a SaaS offering, a SaaS solution needs to onboard the users in the organization to use its service is an easy, seamless manner while being compliant and secure. We, at UiPath identity service team, are hiring a SWE to join us on this mission. Our charter is to allow our customers to bring and manage any user with their existing identities (enterprise or consumer) to use UiPath on cloud or on-prem using whatever protocols their existing identity systems use, like OAuth and OpenID Connect, SAML or with on-prem identity systems like AD and ADFS and securely manage user sessions across UiPath services.




We are also the platform service that other UiPath services use to authenticate and authorize users, robots, applications and other internal services and provide critical security features like least privilege, blast radius reduction, offline access and delegation.




If you are looking to work in a fast paced environment, on high scale services servicing millions of requests per day, secure by design, iterating fast, learning and growing quickly as a result, passionate about delivering features that architecturally take our service to the next level in terms of scalability, security and performance, and to expand platform capabilities to newer revenue generating scenarios for our services, we are looking for you!




What You'll Do At UiPath




Our mission is to build a platform for scale and is also easy to consume for our customers. Quality is baked into our DNA and we believe in being agile and gritty.




As a SWE in the platform team, you will




Design and engineer significant areas of the cloud platform to deliver end to end business outcomes.
Ensure UiPath online services are highly available, participate in livesite monitoring rotations, handle escalations, driving effective mitigations, and making continuous improvements to our livesite process.
Ensure our technical deliverables meet or exceed the expectations on reliability, scalability, quality and performance.
Adhere to and influence our best practices across the engineering organization
Ensure UiPath online services are highly available, participate in livesite monitoring rotations, handle escalations, driving effective mitigations, aggressively reducing its live site impact to customers with broad, detailed and effective post mortems.
Participate in task planning, estimation, scheduling




What You'll Bring To The Team




Proficiency in one or more object-oriented languages (such as C#/C++/Java) backed by solid computer science fundamentals
Familiar with modern engineering practices, including agile development, CI/CD and devops. Ability to work with globally distributed teams.
Experience with developing microservice-based HTTP applications and servers
Good grasp of multithreading, synchronization, asynchronous, cloud programming.
Deep understanding of data structures & algorithms.
Experience with service-oriented architecture and web services development.
Experience in using database backends (e.g. Azure SQL, CosmosDB, Azure Datalake, PowerBI, MangoDB, MSQL, or DynamoDB, etc.)
Experience working with or managing production Kubernetes infrastructure is a plus
Experience working with cloud providers like Azure, AWS, Google Cloud, etc. and cloud services such as AKS, GKE, etc. is a plus
Experience working with identity systems (Okta, AAD, Windows AD) and identity protocols (OAuth, OIDC, SAML) is a plus




Pay Transparency




The anticipated base salary range for this position is between $108,000 and $162,000. Base salary ranges may vary by geographic location and relevant experience, education, certifications, and seniority as compared to others doing substantially similar work. There is no guarantee an offer will be at the top of the posted range based on the salary analysis.




Legal Disclosure




At UiPath, we value a range of diverse backgrounds experiences and ideas. We pride ourselves on our diversity and inclusive workplace that provides equal opportunities to all persons regardless of age, race, color, religion, sex, sexual orientation, gender identity and expression, national origin, disability, military and/or veteran status, or any other protected classes.




UiPath is committed to working with and providing reasonable accommodation to individuals with disabilities. If you have a medical condition or disability which inhibits your ability to complete any part of the application process, and are in need of a reasonable accommodation to complete the process, please contact us @ talentacquisition@uipath.com and let us know how we may assist you.




This notice together with our Privacy Policy and Terms of Use of this website and any other documents we mention here are meant to inform you on what personal data about you we collect, use, disclose, share or otherwise process when you are applying for a job at UiPath or when UiPath contacts you for recruitment purposes. Please read this policy carefully to understand our views and practices on how we protect your personal data.




All applicants from United States have rights under Federal Employment Laws, including Family and Medical Leave Act (FMLA), Equal Employment Opportunity (EEO) and Employee Polygraph Protection Act (EPPA).




Show more "
3587955664,Junior Software Engineer,DataBP,2023-04-26,https://www.linkedin.com/jobs/view/junior-software-engineer-at-databp-3587955664?refId=wD7PpZHl1%2BbhaywvoIhA8A%3D%3D&trackingId=2ct0dPsKyrEAl7cq6Q4s%2Bw%3D%3D&position=16&pageNum=0&trk=public_jobs_jserp-result_search-card,3096,"DataBP is looking for a skilled Software Engineer to join our team and create dynamic, high-performance web applications using modern development frameworks like React, Vue.js, and similar tools. We value candidates who possess a flexible mindset and are committed to mastering new technologies to solve problems and deliver outstanding value to our customers. If you're eager to join a thriving FinTech company from its inception, we encourage you to apply for the Software Engineer position today. 

 

As part of our team, you will contribute to the growth of a thriving SaaS company that serves leading financial institutions and exchanges worldwide. We offer a competitive compensation package, ample vacation days, and the added benefit of remote work. Join us today and be part of a team that's making a difference in the financial technology industry. 

 

Responsibilities: 

Develop single-page applications and REST APIs that streamline business process administration for financial companies. 
Deliver pragmatic software solutions that quickly deliver features without sacrificing quality. 
Share new ideas and best practices by providing information architecture skills to prototype new technology concepts and features. 
Assist in maintaining both legacy and current systems, as well as supporting the migration process to modern technology stacks. 

 

Qualifications: 

Strong understanding of JavaScript, HTML, and CSS. 
At least one year of experience working with Vue.js or similar frameworks. 
Experience building lightweight web applications that consume external REST APIs services. 
Familiarity with common development tools such as Git, Webpack, Gulp, SASS, and Yarn/NPM. 
Solid understanding of automated unit, integration, and functional test suites. 
Strong desire to learn, push the envelope, and share knowledge with other engineers across the world. 
Bachelor's Degree in Computer Science/Engineering or 3+ years of relevant experience. 
Passionate about customer focus with the ability to drive system improvements. 

 

Bonus Qualifications: 

Experience with Agile/Scrum methodologies. 
Proficiency with SQL databases, C# or other server-side technologies. 
Strong interpersonal, communication, self-management, and organizational skills. 

 

The wage range for this role takes into account the wide range of factors that are considered in making compensation decisions including but not limited to skill sets; experience and training; licensure and certifications; and other business and organizational needs. It is not typical for an individual to be hired at or near the top of the range for their role and compensation decisions are dependent on the facts and circumstances of each case. A reasonable estimate of the current range is $75,000-$90,000.




You may also be eligible to participate in a discretionary annual incentive program, subject to the rules governing the program, whereby an award, if any, depends on various factors, including, without limitation, individual and organizational performance.




(Unable to sponsor H1B Visas).

Show more "
